"Date","DiscussionId","PageId","QuoteAuthor","QuoteId","QuoteText","ResponseAuthor","ResponseId","ResponseText","Subtopic","Time","Topic","postCounter"
"01-23-2008","10685",12,"jitobear","298406","On the grounds that you won't being doing a thing to support said child for the better part of a year. Its, frankly, not your health, ability to work, body, and potentially even life that is on the line. I would hope that women in a healthy relationship review options with their partner so they can make a decision together - and I suspect most in that situation do. You see, I keep waiting to see this huge wave of fathers whose evil sex partners are out having abortions against their wishes (snicker). More often than not, that woman is on her own, and that very fact is likely impacting her decision. In any case - when are you gonna quite acting like you actually care? Like you actually want to work on resolutions? All you do is pass judgement. I actually do not support this. I don't believe anyone should be forced into parenting. Babies should be able to be adopted and either parent should be able to sign away their parental rights (to the other parent). (Decision to be made by the time said child is born.) In any case - I actually support measures to reduce unwanted pregnancy and abortion. (Education, access to birth control and health care, assisting pregnant woman (with more than their pregnancies), changing the way we women regard men, and getting rid of unhealthy, puritanical hang-ups about sex). ALL the evidence tells us that criminalization, trivialization, generalization and ""just say no"" don't help.","Archangel","298440","But it's my baby as much as it's hers jito, if we had the relationship that produced it. And we aren't speaking about some impersonal commodity here but are speaking about a human being. How dare you minimize me as the other half of that child's DNA makeup and family. The problem is that they aren't required to respect their partners wishes. The fact that the woman is the incubator seems to trump all common sense and decency. Yet you will fight to defend a woman's absolute right to act as selfishly and morally irresponsible as they want. Even when that selfishness and irresponsibility leads to the death of 1.2 million+ innocent babies per year. Why don't you want to hold those women responsible for their actions, but you will hold their unborn children responsible for the woman's irresponsible acts? And if I didn't care jito, I wouldn't be discussing this with you. It wouldn't matter to me that so many innocents are dying unchecked in America each day. I submit to you that it's you who don't care as you so easily disregard the loss of innocent life while defending the murders committed by so many selfish and uncaring women who treat their own progeny like so much throwaway excess baggage. You have a nice imagination, but now show me one woman's group with clout that would support your plan. The reality is that women's groups would fight your plan at all cost and like holding all of the cards very much and have no intention of ever being fair or even handed with men. In all of this paragraph, as I read it, what popped out at me is your desire to, and I quote: and getting rid of unhealthy, puritanical hang-ups about sex. Go back to the fifty's jito, when modesty still existed, how many unwanted pregnancies occurred in America each year? I remember being a teenager and actually being embarrassed when I saw a woman's cleavage. Women used to cover their bodies when they left their homes and only street walkers dressed in super tight clothing that accentuated every curve and feature of their form. Today, it is the norm. It is another example of women having it both ways again. They can flaunt themselves and seduce men with their bodies, but then when they get pregnant they can either throw the child away, or if the man has deep pockets they can keep the baby and use it as a meal ticket to hijack a man monetarily. So my point is that if you really support measures to reduce unwanted pregnancies, then don't forsake that which used to work. MODESTY AND SELF RESPECT OF ONES BODY AND SEXUAL OPENNESS.","abortion-self-defense","04:00 PM","abortion-debates","173"
"01-23-2008","10685",12,"Archangel","298440","But it's my baby as much as it's hers jito, if we had the relationship that produced it. And we aren't speaking about some impersonal commodity here but are speaking about a human being. How dare you minimize me as the other half of that child's DNA makeup and family. The problem is that they aren't required to respect their partners wishes. The fact that the woman is the incubator seems to trump all common sense and decency. Yet you will fight to defend a woman's absolute right to act as selfishly and morally irresponsible as they want. Even when that selfishness and irresponsibility leads to the death of 1.2 million+ innocent babies per year. Why don't you want to hold those women responsible for their actions, but you will hold their unborn children responsible for the woman's irresponsible acts? And if I didn't care jito, I wouldn't be discussing this with you. It wouldn't matter to me that so many innocents are dying unchecked in America each day. I submit to you that it's you who don't care as you so easily disregard the loss of innocent life while defending the murders committed by so many selfish and uncaring women who treat their own progeny like so much throwaway excess baggage. You have a nice imagination, but now show me one woman's group with clout that would support your plan. The reality is that women's groups would fight your plan at all cost and like holding all of the cards very much and have no intention of ever being fair or even handed with men. In all of this paragraph, as I read it, what popped out at me is your desire to, and I quote: and getting rid of unhealthy, puritanical hang-ups about sex. Go back to the fifty's jito, when modesty still existed, how many unwanted pregnancies occurred in America each year? I remember being a teenager and actually being embarrassed when I saw a woman's cleavage. Women used to cover their bodies when they left their homes and only street walkers dressed in super tight clothing that accentuated every curve and feature of their form. Today, it is the norm. It is another example of women having it both ways again. They can flaunt themselves and seduce men with their bodies, but then when they get pregnant they can either throw the child away, or if the man has deep pockets they can keep the baby and use it as a meal ticket to hijack a man monetarily. So my point is that if you really support measures to reduce unwanted pregnancies, then don't forsake that which used to work. MODESTY AND SELF RESPECT OF ONES BODY AND SEXUAL OPENNESS.","jitobear","298451","But it isn't your body as much as it is her's. Actually, it isn't your body at all. Your half of the DNA does not hold weight next to her entire body for the next nine months. Damn straight they aren't. It is not their partner's body and women, even pregnant ones, are not children or property. For you to be able to trump the rights of a woman to make major medical is nothing more than a violation. It gives me the same warm, fuzzy feeling I got when I was raped. Have I ever told you the stories of my grandma and my mom? My mom grew up in a one room shack with 11 siblings and an abusive father. My grandma could not get birth control without her husband's permission, which he would not grant. So my grandma kept having babies. Babies that he would do little to support. Now this was during the glorious culture of the 40s and 50s that you are glamorizing so on top of not being allowed to make birth control decisions for herself - it was damned hard for a woman to divorce or get the kind of work that would support a family. Telling your husband ""no"" wasn't an option. Spousal rape is still legal in many states. My mother has three children. Her last was my brother born in 1974. She decided at that time she no longer wanted children. She could not legally get her tubes tied without her husband's permission - which my father only granted after the doctor lied to him about the risks of my mother becoming pregnant again. My father would walk out ten years later. I am sorry that you think its unjust that men don't get to make decisions like this for the women in their life. But that is just too damned bad. My grandma and mother both taught me that this body is mine . Period. Its as simple as this - - I don't want to make major life and medical decisions for anyone but myself and my son until he is old enough to make them himself. Bull. One can babble away about all matter of things they don't care about. (Wanna hear what I think about Heath Ledger's death?) I don't believe you care because you don't offer solutions. You simply insult women in a hard place - you wish to disempower them, you trivialize their lives and their bodies. Nothing in your preaching will help. I am not responsible for the actions of ""woman's groups"". I am not a member of one and do not feel compelled to speak for them or offer apologies for them. NO THANK YOU . (See story about my grandma above.) In the 50s I would be stuck with an abusive husband, and unable to support my son when I wasn't worried about discrimination against him for not being white. Today's problems are not going to be solved by retreating into confabulated ideas of what the past was like. To quote Billy Joel ""the good old days weren't always good and tomorrow isn't as bad as it seems."" More than you realize I'd bet. It was just a dirty little secret then. (can anyone say unhealthy, puritanical attitude towards sex/pregnancy?). Why? This is the unhealthy hang-up I am talking about. They are BOOBS. There is nothing wrong with them and its completely natural to like them. There was all kind of sexy going on in the 50s - the styles were just different. Marilyn Monroe is still the most revered pin-up girl of all time. How about Bettie Page? Pedal pushers? Tight sweaters? WHOAH! Now I KNOW you are a misogynist. This really doesn't warrant any more repsect than when Siggy gets on the board and talks about the inferiority of blacks or how the Holocaust didn't happen. Straight up pathetic. Do your daughters know that you find women to be predatory and unable to make a decent living for themselves? As long as people have sex there will be unwanted pregnancy. It happens to single people, coupled people, and married people. And its not new. In previous posts to you I told what things I believe will work and backed those things up with stats and evidence. You have not done this - you have just spun a wildly innacurate fairy tale about the 50s. This will not make a difference. I wear low-cut tops and glitter out to the bar all the time. I never take trash home (or go home with it). The girl next to me could wear a ankle-length skirt and turtle neck and be nailing everything that moves. Change ""sexual openess"" to ""sexuality"" and this is an excellent statment. (I don't believe responsible adults need to be ashsamed of or hide the fact that they are sexual beings.) This all ties to how I feel we raise women and how I feel that needs to be changed. They are told all their lives - by popular culture and often by religion that having a man is the end-all, be-all of the universe. A good relationship with a good man is a wonderful thing. But there are women who will stick to a loser like glue over dealing with the stigma of being single. I choose to be single and I get jeers about it all the time. ""Can't catch a man??"" (like its that hard). We need to stop making a relationship with a man the measure of success for a woman. It is my belief that this idea is responsible for more unwanted pregancies than anything else. They can't stand the thought of being alone so they will do anything to hold on to that man - including sex, getting pregnanct, etc. I wish girls today understood that their sisters, eons ago, had little to no rights over their own lives and were given away in marriage by their fathers. A lot of these women became nuns. In part because they found freedom and power in celibacy that they would not have had married.","abortion-self-defense","04:57 PM","abortion-debates","174"
"01-23-2008","10685",12,"jitobear","None","But it isn't your body as much as it is her's. Actually, it isn't your body at all. Your half of the DNA does not hold weight next to her entire body for the next nine months.","Archangel","298460","This first response in and of itself says it all in proving the depth of your sense of justice and fair play, effectively putting an end to any further discussion with you about this issue.","abortion-self-defense","06:52 PM","abortion-debates","175"
"01-23-2008","10685",12,"None","None","None","Axolotl","298462","Nothing personal, Archangel, but leaving your DNA lying around doesn't give you any rights. I could scrape my finger in my neighbor's sink, leaving them some of my DNA. But I don't have a right take their sink with me on the way out the door. Very moving family stories, Jitobear. Makes it clear why choice is so important to so many American women who've been there when *choice* hasn't been. No thanks to America becoming another country ruled by the Roman Catholic Church. Where women are thrown into prisons leaving their real children motherless, shackled to hospital beds as they bleed from illegal procedures, or the poor dump their newborns on some hillside, in a ditch, or a garbage pail.","abortion-self-defense","07:54 PM","abortion-debates","176"
"01-23-2008","10685",12,"Axolotl","298462","Nothing personal, Archangel, but leaving your DNA lying around doesn't give you any rights. I could scrape my finger in my neighbor's sink, leaving them some of my DNA. But I don't have a right take their sink with me on the way out the door.","Archangel","298463","Nice job minimizing the part a man plays in a consensual relationship with a woman that leads to a baby being conceived by BOTH of them. Only in this generation have men become so utterly castrated so as to willfully abandon their rights as an equal contributor to the life they not only created together, but that wouldn't even exist if not for the mans contribution. So how do you say that this guy just left his DNA lying around like it just fell out of his pocket Axolotl? Your statement makes no sense in reality at all.","abortion-self-defense","08:22 PM","abortion-debates","177"
"01-23-2008","10685",12,"None","None","None","bhbcu64","298464","Nice job minimizing the part a man plays in a consensual relationship with a woman that leads to a baby being conceived by BOTH of them. Only in this generation have men become so utterly castrated so as to willfully abandon their rights as an equal contributor to the life they not only created together , but that wouldn't even exist if not for the mans contribution. Do you really mean to say that a man should control the future of a woman's pregnancy? On what grounds? Do you really mean to say that women who are impregnated through an anonymous sperm donor or through a rape should have access to abortions? Sure looks like it from this post, old boy.","abortion-self-defense","08:37 PM","abortion-debates","178"
"01-23-2008","10685",12,"Archangel","298409","Now consider that every healthy zygote/fetus in its early stages of development has every bit the same potential as you do and your evidence of that is the absolute knowledge within your own mind that you, at one time in your own development, you were exactly where they are now. We don't have to even consider this from a religious perspective or from the vantage point of a soul existing in order to perfectly relate to each and every one of these aborted infants being cut off from life at a stage of development that is precisely where we once were ourselves. Here is some evidence that science has confirmed what I believe to be true.","electrolyte","298474","Wrong. Ao has no ""potential"" to become a human being because Ao is already a human being. But this can also be said about unfertilized ova in ovaries. But, as I've shown above, such ""relation"" doesn't show what you think it does. If we use your reasoning, unfertilized ova -- which you think do not qualify as ""potential"" humans -- are enveloped into this realm that you desire be protected. Yes, here is some evidence that says that fetuses are likely capable of feeling pain by the third trimester, or possibly the late second trimester. How about you rail against third-trimester abortions instead of all abortions if this is your actual reason? Now, because you rail against all abortions instead, this is clearly not the true reason you rail against abortion. But, it's not really about pain at all. Death row inmates feel pain, too, and yet we still kill them...","abortion-self-defense","11:49 PM","abortion-debates","179"
"01-23-2008","10685",12,"Archangel","298431","Abortion insists women need to have control over their bodies while forgiving their irresponsible use of their bodies at the same exact time.","electrolyte","298475","I have challenged you multiple times now to justify the claim that an unwanted pregnancy is necessarily the result of irresponsibility. Put up or shut up, Archie boy. 11) Claiming everyone is lying or distorting what you say ( especially when you fail to provide evidence or meet challenges to prove this )","abortion-self-defense","11:55 PM","abortion-debates","180"
