"Date","Dialog_Turn","Discussion_Id","Post_Counter","Quote_Author","Quote_Id","Quote_Text","Response_Author","Response_Id","Response_Text","Subtopic","Time","Topic","Word_Count"
"01-23-2007",3,"9391","144","ShadowPikachu","248148","Sorry, but I called him sexist because of his attitude toward women as shown in his post. As a women, I felt that his comments were rather demeaning and sexist. I don't call anyone anything unless it has a basis in what they have said or done. And about getting banned, lol! I'm calling it as I see it and I'm not afraid of your petty threats. Oh, and by the way, since you seem so obsessed with the dictionary, here you go: There is nothing false about my statement, therefore it is not slander. Slander is what Bush's buddies did to McCain in the Republican primaries (I think it was the primaries - whatever it is where republicans choose their candidate for president out of a group of republicans).","Steeeeve","248185","So if I called you a child molesting rapist because I thought you were then you would be ok with this? It wasn't a threat...I don't ban people...I'm just saying that many folks have been.","why-pro-life","09:49 AM","abortion-debates","41"
"01-23-2007",3,"9391","147","Steeeeve","248185","So if I called you a child molesting rapist because I thought you were then you would be ok with this? It wasn't a threat...I don't ban people...I'm just saying that many folks have been.","ShadowPikachu","248201","I'd be fine with it... If I said anything in my posts which suggested it, which I have not. (Not to mention the fact that females as ""child molesting rapists"" are rather rare and unusual) You see, with his post, it pretty much showed a sexist attitude, hence why I said that I bet (key word here) he was one of those sexists who blamed the victim for the rape (something frighteningly common from people who live near me). Um, that's why I said you don't scare me with your petty litte threats, as I know you cannot ban me as you are not a moderator. I'll let the moderators tell me if I've gone to far, and then I will abide by their decision, not yours.","why-pro-life","11:16 AM","abortion-debates","148"
"01-23-2007",3,"9391","148","ShadowPikachu","248201","I'd be fine with it... If I said anything in my posts which suggested it, which I have not. (Not to mention the fact that females as ""child molesting rapists"" are rather rare and unusual) You see, with his post, it pretty much showed a sexist attitude, hence why I said that I bet (key word here) he was one of those sexists who blamed the victim for the rape (something frighteningly common from people who live near me).","Steeeeve","248232","I guess we just have a different set of morals. Accusing someone of the things you did or me calling you a ""child molesting rapist"" is wrong.","why-pro-life","03:07 PM","abortion-debates","31"
"01-23-2007",3,"9391","149","Steeeeve","248232","I guess we just have a different set of morals. Accusing someone of the things you did or me calling you a ""child molesting rapist"" is wrong.","ShadowPikachu","248260","It's not wrong if it's true, based on the evidence (of which you would have none to call me that). If I were to call someone who has killed children a ""child-murderer"", is that wrong?","why-pro-life","06:27 PM","abortion-debates","43"
"01-24-2007",3,"9391","151","ShadowPikachu","248260","It's not wrong if it's true, based on the evidence (of which you would have none to call me that). If I were to call someone who has killed children a ""child-murderer"", is that wrong?","Steeeeve","248311","what is this ""evidence""? The fact that he doesn't think a rape victim should get an abortion? I'd like to see that one in a court case..HA","why-pro-life","10:24 AM","abortion-debates","33"
"01-11-2007",4,"9391","61","Steeeeve","246731","I get the idea that our English classes are failing on every level. For one, it is hard to be a member of something when you are dead. Secondly, the definition is what it is. My cat mentally lives...she must be a human","Sigma","246755","The definition makes no distinction between those alive and those dead. Were a dictionary definition used, it would be difficult to deny the dead equal protection based on your reasoning. The dictionary definition also does not make a distinction based on the number of chromosomes. A sperm is human in the same way the fetus is human: they both contain human DNA. However, this is all moot. The dictionary definition has no authority over how we use words. It simply records how words are generally used. In a philosophical debate such as this, shadings of meaning are used constantly that you will not find in any dictionary. It is up to the participants to agree to use a word in a certain way to avoid confusion between them. A philosophical argument is to argue concepts , not semantics. Non-human animals are usually not considered to posess consciousness as we know it. However, we can make the distinction that your cat does not have a unique human consciousness.","why-pro-life","11:45 AM","abortion-debates","184"
"01-11-2007",4,"9391","63","Sigma","246755","The definition makes no distinction between those alive and those dead. Were a dictionary definition used, it would be difficult to deny the dead equal protection based on your reasoning. The dictionary definition also does not make a distinction based on the number of chromosomes. A sperm is human in the same way the fetus is human: they both contain human DNA. However, this is all moot. The dictionary definition has no authority over how we use words. It simply records how words are generally used. In a philosophical debate such as this, shadings of meaning are used constantly that you will not find in any dictionary. It is up to the participants to agree to use a word in a certain way to avoid confusion between them. A philosophical argument is to argue concepts , not semantics. Non-human animals are usually not considered to posess consciousness as we know it. However, we can make the distinction that your cat does not have a unique human consciousness.","Steeeeve","246758","you can't join in so late This is simple biology...member of the species homo sapien doesn't mean a sperm cell, never has never will. It is moot but at the same time aggravating that people claim the fetus is a ""human"" and thus this justifies abortion. I believe to you this doesn't even matter. yet there is the word ""human"" agian...what makes human so important? (note: I agree that human is important).","why-pro-life","11:53 AM","abortion-debates","89"
"01-11-2007",4,"9391","67","Steeeeve","246758","This is simple biology...member of the species homo sapien doesn't mean a sperm cell, never has never will. yet there is the word ""human"" agian...what makes human so important? (note: I agree that human is important).","Sigma","246778","You cannot deny, however, that sperm is human for the same reason the fetus is human: both contain human DNA. The dictionary definition would then cover both. As opposed to non-human animals, such as your cat. Consciousness is generally considered unique to humans, but since you insist that your cat posesses this feature, human consciousness can still be distinguished.","why-pro-life","01:15 PM","abortion-debates","69"
"01-11-2007",4,"9391","68","Sigma","246778","You cannot deny, however, that sperm is human for the same reason the fetus is human: both contain human DNA. The dictionary definition would then cover both. As opposed to non-human animals, such as your cat. Consciousness is generally considered unique to humans, but since you insist that your cat posesses this feature, human consciousness can still be distinguished.","Steeeeve","246804","no one doubts the adjective sense of the word and what is special about the human aspect? That was my question.","why-pro-life","03:15 PM","abortion-debates","23"
"01-11-2007",4,"9391","70","Steeeeve","246804","no one doubts the adjective sense of the word and what is special about the human aspect? That was my question.","Sigma","246829","I see. And what makes something human in the noun sense of the word different from the adjective sense? Could it be that, ultimately, we're ""characterized by a brain capacity averaging 1400 cc (85 cubic in.) and by dependence upon language and the creation and utilization of complex tools"" like the dictionary tells us? Wouldn't that imply a mental existence to be a member? Special? In what way did I say it was ""special""? Do you mean, what is different from a human consciousness than the animal consciousness? I have not asserted animal consciousness exists; you have.","why-pro-life","05:32 PM","abortion-debates","116"
"01-12-2007",4,"9391","71","Sigma","246829","I see. And what makes something human in the noun sense of the word different from the adjective sense? Could it be that, ultimately, we're ""characterized by a brain capacity averaging 1400 cc (85 cubic in.) and by dependence upon language and the creation and utilization of complex tools"" like the dictionary tells us? Wouldn't that imply a mental existence to be a member? Special? In what way did I say it was ""special""? Do you mean, what is different from a human consciousness than the animal consciousness? I have not asserted animal consciousness exists; you have.","Steeeeve","246897","no. But the noun sense of the word says ""member of species homo sapien"" ...not having a brain capacity of 1400cc. ok, well if it does exist then does this change the way we deal with animals? If not then what is so special about a human as opposed to other animals that makes our consciousness worthy of value.","why-pro-life","12:32 PM","abortion-debates","67"
"01-12-2007",4,"9391","72","Steeeeve","246897","no. But the noun sense of the word says ""member of species homo sapien"" ...not having a brain capacity of 1400cc. ok, well if it does exist then does this change the way we deal with animals? If not then what is so special about a human as opposed to other animals that makes our consciousness worthy of value.","Sigma","246905","By definition a member of the species homo sapien is characterized by a brain capacity averaging 1400 cc (85 cubic in.) and by dependence upon language and the creation and utilization of complex tools. Wouldn't you agree, then, that the definition implies a mental existence to be a member of our species? We're determining when to place moral value on a human , not an animal. It is generally accepted that the nexus of self requires greater brain capacity than other animals are capable of. Please make your point instead of asking questions. Your questions make no sense.","why-pro-life","01:08 PM","abortion-debates","109"
"01-12-2007",4,"9391","73","Sigma","246905","By definition a member of the species homo sapien is characterized by a brain capacity averaging 1400 cc (85 cubic in.) and by dependence upon language and the creation and utilization of complex tools. Wouldn't you agree, then, that the definition implies a mental existence to be a member of our species? We're determining when to place moral value on a human , not an animal. It is generally accepted that the nexus of self requires greater brain capacity than other animals are capable of. Please make your point instead of asking questions. Your questions make no sense.","Steeeeve","246954","An interesting definition I admit but every other definition there does not have the definition as so. Besides, a new-born is classified as in the species homo sapien and yet its brain is only 386cc or so. Any biology book also states that every living organism is classified in a species. Where would the fetus go if not human? So no, I do not agree that mental existence is required. they certainly make sense. I ask why does being human matter? You seem to think that you have to be 1) human and 2) conscious in order to have moral value. I am asking why the human criteria exists.","why-pro-life","03:57 PM","abortion-debates","122"
"01-12-2007",4,"9391","74","Steeeeve","246954","Any biology book also states that every living organism is classified in a species. Where would the fetus go if not human? So no, I do not agree that mental existence is required. they certainly make sense. I ask why does being human matter? You seem to think that you have to be 1) human and 2) conscious in order to have moral value. I am asking why the human criteria exists.","Sigma","246993","Well, what is the dictionary criteria for being a human? It appears to be that humans are characterized by a brain capacity averaging 1400 cc (85 cubic in.) and by dependence upon language and the creation and utilization of complex tools. Therefore any who do not fall under this definition cannot be human. Would you agree? How else could the fetus be human if not by this dictionary definition? So, you're pulling definitions out of your XXX now? I don't care what you agree with the definition or not. I asked if you agreed that this definition seems to imply a mental existence. If we want to assess the moral weight of something that is human, then being human would be part of the criteria, yes? If we are asessing the moral weight of cats, the fact that it is a cat would be part of the criteria. If we are just asessing what has moral weight in general, then consciousness with no reference to species would be the criteria. What is your point?","why-pro-life","07:15 PM","abortion-debates","195"
"01-13-2007",4,"9391","75","Sigma","246993","Well, what is the dictionary criteria for being a human? It appears to be that humans are characterized by a brain capacity averaging 1400 cc (85 cubic in.) and by dependence upon language and the creation and utilization of complex tools. Therefore any who do not fall under this definition cannot be human. Would you agree? How else could the fetus be human if not by this dictionary definition? So, you're pulling definitions out of your XXX now? I don't care what you agree with the definition or not. I asked if you agreed that this definition seems to imply a mental existence. If we want to assess the moral weight of something that is human, then being human would be part of the criteria, yes? If we are asessing the moral weight of cats, the fact that it is a cat would be part of the criteria. If we are just asessing what has moral weight in general, then consciousness with no reference to species would be the criteria. What is your point?","Steeeeve","247029","by the other 5 or so definitions. Either way, Sapien should be the word you look up as Homo Sapien is two words...but since we have 5 other definitions (this includes my at home websters) then I'll take the 5 over the 1. So I guess I disagree. Did you look at your own link? 5 other definitions (sources) saying the exact same thing...not one of them says anything about brain mass. I feel like you aren't answering my question. I am weighing the moral value of a human verus a cast or other animal. Why would the charateristic ""human"" be more valuable than say a cat...assuming they both have consciousness?","why-pro-life","09:47 AM","abortion-debates","132"
"01-15-2007",4,"9391","76","Steeeeve","247029","by the other 5 or so definitions. Either way, Sapien should be the word you look up as Homo Sapien is two words...but since we have 5 other definitions (this includes my at home websters) then I'll take the 5 over the 1. So I guess I disagree. Did you look at your own link? 5 other definitions (sources) saying the exact same thing...not one of them says anything about brain mass I feel like you aren't answering my question. I am weighing the moral value of a human verus a cast or other animal. Why would the charateristic ""human"" be more valuable than say a cat...assuming they both have consciousness?","Sigma","247270","I looked up Homo Sapien , which is the species we belong to. Do I have to repeat myself, Steve? Read it again: I don't care whether you agree with the definition or not. I asked if you agreed that this definition seems to imply a mental existence lol! Ok, lets look at those other definitions. First one: The modern species of humans . How does one determine if the fetus is of the modern species of humans? Second one: The biological classification of modern humans . How does one determine if the fetus is a modern human? Third one: the only surviving hominid; species to which modern man belongs . How do we determine this, Steve? The only definition that mentions any sort of criteria was the one I quoted. Wouldn't you agree the definition I quoted implies a mental existence, Steve? Let's look at it again, Steve. It says that humans are characterized by a brain capacity averaging 1400 cc (85 cubic in.) and by dependence upon language and the creation and utilization of complex tools. You feel this way because you aren't coming to your point. I am answering as best I can. I did not say that human animals are intrinsically more valuable than a cat. We are weighing the moral value of a human, though, which is why it is part of the criteria. Or are you trying to draw the discussion off-topic?","why-pro-life","10:41 AM","abortion-debates","270"
"01-15-2007",4,"9391","77","Sigma","247270","I looked up Homo Sapien , which is the species we belong to. Do I have to repeat myself, Steve? Read it again: I don't care whether you agree with the definition or not. I asked if you agreed that this definition seems to imply a mental existence lol! Ok, lets look at those other definitions. First one: The modern species of humans . How does one determine if the fetus is of the modern species of humans? Second one: The biological classification of modern humans . How does one determine if the fetus is a modern human? Third one: the only surviving hominid; species to which modern man belongs . How do we determine this, Steve? The only definition that mentions any sort of criteria was the one I quoted. Wouldn't you agree the definition I quoted implies a mental existence, Steve? Let's look at it again, Steve. It says that humans are characterized by a brain capacity averaging 1400 cc (85 cubic in.) and by dependence upon language and the creation and utilization of complex tools. You feel this way because you aren't coming to your point. I am answering as best I can. I did not say that human animals are intrinsically more valuable than a cat. We are weighing the moral value of a human, though, which is why it is part of the criteria. Or are you trying to draw the discussion off-topic?","Steeeeve","247301","I disagree that certain definition implies mental existence. You determine this by taking a biology class Yeah, I'd say it implies more of a full development than ""mental existence"". No we are not weighing that...I made the question not you. We are weighing the moral value of a human over a cat. What makes the human have more value than a cat....what about a monkey that has more ""intelligence"" than some humans? You seem to just not want to answer!","why-pro-life","02:37 PM","abortion-debates","95"
"01-15-2007",4,"9391","78","Steeeeve","247301","I disagree that certain definition implies mental existence. You determine this by taking a biology class Yeah, I'd say it implies more of a full development than ""mental existence"". No we are not weighing that...I made the question not you. We are weighing the moral value of a human over a cat. What makes the human have more value than a cat....what about a monkey that has more ""intelligence"" than some humans? You seem to just not want to answer!","Sigma","247322","What the heck is ""certain definition""? Do you agree or disagree that the definition I quoted implies a mental existence? Oh? Are you trying to tell me that the dictionary definition cannot tell us what it is to be human?! You can't be serious! The dictionary definition knows all and tells all! You must be wrong. So what is the criteria, then? What makes us 'a human' as opposed to 'human'. Oh, so only fully developed... things... are human if they fit that criteria? What are they before they are fully developed? This question is off-topic, then. Make a new thread about what makes humans of more moral worth than animals to various posters.","why-pro-life","03:50 PM","abortion-debates","138"
"01-15-2007",4,"9391","80","Sigma","247322","What the heck is ""certain definition""? Do you agree or disagree that the definition I quoted implies a mental existence? Oh? Are you trying to tell me that the dictionary definition cannot tell us what it is to be human?! You can't be serious! The dictionary definition knows all and tells all! You must be wrong. So what is the criteria, then? What makes us 'a human' as opposed to 'human'. Oh, so only fully developed... things... are human if they fit that criteria? What are they before they are fully developed? This question is off-topic, then. Make a new thread about what makes humans of more moral worth than animals to various posters.","Steeeeve","247338","Disagree. I stated that. The ""certain definition"" was the one you quoted. Are you suggesting the dictionary is meaningless? If you want to try and define every word in every definition then you could come to the conclusion that nothing is defined. You asked questions that were not related to definition as it assumes some level of knowledge (ie not questioning every word in the definition). The criteria for the word human is set up in the dictionary as that is what they are there for. I don't claim you have to put any moral significance on this. I said the definition you selectivily chose implies a fully developed body. This contradicts the other 5 definitions in the same link you gave me so I reject the definition you gave. It beats me what dictionary.com (the source of that definition) thinks 2yr olds are. It is right on topic. Why can't you answer? The discussion we were having was about consciousness and that being the deciding factor for moral value. I said that my cat has consciousness and then you said my cat was not human. My question is why should ""human"" matter?","why-pro-life","05:12 PM","abortion-debates","218"
"01-15-2007",4,"9391","81","Steeeeve","247338","Disagree. I stated that. The ""certain definition"" was the one you quoted. Are you suggesting the dictionary is meaningless? If you want to try and define every word in every definition then you could come to the conclusion that nothing is defined. You asked questions that were not related to definition as it assumes some level of knowledge (ie not questioning every word in the definition). I said the definition you selectivily chose implies a fully developed body. This contradicts the other 5 definitions in the same link you gave me so I reject the definition you gave. It beats me what dictionary.com (the source of that definition) thinks 2yr olds are. It is right on topic. Why can't you answer? The discussion we were having was about consciousness and that being the deciding factor for moral value. I said that my cat has consciousness and then you said my cat was not human. My question is why should ""human"" matter?","Sigma","247349","I see. On what basis do you disagree that dependence upon language and the creation and utilization of complex tools implies a mental existence? I see. You are then claiming the dictionary does not provide a criteria for being human, and instead assumes we know this criteria? What is the criteria then, according to Steve? Contradicts in what way? I see no contradiction. The other definitions provide no criteria, while the one I quoted did. Yet it is unacceptable to you for some reason you have not supplied. The deciding factor for moral value... in humans. Whether it applies to non-human animals or not would be the subject for another thread.","why-pro-life","06:15 PM","abortion-debates","126"
