"Date","DiscussionId","PageId","QuoteAuthor","QuoteId","QuoteText","ResponseAuthor","ResponseId","ResponseText","Subtopic","Time","Topic","postCounter"
"08-30-2009","13107",18,"Matthew","367577","Archie, you have ascribed to evolutionists the view that a fish crawled out of the ocean and survived long enough to turn into a mammal. You have demanded explanations about how lizards can turn into dogs or plants turn into insects. What that indicates to me is not a lack of intelligence, but it certainly qualifies as ignorance. You do not understand evolution. Ignorance is no sin. But the wise thing to do would be to correct it, as quickly as possible. Personally, I have never called you ""stupid."" I have called you deeply ignorant of what you are criticizing. Three instances are provided above. Your ""blunt honesty"" is used in defense of a basic misunderstanding. So what exactly am I supposed to ""appreciate?"" Archie, I spent a sizable portion of my afternoon yesterday composing responses to you. Those responses were substantive and specific. I explained exactly where I thought you were wrong. What I have received in return is an attack on my honesty. Just like the last time I tried to engage you. Archie, anyone who believes that evolution says a fish turned into a mammal, a lizard could turn into a dog, or a plant could turn into an insect does not understand evolution. Period. So what are you going to do about that? Just assert ""I do get it"" again? Get over the defensiveness and educate yourself about the thing you are criticizing! No, there's plenty of evidence. But ""there is none"" that you will accept. The issue of what constitutes acceptable evidence was another substantive matter discussed in my posts. And you have ignored it. I find that there is indeed a stalemate. But it results from the fact that one side simply does not understand evolution, yet criticizes evolution as if it did. How can we even have a serious debate, when there are such serious misunderstandings of the very issue to be debated? when any attempt to correct misunderstandings is treated as evidence of the sinful character of those attempting to do the correcting? I have no doubt that you believe what you say you believe. I have never criticized you for a lack of commitment. The problem is, right now, any time something challenges your worldview, you attack the character of him who offered the challenge. And the above is a case in point.","Archangel","367600","You call that selectively doled out drivel to my extensive post a considered and thoughtful response to the points I raised? You oughta be on stage Matthew. So I'll just let my prior post stand as evidence of what I'm dealing with here. If you have even half of the intelligence that I have given you credit for then you know darn well that I was making general statements of evolutionist conclusions rather than stating my view of the specific process which led to land mammals coming to exist. You know as well as I do that macro-evolution believes that all life evolved from an original single celled organism/protein/ enzyme which is all living creatures common ancestor. But you can't honestly accept my general statement of description for what it is. Like a typical dishonest advocate of this pseudo science you must interpret my statements literally and then assert that I don't understand the subject. This knowing full well that I do understand the subject very well, but since you can't answer the inconsistencies I point out to you, you must deflect from that reality by asserting that I don't get it. A dishonest and cowardly debating tactic since it prevents us from ever getting to the meat of the issues I raise. BOLDED FOR EMPHASIS! Agreed, but you and your secular humanist cohorts will never admit it's you who needs correcting. And I have shown that your criticisms above are either deeply ignorant or blatantly disingenuous as you attempt to use literal interpretations of general statements of the accepted cause and effect which accurately defines evolution as an example of my lack of knowledge of your pseudo-scientific religion. Balderdash. Speak for yourself. My blunt honesty is usually just posting bible passages which so convict the opposition because Gods word is a living breathing double edged sword of truth, that the recipients feel condemned by it. But rather than take that truth to heart, they respond by claiming I have condemned them. Here's a bit of wisdom you either missed or are also in denial of in your christian belief system Matthew, the word of God never comes back void. Here's how Gods Word puts it as evidence that His word never comes back void nor can we hide from HIM. Hbr 4:12 For the word of God is living and active and sharper than any two-edged sword, and piercing as far as the division of soul and spirit, of both joints and marrow, and able to judge the thoughts and intentions of the heart. Hbr 4:13 And there is no creature hidden from His sight, but all things are open and laid bare to the eyes of Him with whom we have to do. I guess to you they were substantive, to me they were just opportunities to bluster and waste bandwidth one post at a time so you could feel like you were contributing substantial content. But no actual absolute scientific information was proffered at all and you. And your posts are still there for independent confirmation of that fact. As long as you claim to be a believer and follower of Christ, yet spend your time defending the exact opposite of what His word teaches, I am going to call you the obvious hypocrite that you are. If you come here and admit that you're an atheist or at least a dedicated secular humanist who rejects the judeo-christian teachings in the Old and New Testaments my respect for you will rise considerably since you will be debating from an honest position. But as long as you spew the same old Secular humanist party line which is in perfect harmony with the atheist perspective, as you dishonestly claim to be a christian believer, then I am going to continue to prove you're a liar and a hypocrite. Evolution does IN FACT say that these stages of evolution did occur in that all life on land eventually evolved from creatures which came from the Sea. And those seas creatures evolved from proteins and microbes which were allegedly formed in the primordial ooze by way of some spontaneous form of random mutation. And for you to all of a sudden become a literalist when you are a generalist in every other aspect of the debate is just more evidence of your dishonesty regarding this sketchy issue. I've explained it twice now, the question is, will you admit your dishonesty in attempting to interpret my statement as you have. I would say the same thing to you if I thought it would make a difference, but you seem totally sold out to this man made lie and fairy tale which seeks to explain our creation apart from a personal and intelligent God. The question I have is how can you claim to believe in that Creator God as you deny and reject HIS explanation for how you came to be here? He says you were planned while you say you were a random accident of nature. Wrong again, THERE IS NO ABSOLUTELY RELIABLE EVIDENCE, SO THERE IS NOTHING WORTHY OF ACCEPTING. You mean you spent a lot of time giving your useless and prejudicial opinion which is anything but informed, reliable or objective. Big deal; your opinion and a dollar and I still can't buy a lousy coffee. Blah blah blah... How many times will the guy who can't even supply absolute evidence for what he claims is a valid and authoritative science, continue to tell me that it is I who doesn't understand it? How about we start with the fact that the real problem is that I am dealing with people who refuse to accept that their whole evolutionist belief system is based on an unprovable, unrepeatable and unverifiable house of cards which is NOT based in any factual data at all! How about you admit that you are too blind to recognize how weak and impossible what you claim to be reality is in reality? Sure you did. You said I was intellectually dishonest which implies I don't really believe the things I say here in defense of the positions I defend. When the fact is that you are the intellectually dishonest one, and that is undeniable since you claim to be a christian believer and follower of Christ as you defend an undeniably secular humanist gospel which attempts to explain how man came to be without any active or personal participation from the Judeo Christian Creator God spoken of in the bible you CLAIM to accept. You are the only intellectually dishonest one between us Matthew, and sadly, you are too blind to recognize it in yourself. I'm not attacking you Matthew. I am pointing out the obvious hypocrisy which you represent here as you claim to be one thing and defend another. Remember what Matthew 6:24 says Matt, No man can serve two masters: for either he will hate the one, and love the other; or else he will hold to the one, and despise the other. Ye cannot serve God and mammon. It's speaking directly to you. And one more thing Matt. It took me a while to get back to you because unlike you, I went to church today to fellowship with like minded believers and to worship my heavenly Father. I realize that wasn't an issue for you based on the time your post was submitted. Like I said though, as hypocrites go, at least you're consistent.","effective-arguments-disproving-biblical-creation","05:36 PM","creation-intelligent-design-vs-evolution","264"
"08-30-2009","13107",18,"Archangel","367573","I would celebrate it for a month of sundays. Don't believe me? I dare you to try me and leave instead of just scurrying down your hole like a rat in hiding for a couple of weeks every time admin warns you about your incessant dishonest debating style and trolling ways. Too afraid to go? And you know this how? I mean, by what standard of supernatural insight do you claim to get into the heart and mind of other people obnoxious child, as you claim to speak of our fears and apprehensions in life? Or is it just more of your delusional ranting just as you now assert that I argue in favor of the God of Israel being a liar just because I defend the Creation account in Genesis. In your sick mind, I'm not defending Gods word, I'm arguing that He is a liar. Go figure huh? In almost every post you write you expose your muddled and twisted thinking as you distort, pervert and misinterpret everything I say in your usual style of defaming those whom you cannot refute with rational arguments, as you corrupt what they say with your twisted interpretation of their beliefs. So yeah, I challenge you to wash your hands of this forum if you have so little respect for it, and go back to evC unless you have been banned from their also.","obvious_child","367607","You mean how you are constantly getting warnings? Because that place won't allow your tantrums. They force you to actually debate with evidence. You cannot do that . And the site keeps track of the posts you ignore rather unlike this place where you have completely ignored how your flood argument requires nearly a billion cubic miles of sediment time and time again. You throw insults like you do here there, you'll be banned almost instantly. Incorrect. There is no basis for your claims in Genesis. There is no scripture for ""star throwing."" Furthermore, you have never dealt with how your argument makes God a liar. Let's go over this again for the hard of thinking. 1) The natural world does not show any evidence of physical changes in the laws regarding light in a medium 2) You argued God changed them 3) You presented absolutely no evidence 4) Therefore, with no evidence of any changes, God must have secretly hid all of the physical changes to allow your argument presenting us with a universe that operates completely different How is that not lying? Okay, magic billion cubic miles of sediment... You do realize that we don't listen to your tantrums anymore? How about you go see if I'm banned here? And for the second time on this thread alone, here's all the evidence I need to prove that you contribute nothing more to the debate than off topic insults. Bam, I didn't even need to change anything there to turn it around.","effective-arguments-disproving-biblical-creation","06:08 PM","creation-intelligent-design-vs-evolution","265"
"08-30-2009","13107",18,"None","None","None","tester","367610","Setting personal beliefs regarding biological evolution aside, is there even a SINGLE reader of these forums who wouldn't agree that Matthew's discourse is more clear, courteous and rational than Archangel's? Can we do a simple poll?","effective-arguments-disproving-biblical-creation","06:17 PM","creation-intelligent-design-vs-evolution","266"
"08-30-2009","13107",18,"None","None","None","Accipiter","367619","Everybody (except arch) agrees with you, no poll needed.","effective-arguments-disproving-biblical-creation","07:12 PM","creation-intelligent-design-vs-evolution","267"
"08-30-2009","13107",18,"tester","367610","Setting personal beliefs regarding biological evolution aside, is there even a SINGLE reader of these forums who wouldn't agree that Matthew's discourse is more clear, courteous and rational than Archangel's? Can we do a simple poll?","obvious_child","367624","Is that a rhetorical question? I've never seen Mathew resort to the level of incivility that Arch does on a regular basis. And unlike Arch, Mathew at least attempts to back his claims up with evidence and rational, not throwing insults like ""spiritually dead heathen"" and ""ignorant atheist"" not to mention accusing everyone of lying about anything as if those were valid arguments as to why either your opponent's argument is wrong or why you are correct.","effective-arguments-disproving-biblical-creation","07:23 PM","creation-intelligent-design-vs-evolution","268"
