"Date","DiscussionId","PageId","QuoteAuthor","QuoteId","QuoteText","ResponseAuthor","ResponseId","ResponseText","Subtopic","Time","Topic","postCounter"
"09-21-2010","12023",45,"Freedom","413131","Let A = A belief system. Let B = A system that you believe in. 'Believing in science' = 'A system you believe in' provided science is a system. 'does not make science a belief system.' = 'Not a belief system'. Then the first statement says A IS B and the second is B IS NOT A Unfortunately identity is commutative. (the scope here the domain of the word 'science') Do you realize how rare formal logic fallacies are? Then I regret to inform you I don't know what you meant because you used the word 'need' in a vacuum. Need for what? Indeed. Which as far as I am concerned can only be caused by three possible scenarios. 1. We are not using the same meaning for the phrase belief system, or even the word belief. 2. You are deliberately playing mind games for some alterior motive. 3. You haven't a clue what I am saying and are merely contradicting me on the premise that if I think it, it's wrong. If you were content with ignoring criticism of irrational evolution you wouldn't have signed up on a political debate forum and proceed to post in threads on the topic. That point is incorrect. Continuous or steady 'progress' from one species to another does not imply that new species will be formed along the way and certainly doesn't imply that new species will survive. Uh maybe we should complicate things for a reason. A cell membrane is not a patch of skin. From this post I am sure you are talking about a multicellular life form even though you said: ""a patch of skin on a single celled eukaryotic organism"" Now, assuming you mean multi-cellular organism you may repeat 'developed a variation' but again since this is the actual process in question it simply isn't helping the way you seem to think it is to repeatedly assert it happened. Except that this action of tracing consists of looking for similarity and telling a story. Bad form for science to be as valid as the imagination of the scientist. I could tell you a story about how flukes evolved from nose muscles, the key to these evolutionary stories is making is sound plausible which is a problem because there is no standard for actual truth in the matter because they proposed explanation does not apply and cannot be checked against the proposed occurrence. No you can identify more basic forms, that does not mean you identified a process it means your mind is conjecting that some occurrence must have happened. Please don't feel offended because this is quite normal. This is in fact exactly why so many evolutionist have thought I was in contradiction accepting common descent without accepting irrational evolution. Common descent says that creatures came from common ancestors, life has advanced so then I must accept that something is causing life to advance over generations. Yes I do, that does not specify what I must accept though, you are basically pointing out 'common descent' for organisms and conjecting that some process must have happened. Ah, here is the good stuff. Another evolutionist (I don't remember who but will look it up) tried to use the secretory system as a proposed precursor as well, as evidence he posted a link to an article discussing the similarities between them. The most interesting thing after reading that article, however; was no the similarities but the fact that the article had good reason to think that the secretory system was a decomposition of the flagellum, i.e. the secratory system evolved from the flagellum. I suspect this circular descendancy comes from that fact that similarity ~~ descent connection but that does not specify the direction so often 'scientist' simply choose which ever happens to be more convenient for their paper. If it does not function ""the same say as a flagellum"". It is not a flaggelum. You may now see the relevance of my opposition to the notion that every biological system is merely a permutation of some other system. On that premise you will be hard pressed to understand IC because you will only see one actual system in life, this blurring is objectively flawed. I have, the video you linked to surmised ken miller's argument precisely I think. Are you suggesting the cilia has any connection with a flagellum besides they do the same thing for the cell? I am not suggesting that one attempts to make things complicated but trying to simplify something beyond the level made possible by the number and the meaning of the terms will omit information and necessarily cause confusion. It does not. Again I have gone through these arguments before on this very forum, since you do not wish to read what I have argued perhaps I should give you a primer. ON TYPES OF SYSTEMS: I concluded all systems in biology are either IC or HIC HIC = hybrid irreducibly complex, meaning as system which contains both necessary parts and unnecessary but merely helpful parts. HIC is a favorite escape for arguing against IC, examples of HIC are given in which the necessary component becomes necessary, it then becomes IC. It is then asserted that since an HIC system can be converted to an IC system and IC system is not IC. The blade cuts both ways though, an IC system may be converted to an HIC system and every system has an IC core which means that all novel function is IC. ON INTERMEDIATES: I made detailed arguments from many directions on the invalidity of association any function with a specific selection pressure. This is the mistake that ken miller made in the video you posted for me, He used Behe's definition of IC which has some terms implied that should not be. Most important of these being when he says 'function' he does not mean any function he means the function of the said system. The ability to decompose a system into systems with different function does not mean the system was not IC because you in fact are not able to remove and of the parts and retain the function, merely a function. Further the ability to compose a system into simpler systems with the same function does not mean the system was never IC, it means it is HIC now. ON GUIDED MUTATION: The tool previously mentioned is a formula for identifying the concept IC is talking about. I do not wish to restate it's definition if you are not interested. I can summarize what it does, it returns a boolean value which is an absolute measure of whether a genetic change is produced by evolution or pure chance. true = guided = the result of natural selection + random mutation = rational evolution. false = unguided = luck = irrational evolutions production of novelty Using this function one can define IC in another way: An IC system is one which returns false when measuring from any previously existing genetic code to the systems minimal functional form (IC core). Since nearly axiomatic that all systems have an IC core the analysis seems silly to take to see if an IC core is IC but it will still return the correct value, it is much more useful to see if a proposed IC system is just IC or HIC. It's primary purpose however is it's extreme convenience at defining the difference between creating an IC system (novel system) and improving an existing one. At the risk of sounding arrogant Behe's book 'the edge of evolution' could be reduced to two pages of explaining this tool and would stand some improvement for the lack of puzzle fitting one would have to do. No intermediates and 'you can't remove a part without removing the function' are equivalent. The eye is a system of compound IC improvements, as opposed to the flagellum which as far as I can tell is actually IC. (or very slightly HIC).","gansao","413145","All your effort wasted because you cannot comprehend that you do not NEED to ' believe' in a fact . You do not seem to understand this simple concept and that is why you are seeing contradictions that are not there","there-absolutely-no-convincing-evidence-theory-evolution","06:29 AM","creation-intelligent-design-vs-evolution","669"
"09-21-2010","12023",45,"gansao","413145","All your effort wasted because you cannot comprehend that you do not NEED to ' believe' in a fact . You do not seem to understand this simple concept and that is why you are seeing contradictions that are not there","Freedom","413159","NEED for what? I proved the contradiction, as I said it is very rare for terms of online arguments to be so simple as to practicaly allow for that and almost as unlikley that a poster would let a formal fallacy past them. So enjoy, it could be months till another one","there-absolutely-no-convincing-evidence-theory-evolution","11:48 AM","creation-intelligent-design-vs-evolution","670"
"09-21-2010","12023",45,"Freedom","413159","NEED for what? I proved the contradiction, as I said it is very rare for terms of online arguments to be so simple as to practicaly allow for that and almost as unlikley that a poster would let a formal fallacy past them. So enjoy, it could be months till another one","gansao","413160","You proved you didnt understand the point in the first place and confirmed it in your last post. It glares out to me but you seem to be blind to it. You invented your own formal fallacy to prove. Unfortunately I doubt whether it will be months before you make the same mistake, probably the next post","there-absolutely-no-convincing-evidence-theory-evolution","11:58 AM","creation-intelligent-design-vs-evolution","671"
"09-21-2010","12023",45,"gansao","413160","You proved you didnt understand the point in the first place and confirmed it in your last post. It glares out to me but you seem to be blind to it. You invented your own formal fallacy to prove. Unfortunately I doubt whether it will be months before you make the same mistake, probably the next post","Freedom","413161","I am translating this to 'no comment but still need to respond to save face'.","there-absolutely-no-convincing-evidence-theory-evolution","12:01 PM","creation-intelligent-design-vs-evolution","672"
"09-21-2010","12023",45,"Freedom","413161","I am translating this to 'no comment but still need to respond to save face'.","gansao","413162","You declared you successfully disproved a point that you did not understand in the first place. You have a lot of face to save","there-absolutely-no-convincing-evidence-theory-evolution","12:06 PM","creation-intelligent-design-vs-evolution","673"
"09-21-2010","12023",45,"gansao","413162","You declared you successfully disproved a point that you did not understand in the first place. You have a lot of face to save","Freedom","413163","I have noticed you are happy with simple contradiction, so why don't you imagine a copy of me repeatedly telling you that you're wrong ok? http://www.youtube.com/watch?v=teMlv3ripSM","there-absolutely-no-convincing-evidence-theory-evolution","12:07 PM","creation-intelligent-design-vs-evolution","674"
"09-21-2010","12023",45,"Freedom","413163","No comment","gansao","413165","You never did have one","there-absolutely-no-convincing-evidence-theory-evolution","12:08 PM","creation-intelligent-design-vs-evolution","675"
