"Date","DiscussionId","PageId","QuoteAuthor","QuoteId","QuoteText","ResponseAuthor","ResponseId","ResponseText","Subtopic","Time","Topic","postCounter"
"01-27-2005","1649",7,"georged","None","I personally thought SS, as originally formulated, was a brilliant plan. Business paid its share, easily passed on to end consumers, no government costs and one of the few plans other than military expenditures we've had as a nation that extended beyond 3-4 years. In original form, it would have eliminated future tax burdens on those who pay the bulk of personal taxes to carry the poor. And that exposure is now in the very near future. Then the politicians, we both know who, got into it in a serious manner and discovered they could pump almost anything not being paid out into general revenue to meet budget shortfalls and avoid the risk of not being reelected by raising other taxes. That meant they kept it as a big slush fund, with no public attention desired. To have properly maintained it would have meant actuary and contributory adjustments and pushing the retirement age out to 70, where it should have been years ago, but that would have meant closer scrutiny and public uproar.","JPSartre12","88572","It was a brilliant plan...for a socialist state. The SCOTUS thought so, too.","political-stance-helps-country-more","07:16 PM","government-debates","97"
"01-27-2005","1649",7,"JPSartre12","None","It was a brilliant plan...for a socialist state. The SCOTUS thought so, too.","georged","88576","I'm a businessman. Anytime I can recover the employee's money and my expense without an earnings tax burden on my expense, that's a good capitalist plan.","political-stance-helps-country-more","07:43 PM","government-debates","98"
"01-28-2005","1649",7,"georged","None","Our government's entry into subsidized living in the 1960s spawned a huge industry of public employees covering every mental and physical health discipline in the book and an even greater number of new ones. As federal social engineering programs grew, the staffs serving them increased in logarithmic fashion as 'treatment' methodology became fashionable. I can see where Marxist ideology would flourish in that atmosphere. I also view that US government social direction change as a beginning conditioning effect on the general populace, the government take care of everyone attitude that now seems so very common in the generation first exposed to it and progressively more so in succeeding generations. That also spawned the first crop of US politicans who started using public money as an incentive for votes from the cushioned sector.","Alan Ryan","88598","I think what you're saying here applies perhaps with even greater force to the welfare ""paradise"" that is under construction in the European Community. (A rare case in which America might be behind social policy in Europe ?) The number of people on the public payroll here in the UK is growing almost exponentially and ""stealth"" taxes have been increased to finance this huge bureaucracy. Incentives to get off welfare and back into employment are disappearing fast and even middle income families expect and get tax credits for shouldering responsibilities that are strictly private choices and which should be economically neutral. But once ""free"" welfare services are rolling, they are very difficult to stop. No political party has any credible plan to even modify the rate of increase. The only (feeble) hope I can conjure that might eventually stall the idiotic growth of welfare systems is that, in the end, people will revolt against inferior services and the state will be compelled to retreat.","political-stance-helps-country-more","04:33 AM","government-debates","99"
"01-28-2005","1649",7,"Alan Ryan","None","I think what you're saying here applies perhaps with even greater force to the welfare ""paradise"" that is under construction in the European Community. (A rare case in which America might be behind social policy in Europe ?) The number of people on the public payroll here in the UK is growing almost exponentially and ""stealth"" taxes have been increased to finance this huge bureaucracy. Incentives to get off welfare and back into employment are disappearing fast and even middle income families expect and get tax credits for shouldering responsibilities that are strictly private choices and which should be economically neutral. But once ""free"" welfare services are rolling, they are very difficult to stop. No political party has any credible plan to even modify the rate of increase. The only (feeble) hope I can conjure that might eventually stall the idiotic growth of welfare systems is that, in the end, people will revolt against inferior services and the state will be compelled to retreat.","daewoo","88600","I don't think the US is lagging behind in this area. It has been a lot of years since there was any incentive to get off welfare here in the US. Most people who are currently on welfare never get off, and when their kids get old enough to collect (since they inevitably reproduce, we build benifits for reproduction into the system), they take their kids down and sign them up. The more kids you have, the more money you get, so we are effectively encouraging the dregs of society to reproduce at a disporportionatly high rate, thus ensuring that future generations will have even MORE layabouts to support. I can certainly understand the reluctance of any major political party to address the issue (that is the case here, too) since nothing motivates career welfare recipients to get out and vote like the suggestion that they might have to get a job. Personally, I have no problem with reasonable social programs. It is certainly cheaper and easier to pay off the lower end of society than it is to have to hold them back by force. When you are encouraging them to breed, and providing no incentive for them to improve their situation, it will not take long before there are more of them than the system can handle. The up side is that, as I pointed out earlier in the thread, economic circumstances are such in America that we will soon not have enough money to support those who, God bless them, just don't feel like working. Maybe as our european counterparts watch the wealthiest nation on the planet wither and die, they will learn something from the display. While massive social spending has certainly not been the main cause of the decline, it is certainly a major one.","political-stance-helps-country-more","05:39 AM","government-debates","100"
"01-28-2005","1649",7,"Alan Ryan","None","But once ""free"" welfare services are rolling, they are very difficult to stop. No political party has any credible plan to even modify the rate of increase. The only (feeble) hope I can conjure that might eventually stall the idiotic growth of welfare systems is that, in the end, people will revolt against inferior services and the state will be compelled to retreat.","georged","88603","In Western society, with politicians having harnessed themselves to popular opinion for election purposes, public welfare services are used to win elections. In the US free services permeate our society from college age through retirement, the entire span of voters. Modification of increase isn't even a consideration, expansion is what helps win elections. One looming factor about public services in the US is the current administration's coming effort to push many of those services from the federal level down to state and municipal levels. That will allow what they consider normal military expansion to continue in 2005-6 budgets. The problem there is that those programs will still have federal compliance legislation attached, with no funding. I live in a US state that has a constitution permitting no increase in public services or taxes without majority popular vote approval. Lawyers are now looking at how we'll cope with a potential increase in public service costs carrying federal legislation, which always uses federal highway and education funding as a bludgeon in coercing state compliance on all issues. And then there's Russia, with thousands of retired people demonstrating daily about reductions in their previously bare subsistence only pensions. Russia's attitude about what the public thinks hasn't changed much since being the czars, bullets always being less expensive and troublesome than civil disobedience.","political-stance-helps-country-more","09:01 AM","government-debates","101"
"01-28-2005","1649",7,"daewoo","None","Personally, I have no problem with reasonable social programs. It is certainly cheaper and easier to pay off the lower end of society than it is to have to hold them back by force. When you are encouraging them to breed, and providing no incentive for them to improve their situation, it will not take long before there are more of them than the system can handle. The up side is that, as I pointed out earlier in the thread, economic circumstances are such in America that we will soon not have enough money to support those who, God bless them, just don't feel like working. Maybe as our european counterparts watch the wealthiest nation on the planet wither and die, they will learn something from the display. While massive social spending has certainly not been the main cause of the decline, it is certainly a major one.","Alan Ryan","88604","I was struck by the healthy cynicism of your take on the wisdom of paying off the benefit seekers and unemployables rather than seeking to suppress them. A few years ago, I put a similar proposition before a group of pious social professionals at a seminar on ""workfare"": this caused a bogus outrage that resulted in some people almost censuring my very existence. Such a preferred remedy may meet the case while the ratio of those collecting benefit to those paying for it remains an economically viable number. But at least theoretically, unless the economy resumes its former prosperity, the tab will eventually become too big for the taxpayer to wink at any longer. One certainty we can count on is that no political party will grasp this nettle and readjust the situation so that genuinely needy people are assisted while the ""human right"" of freeloaders to live off the state is withdrawn.","political-stance-helps-country-more","09:04 AM","government-debates","102"
"01-28-2005","1649",7,"Alan Ryan","None","I was struck by the healthy cynicism of your take on the wisdom of paying off the benefit seekers and unemployables rather than seeking to suppress them. A few years ago, I put a similar proposition before a group of pious social professionals at a seminar on ""workfare"": this caused a bogus outrage that resulted in some people almost censuring my very existence.","georged","88605","Those employed distributing public money in the US normally enjoy salaries, benefits and immediate control far beyond the private sector, a circumstance that tends to put their assumed righteousness on a parallel with the Christian God.","political-stance-helps-country-more","09:15 AM","government-debates","103"
"01-28-2005","1649",7,"georged","None",". One looming factor about public services in the US is the current administration's coming effort to push many of those services from the federal level down to state and municipal levels. That will allow what they consider normal military expansion to continue in 2005-6 budgets. The problem there is that those programs will still have federal compliance legislation attached, with no funding. I live in a US state that has a constitution permitting no increase in public services or taxes without majority popular vote approval. Lawyers are now looking at how we'll cope with a potential increase in public service costs carrying federal legislation, which always uses federal highway and education funding as a bludgeon in coercing state compliance on all issues.","Alan Ryan","88607","This is a ""cunning stratagem"" or blackmail that deflects blame for rising taxes and cuts in essential services from national government to local political level. The success of this kind of manipulation (which is so regular as to be quite unremarkable here) depends of course on the apathy/ignorance of the ""voter in the street"". Nobody is supposed to notice what's going on. It's almost an argument for a more limited form of democracy than the universal franchise we have inherited and respect so much.","political-stance-helps-country-more","09:25 AM","government-debates","104"
"01-28-2005","1649",7,"Alan Ryan","None","I was struck by the healthy cynicism of your take on the wisdom of paying off the benefit seekers and unemployables rather than seeking to suppress them. A few years ago, I put a similar proposition before a group of pious social professionals at a seminar on ""workfare"": this caused a bogus outrage that resulted in some people almost censuring my very existence. Such a preferred remedy may meet the case while the ratio of those collecting benefit to those paying for it remains an economically viable number. But at least theoretically, unless the economy resumes its former prosperity, the tab will eventually become too big for the taxpayer to wink at any longer. One certainty we can count on is that no political party will grasp this nettle and readjust the situation so that genuinely needy people are assisted while the ""human right"" of freeloaders to live off the state is withdrawn.","daewoo","88608","When you consider the cost of electrified fences, armored cars, roving guards, attack dogs, and belt fed machine guns, it makes sense. Keep the unwashed masses in the gutter where they belong with enough to keep from starving to death and (more importantly) from rioting. The system has, as I think you are implying, broken down. No longer are we giving folks the minimum amount needed to keep them complacent. Now we have bred a whole generation of human leeches whose entire existence is Dependant on the legislated charitable contributions of those members of society who are actually productive. The problem is that we have raised the bar as far as what is expected to keep them complacent. No longer is just a roof over their head and enough food to keep them alive acceptable. Now welfare recipients it he US expect enough cash to be able to purchase and maintain a nice car, have a nice entertainment system, etc... These things are no longer considered luxuries, but the right of every American welfare recipient. It won't be long before we cannot afford to keep people at this level, and when we fail to do so, electrified fences, attack dogs, roving patrol, and belt fed machine guns may very well start looking more affordable. I would agree that government programs to help the truly needy is a noble cause. The problem seems to be that governments can not seem to differentiate between ""truly needy"" and ""human leech"".","political-stance-helps-country-more","09:31 AM","government-debates","105"
"01-28-2005","1649",8,"georged","None","One looming factor about public services in the US is the current administration's coming effort to push many of those services from the federal level down to state and municipal levels. That will allow what they consider normal military expansion to continue in 2005-6 budgets. The problem there is that those programs will still have federal compliance legislation attached, with no funding. I live in a US state that has a constitution permitting no increase in public services or taxes without majority popular vote approval. Lawyers are now looking at how we'll cope with a potential increase in public service costs carrying federal legislation, which always uses federal highway and education funding as a bludgeon in coercing state compliance on all issues.","daewoo","88611","I live in Kansas, where we are constitutionally bound to a balanced budget. Alreayd lawmakers are trying to figure out ways around this without upsetting the population in general. The last couple of years, they have used the low interest rates as an excuse to issue bonds for projects that traditionally were paid out of pocket. Now we are in a situation where not only do we not expect to have nearly enoguh money, we are servicing a deabt load that is nearly 5 times that of 10 years ago. Things do not look good. It is business as usual on just about every level though, since it is widely assumed that we will have they will simply raise taxes to make up the shortfalls. It will be interesting to see what kind of reaction that raises from the general public. Kansas is a radically republican state, and we have a democratic goverener. She has been under a microscope since she took office, and failure to present a reasonable budget will likely be the end of her.","political-stance-helps-country-more","09:40 AM","government-debates","106"
"01-28-2005","1649",8,"Alan Ryan","None","I was struck by the healthy cynicism of your take on the wisdom of paying off the benefit seekers and unemployables rather than seeking to suppress them. A few years ago, I put a similar proposition before a group of pious social professionals at a seminar on ""workfare"": this caused a bogus outrage that resulted in some people almost censuring my very existence. Such a preferred remedy may meet the case while the ratio of those collecting benefit to those paying for it remains an economically viable number. But at least theoretically, unless the economy resumes its former prosperity, the tab will eventually become too big for the taxpayer to wink at any longer. One certainty we can count on is that no political party will grasp this nettle and readjust the situation so that genuinely needy people are assisted while the ""human right"" of freeloaders to live off the state is withdrawn. The $240-million-a-year General Assistance Program intended mostly for single adults was eliminated, ending welfare checks for nearly 83,000 people. In the aftermath, Engler was widely viewed as a coldhearted bureaucrat who was more concerned with balancing budgets than with the pain and suffering of poor people. His popularity sank across the state, polls showed. As it turned out, Michigan was on the vanguard of a national movement to change welfare, putting more focus on work. By the time Engler sought re-election in 1994, none of the three Democrats seeking the nomination proposed a return to the General Assistance Program. http://www.freep.com/news/mich/gov16_20020116.htm","JPSartre12","88616","All is not lost, IMO. When John Engler(R), governor of Michigan, cut the state's welfare role by 250,000 the roar from liberals was almost deafening, but with a Republican Statehouse behind him, he succeeded and even the Democrats in Michigan had to admit that ""tough love"" works. I think that for us to break the dependency on the Federal gov't, we need Washington to wean itself off of Federal social engineering programs. At first, send them back to the states with a concommittant reduction in the state's Federal tax burden. Then, let the states decide which programs it wants to keep...and more importantly, fund locally. With time, I think that you'd see a curious phenemonon take place. Indigents will ""shop states"" to find the best free benefits initially until the population of that state wises up and quickly moves to become more ""heartless"". I'm guessing that in 10 years, California would be transformed from the land of liberal fruits and nuts to the land of heartless Capitalists as California voters tire from the huge influx of street urchins from across the country seeking ""liberal freebies.""","political-stance-helps-country-more","09:56 AM","government-debates","107"
"01-28-2005","1649",8,"JPSartre12","None","With time, I think that you'd see a curious phenemonon take place. Indigents will ""shop states"" to find the best free benefits initially until the population of that state wises up and quickly moves to become more ""heartless"". I'm guessing that in 10 years, California would be transformed from the land of liberal fruits and nuts to the land of heartless Capitalists as California voters tire from the huge influx of street urchins from across the country seeking ""liberal freebies.""","Alan Ryan","88622","I was amused by your phrase ""liberal fruit and nuts"" and the idea of an army of benefit hobos riding the railroads of America seeking the best welfare deal they can find. Unfortunately, it's the ""liberal fruit and nuts"" who dream up and justify the social engineering programs that cause the problems being discussed here. These people infest the top echelons of government and the media as well as acting as ""thought police"" in the universities etc. Only a new generation of well educated conservatives (with a small ""c"") might redress the balance when they occupy those positions of influence and power which count. This will take many years. Can the American taxpayer hold out that long ?","political-stance-helps-country-more","10:22 AM","government-debates","108"
"01-28-2005","1649",8,"daewoo","None","I live in Kansas, where we are constitutionally bound to a balanced budget. Alreayd lawmakers are trying to figure out ways around this without upsetting the population in general. The last couple of years, they have used the low interest rates as an excuse to issue bonds for projects that traditionally were paid out of pocket. Now we are in a situation where not only do we not expect to have nearly enoguh money, we are servicing a deabt load that is nearly 5 times that of 10 years ago. Things do not look good. It is business as usual on just about every level though, since it is widely assumed that we will have they will simply raise taxes to make up the shortfalls. It will be interesting to see what kind of reaction that raises from the general public. Kansas is a radically republican state, and we have a democratic goverener. She has been under a microscope since she took office, and failure to present a reasonable budget will likely be the end of her.","georged","88629","Sorry to point this out, but California also has a balanced budget constitution. Last fall Arnie went to market with $15 billion in general obligation bonds (CA rated near junk bond status for bonds not tied to a tax revenue stream) to tide them over budget shortfalls. Many states are following federal direction of balancing budgets with public debt. The general public is so apathetic and lacks knowledge about finance, as evidenced by their personal fiscal habits, that legislators can assign legal staff to provide interpretations to do just about whatever they want.","political-stance-helps-country-more","10:31 AM","government-debates","109"
"01-28-2005","1649",8,"Alan Ryan","None","I was amused by your phrase ""liberal fruit and nuts"" and the idea of an army of benefit hobos riding the railroads of America seeking the best welfare deal they can find. Unfortunately, it's the ""liberal fruit and nuts"" who dream up and justify the social engineering programs that cause the problems being discussed here. These people infest the top echelons of government and the media as well as acting as ""thought police"" in the universities etc. Only a new generation of well educated conservatives (with a small ""c"") might redress the balance when they occupy those positions of influence and power which count. This will take many years. Can the American taxpayer hold out that long ?","daewoo","88631","It is not as outlandish as it may sound. Just west of here is Chase County. Chase county is the typical central kansas dying agricultural community, with one exception. They have incresed in size at a fairly alarming rate. Apparently wlefare in Chase county is higher than in other parts of the state because chase county is the poorest county in the state and has the highest number of ""disadvantaged"" people per capita (in fact the leeches outnumber the productive folks). People end up in chase county not only from otehr parts of the state, but from oklahoma as well, sinc ekansas pays better than oklahoma, and if you are goin gto move for a paycheck, you may as well maximise the benifit. Not a chance. Just looking over the new GDP numbers. 3.1% growth. Subtract from that deficit and debt service, and you are looking at negative growth. If you want to really scare yourself, there is an awful lot more you can subtract from it to get a better idea of the US economy (military spedning comes to mind). Currently, we have supposedly conservaitve republicans bowing down in worship of a president who passed the biggest social program in recent history. Waiting for true conservatives to come along is not likely an option.","political-stance-helps-country-more","10:38 AM","government-debates","110"
