"Date","DiscussionId","PageId","QuoteAuthor","QuoteId","QuoteText","ResponseAuthor","ResponseId","ResponseText","Subtopic","Time","Topic","postCounter"
"03-12-2003","376",1,"None","None","None","Debater","4537","Do you think the govt should be able to keep track of everyone's library accounts? Currently the FBI and the HSD can look at your library history without a warrent.","govt-library-searches","05:17 PM","government-debates","1"
"03-12-2003","376",1,"None","None","None","Crim","4545","I don't really care.","govt-library-searches","05:44 PM","government-debates","2"
"03-12-2003","376",1,"None","None","None","kelvin90701","4568","What you check out at the library reflects what is happening inside your brain. Do you feel safe that state has the ability to know what is inside your brain?","govt-library-searches","09:21 PM","government-debates","3"
"03-12-2003","376",1,"None","None","None","Crim","4570","It doesn't reflect your exact thoughts. Knowing that I like Tolkien or that I'm writing a paper on X isn't real vital information.","govt-library-searches","09:36 PM","government-debates","4"
"03-14-2003","376",1,"None","None","None","gilligan8503","4689","what could you possibly check out in the library that the government would be suspicious over? they already burn books that are on the government's ""black list"" (such as the turner diaries and the anarchist's cookbook) of course you have the right to own them, but not in public, or they will confiscate it. my point is: the government already shields us from certian information. (government meaning u.s.a. gov.)","govt-library-searches","12:47 AM","government-debates","5"
"03-14-2003","376",1,"None","None","None","Debater","4741","books that explain terrorism or bombs and that kind of stuff if someone checks out a book like that the library notifies the government and they check it out.","govt-library-searches","12:13 PM","government-debates","6"
"11-29-2003","376",1,"None","None","None","Morfos","24663","The Government should not be doing this. It has no right to find out what books you are buying. It has no right to know what you like to read. I despise the Patriot Act and everything else that allows the Government to spy on innocent people without permmision.","govt-library-searches","07:52 PM","government-debates","7"
"12-03-2003","376",1,"None","None","None","smokefree","25397","well you should care because preety soon they'll be checking your identity and what movies you watch (sarcastically) and what you do in your everyday life. they have eyes (cameras and spies) every where don't turn your backs or they'll have you as their suspects. Look at me no authority ever comes near me you know why? it's because they can't control you. the more you fear them the more you let them have their power.","govt-library-searches","07:08 PM","government-debates","9"
