"Date","DiscussionId","PageId","QuoteAuthor","QuoteId","QuoteText","ResponseAuthor","ResponseId","ResponseText","Subtopic","Time","Topic","postCounter"
"01-19-2009","12202",8,"Matthew","340749","Archie, it is my contention that everyone's interpretation of the Bible is motivated by contingencies of his personal value system, and by much else besides. This applies to the authors of the Bible themselves, to the founders of Christianity, to you, and even -- it should go without saying, but for clarity's sake, I must mention it -- to me. But I have never said that this is the reason why your literalist view is false. To do so would clearly be ad hominem. And if that's what you think I've done, I think you've misunderstood me entirely. As to my other complaints, however, those certainly stand. I have never called you a ""pseudo-Christian"" or a ""mental midget."" I have never questioned the sincerity of your beliefs or declared you spiritually dead. And I have certainly never placed myself on a ""higher plane of understanding"" than you or any other poster. And I am mighty sick and tired of repeatedly receiving such abuse in an ostensibly reasonable discussion. That's great, Archie. I have found some of your personal comments quite moving. But how do they solve any of the issues in this debate? And I'm sorry, but this doesn't even hold up in the Gospels. The first use of ""Lord"" in the New Testament (NIV) is at Matthew 1:20. It appears throughout the Christmas story, and during neither that passage nor what follows can ""Lord"" be described as an unambiguous reference to the Person of the Son. Compare similar passages in the beginning of Luke. Especially note Luke 1:31-33, when the angel visits Mary : ""31 You will be with child and give birth to a son, and you are to give him the name Jesus. 32 He will be great and will be called the Son of the Most High. The Lord God will give him the throne of his father David, 33and he will reign over the house of Jacob forever; his kingdom will never end."" It is clearly Jesus, the Son, who will be given the throne of David by ""the Lord God."" So I daresay the author was not saying that the Son would give the throne of David to himself. So I think if my refusal to accept ""Lord"" as an unambiguous reference to Jesus Christ indicates something horrible about my spiritual discernment to you, you are not reading the Bible all that closely. Not so. Even if the words aren't literally true, they may reveal God's truths. So you can keep making this charge, but it will never hold water. When are you going to learn that, since I do not regard the Bible as literal, infallible, or authoritative, that appealing to it is not enough to convince me of anything?","Archangel","340790","Regarding the bolded: That's all the evidence needed to prove that you don't have a personal relationship with God through Christ Matt. If the Holy Spirit indwelled you, you would know and believe that it's inspired by God at every level of your being. It doesn't matter what your motivation is Matt, the fact is that you are more dedicated to debating every aspect of my interpretation of the bible than you are in correcting the deniers of God and His word. You claim to be a follower of Christ yet you are dividing the house by opposing an alleged brother in Christ rather than defending Christ with Him against those who slander and blaspheme God here. You are a blatant hypocrite in your denials and inconsistencies as a so called believer. Look at subaru's blasphemies? Have you once spoken against him/her? No! in fact once you even referred to his post in a complimentary fashion as you attack my beliefs. But you just don't get it, do you! Sorry if the truth offends you Matt. You are free to either not respond to my posts or to put me on ignore. If you don't spew your shallow fleshly interpretations of the bible as you oppose me, I wont expose them or you for what they/you are. They were attempts to reach YOU with the truth Matt. I'm not here to hurt you or beat you. I'm trying to get you to look inward and to see your spiritual need which can only be satisfied by a personal relationship with the living God. Sure it can, and it does. Because the Son, in His eternal position is the Word of God and Lord of all who spoke creation into existence. So the Angel of the Lord was referring to the same person who was to be born to Mary. He even makes it clearer by attributing her pregnancy to the Holy Spirit. How many Lords could the bible be referring to Matt, under such a circumstance? The problem is that you don't have the Holy Spirit to guide you according to the promise Jesus made to us before He left to prepare a place for us with Him. If you did, this would be a no brainer for you. True, this reference is to Lord God the Father. Again, it's obvious and this time you recognized it accurately. Did I say that every single reference to the Lord in the bible was referring to Jesus? Absolutely NOT. All I said is that your inability to tell when it does is very telling about your spiritual condition. You are attempting to interpret the word with the flesh, and I'm trying to tell you that it isn't possible. Only through the power of the Holy Spirit does Gods word come alive to us. This isn't to say that you can't get where you need to be. I'm only saying that you aren't there yet, spiritually speaking. Again you corrupt what I say. I never said that every reference to the Lord was an unambiguous reference to Jesus. Maybe that's true in your mind, but it isn't true to God. And in the final analysis that is all that matters. When are you going to realize that this statement is all the evidence that's required to prove that you aren't a born again christian/believer in Christ as you falsely claim to be. If the Holy Spirit indwelled you according to the promises of Jesus Christ the Savior, you would never make such a statement. You couldn't make such a statement. This is why my statement is absolutely true that you have more in common with the atheists, the secular humanists and the unbelievers than you have with me. So please stop claiming to be a member of the family of God and a believer who just happens to disagree with a fellow believer Matt. Because we have absolutely nothing at all in common. We are literally from different worlds my friend. And I have no problem relating to you on that level at all. Nor answering your questions. But to lie to these other unbelievers while claiming the authority of a true believer as you deny the power there of is a serious sin which God will not look kindly on. I repeat Jesus prayer to the Father before dying for our sins, on behalf of TRUE believers. Jhn 17:14 I have given them your word and the world has hated them, for they are not of the world any more than I am of the world. Jhn 17:15 My prayer is not that you take them out of the world but that you protect them from the evil one. Jhn 17:16 They are not of the world, even as I am not of it. Jhn 17:17 Sanctify [fn] them by the truth; ""your"" word is truth. If Gods truth was evident in you, this passage would be fulfilled within you. See the bolded Matthew? The word is the bible which Jesus is calling Gods truth. Your statement above means you are calling both Jesus and Father God a liar. Would a true believer be able to do that? The answer is no. By denying the truth of Gods word you deny God Himself. I don't know how many different ways I can clarify this for you. But with each new post you write, you just further prove how lost you are. Sorry, but it's better that you know the truth of your standing rather than waste a lifetime piously denying the truth of your true standing with the living God. Only after accepting that truth can you move on to find the whole truth which only comes by way of the word of God.","global-conspiracy-scientists","08:56 AM","creation-intelligent-design-vs-evolution","116"
"01-19-2009","12202",8,"marc9000","340717","The creationists here usually fight their own battles well enough, but some things are difficult to let get by. A couple of months may not be good enough to make a judgment like you have made. A couple of years might be better. For example, read posts.....8 thru 18 of this thread, or even the entire thread if you have time. Other archive reading would be helpful for you also.","trebor","340793","I always wondered why denial of evidence, lies, straw men, and avoidance of issues are considered 'fighting their own battles well enough'.","global-conspiracy-scientists","09:32 AM","creation-intelligent-design-vs-evolution","117"
"01-19-2009","12202",8,"Archangel","340790","That's all the evidence needed to prove that you don't have a personal relationship with God through Christ Matt. If the Holy Spirit indwelled you, you would know and believe that it's inspired by God at every level of your being.","Matthew","340796","And yet again, you declare that if someone doesn't experience or understand his relationship with God the way you experience and understand yours, then he has no such relationship. -sigh- Rationalize all of this however you want. But I've had enough. Shalom.","global-conspiracy-scientists","10:02 AM","creation-intelligent-design-vs-evolution","118"
"01-19-2009","12202",8,"Matthew","340796","And yet again, you declare that if someone doesn't experience or understand his relationship with God the way you experience and understand yours, then he has no such relationship. -sigh- Rationalize all of this however you want. But I've had enough. Shalom.","Archangel","340799","You still can't see it, can you Matt. You still don't understand that I'm not asking you to do anything my way. I am and have been showing you the simple Gospel of Christ which is the ONE way to receive HIS salvation. There is no other way. Don't believe me Matt, but if you SINCERELY hunger for His truth at all, and this isn't just some pseudo intellectual exercise to you, then please listen to ""Jesus Himself"" when He explained it to Nicodemus. Jhn 3:1 Now there was a man of the Pharisees, named Nicodemus, a ruler of the Jews; Jhn 3:2 this man came to Jesus by night and said to Him, ""Rabbi, we know that You have come from God {as} a teacher; for no one can do these signs that You do unless God is with him."" Jhn 3:3 Jesus answered and said to him, ""Truly, truly, I say to you, unless one is born again he cannot see the kingdom of God."" Jhn 3:4 Nicodemus *said to Him, ""How can a man be born when he is old? He cannot enter a second time into his mother's womb and be born, can he?"" Jhn 3:5 Jesus answered, ""Truly, truly, I say to you, unless one is born of water and the Spirit he cannot enter into the kingdom of God. Jhn 3:6 ""That which is born of the flesh is flesh, and that which is born of the Spirit is spirit. Jhn 3:7 ""Do not be amazed that I said to you, 'You must be born again.' Jhn 3:8 ""The wind blows where it wishes and you hear the sound of it, but do not know where it comes from and where it is going; so is everyone who is born of the Spirit."" Jhn 3:9 Nicodemus said to Him, ""How can these things be?"" Jhn 3:10 Jesus answered and said to him, ""Are you the teacher of Israel and do not understand these things? Jhn 3:11 ""Truly, truly, I say to you, we speak of what we know and testify of what we have seen, and you do not accept our testimony. Jhn 3:12 ""If I told you earthly things and you do not believe, how will you believe if I tell you heavenly things? Jhn 3:13 ""No one has ascended into heaven, but He who descended from heaven: the Son of Man. Jhn 3:14 ""As Moses lifted up the serpent in the wilderness, even so must the Son of Man be lifted up; Jhn 3:15 so that whoever believes will in Him have eternal life. Jhn 3:16 ""For God so loved the world, that He gave His only begotten Son, that whoever believes in Him shall not perish, but have eternal life. Jhn 3:17 ""For God did not send the Son into the world to judge the world, but that the world might be saved through Him. Jhn 3:18 ""He who believes in Him is not judged; he who does not believe has been judged already, because he has not believed in the name of the only begotten Son of God. Jhn 3:19 ""This is the judgment, that the Light has come into the world, and men loved the darkness rather than the Light, for their deeds were evil. Jhn 3:20 ""For everyone who does evil hates the Light, and does not come to the Light for fear that his deeds will be exposed. Jhn 3:21 ""But he who practices the truth comes to the Light, so that his deeds may be manifested as having been wrought in God.""","global-conspiracy-scientists","10:54 AM","creation-intelligent-design-vs-evolution","119"
"01-19-2009","12202",8,"marc9000","340720","That may very well be, but theres no guarantee that its always a good thing, if there are costs involved. One of the things thats always said to me on these forums is that evolution (a belief in a common ancestor for both humans and animals) works. I dont agree that it always works, if it puts the interests of animals above those of humans, or imposes questionable costs. The movie Expelled, and several books (of both extremes) tell me that it [the atheist take-over of science] may be closer than we think. Ever hear of The God Delusion by Dawkins... ...or Victor Stengers The failed hypothesis how science shows that God does not exist? How about this statement: ""'Anything we scientists can do to weaken the hold of religion,' says Nobel Prize winner Steven Weinberg, 'should be done and may in the end be our greatest contribution to civilization.'"" I'm told that statements like that are just one persons opinion, and don't mean a thing. If his statements don't mean anything, how did he get his Nobel Prize? ...am I saying that I want products (like clindamycin) to not be produced just because religious people may not want it to be produced? My answer is that it depends on the reasons put fourth by religious people. If the religious people say they dont want it because they believe in prayer over modern medicine, then I usually dont agree with them. But if the religious people say they dont want it because their knowledge of money management as described in the Bible says that our society cant afford it, then I may agree with them. The ever increasing problem we have in the US is that a demand for a product is often a lot larger than a willingness to pay for that product. Going back to the prop 71 example, Reeve, Fox, Hoffman and Pitt all wanted a product (research results), but they certainly werent willing to pay for it out of their own pockets. Many, probably most, people who demand new drug technology also demand that their insurance company pay for it. Often they dont stop to think where insurance companies get money, because they dont care. Not caring isnt a good glue to hold a society together. Taxing people for unlimited scientific research is just as wrong as taxing them to redistribute their wealth, because it can be the same thing! Do you think its an area of concern when most statistics clearly show that there is a disproportionate balance of scientists who are atheists vs the general public who are atheists? Its complicated, but much complicated literature has been written claiming that values can/do come from Darwinian evolution. My point is that God is either absent or present. If Spencer, Darwin, Lewontin, Dawkins, Wallace, and Gould all have positions that differ greatly, its very significant that they have one big thing in common, a non-belief in Gods involvement. Opinions in US politics vary all over the place, but when all is said and done, we almost always see a two way conflict. Its the reason we have only two major political parties. We always hear the terms religious right or atheist left (secular left, humanist left, etc.) but we never hear of religious left or atheist right, do we? If Spencer, Darwin, Lewontin, Dawkins, Wallace, and Gould cant agree on anything else, they can always agree on one thing that the book of Genesis is wrong, that creationists are wrong. Its a big political uniter.","Matthew","340803","I'm afraid I don't understand where you're coming from here. Evolution ""works"" in the scientific sense: it explains disparate phenomena, and it yields testable predictions. There is nothing about evolution that requires us to place any particular relative value on the interests of humans and animals. I do think that disregarding the interests of animals, and of all other organisms, is deeply unwise even from the standpoint of human interests. For our own long-term existence depends crucially on how well the environment around us continues to function. But this is an entirely general position, which leaves open the question of what particular actions would be wise or unwise. And perhaps more pertinently to this discussion, it's not a position that derives from evolution. And I really don't understand what you mean by ""questionable costs."" Do you have in mind the economic side of the ""particular actions"" I alluded to in my preceding paragraph? Because as I said before, I think there are clearly trade-offs that have to be made. But evolutionary biology is not what decides which to make and which not to. Perhaps I've misunderstood you (and perhaps you didn't even have economics in mind). I confess that I haven't seen Expelled . In part, I will admit, this is because I have heard some very bad things about it, including deception practiced by the film-makers to get some of the biologists to participate. But perhaps I will go and take a look sometime. Sure. It's a non-science book written by a scientist. I read it. I thought his view of theism was superficial and dismissive of the diversity of theistic options available, and I found his grasp of certain ideas and arguments to be tenuous. On the other hand, I do think he made some good points about the dangers of religious extremism and about morality transcending particular religions, and my favorite part of the book was his evolutionary explanation of why traditions are maintained. Overall, it was decent, but nothing world-changing. Not for me, at least. I've seen it, but I haven't read it. I've read similar arguments before, though, and I don't think that science is capable of showing any such thing. Atheistic philosophers are running a better track, but I don't think they've disproved the existence of God, either. There are plenty of atheistic scientists and philosophers who actually agree with that assessment (e.g. Michael Ruse or Philip Kitcher). But this is a bit misleading! Because he didn't get his Nobel for his statements about religion . He got it for his statements about science . I still have trouble thinking that these fellows' views qualify as a take-over of science. There have been scientists themselves, including biologists -- e.g. Ken Miller or Francis Collins or Francisco Ayala -- who reject these guys views on religion, often quite publicly. And they have no trouble at all getting their work published, just as many other religious scientists don't. Fair enough. But my point is, this is an economic argument. It has no bearing at all on evolution's merits as biology . As I've said, there are most definitely economic trade-offs involved here. If you think research into any particular field is not something we can afford, that's fine. You're free to say so, and to vote for people who think so as well. Just as we all are. But no governmental funding decisions will determine what is or isn't correct science. So I'm afraid that I still don't see your point with this line of argument. No. Science is grounded in empiricism. It is neutral on the metaphsyical question of theism vs. atheism: whether God exists or not, the empirical evidence remains what it is. Because of this neutrality, science has been far more tolerant of atheism than the rest of society. It is only natural that atheists would gravitate there. And keep in mind that while science is compatible with atheism, it is also compatible with theism. It doesn't require either one. So no, I don't see any reason to worry. Indeed. But many of those claims are false ! This is especially so when one attempts to derive particular ethical injunctions from general features evolved in human nature -- e.g. human beings are evolved to cooperate and therefore ought to be socialists, or men are evolved to be stronger than women and therefore women should not serve in the military. But why is that so significant? People like Miller or Collins take quite a different view. What they have in common with the above guys is a belief in evolution, not atheism. Moreover, I've even read some post-modernists (and I apologize, but no names are coming readily to mind; po-mo is not really my thing) who are atheists but anti-evolutionists (they see both science and religion as efforts at social control). The questions of whether or not life evolved and whether or not God exists are entirely independent of each other. You could answer either question either way, with no necessary implication for how you must answer the other question. I think that's far too simple. Because there are lots of diverse opinions covered under those blanket groupings. The ""religious right"" is most commonly associated with evangelical Christians, but it also contains many Catholics and Mormons. The ""secular left"" includes Marxists like Gould and non-Marxists like Dawkins, and many an anti-scientific post-modernist comparative literature professor, as well. And actually there is growing ""religious left"" in this country, as can be seen with people like John Shelby Spong or Jim Wallis or Robert McElvaine. There's also an ""atheist right"" -- just consider Christopher Hitchens, for example. And there are people who don't neatly fit these categories. For example, the followers of Ayn Rand (also known as Objectivists) are certainly atheists, but like many ""libertarian""-ish groups, their economic policies seem right-wing while their social policies seem left-wing. And how the heck do we categorize Buddhists? You forgot to mention Miller, Collins, Ayala, et al , from the camp of Christian biologists! For you see, it's not a matter of political unity, and still less is it a matter of religious unity. It's a matter of scientific unity. The overwhelming majority have been convinced, on the basis of evidence, that a literal reading of Genesis is, in fact, wrong. Beyond that, however, they have widely divergent views of just how non-literally true and/or otherwise meaningful it is.","global-conspiracy-scientists","11:28 AM","creation-intelligent-design-vs-evolution","120"
