"Date","DiscussionId","PageId","QuoteAuthor","QuoteId","QuoteText","ResponseAuthor","ResponseId","ResponseText","Subtopic","Time","Topic","postCounter"
"12-26-2008","12141",4,"Lomu","338006","Point of order here: you've made the assertion- it's now your responsibility to provide evidence for it. Either that, or retract. I too would very much like to see this- do you have any weblink for this?","Archangel","338010","Hi Lomu, welcome to the forum, I think. Here are 5 problems I have with Carbon dating. The question is, if a process is reliable, why must a target date be submitted with a sample before testing? Why isn't blind testing done if the process is consistent and reliable? 1. Carbon dating depends upon atmospheric carbon. This is not always consistent, and is partly related to sunspot cycles. 2. Carbon dating tries to get verified via dendrochronology which results in a circular reasoning problem as I pointed out above. 3. Carbon dating can give so many different results for even one sample that a target date is required to be submitted by most labs. 4. Compared to historical dates, carbon dating is systematically too young from about 100 BC back to about 2600 BC 5. There are known examples of wild discrepancies in carbon dating because of environmental circumstances. Carbon absorption from the environment varies significantly. Those are a fast five reasons. There are others but plenty of material is on the web. And every dating method has its own problems. Here's an explanation of why all dating methods have their own unique problems. Keep scrolling down to the next section for problems with K-ar dating method specifically. - Radiometric Dating Game -","built-redundancy-vs-vestigal-organs","06:20 PM","creation-intelligent-design-vs-evolution","46"
"12-26-2008","12141",4,"None","None","None","Matthew","338014","Archangel: ""Although your point accurately fits the false faith evolutionists have in this pseudo, man made science, it fails miserably when applied to believers in Christ."" Not to all believers in Christ. I have met many Christians who regard belief on the basis of faith as quite distinct from knowledge. And I've read more than a few as well. Archangel: ""You see Matthew, I do have first hand personal knowledge and experience regarding Gods interaction with human beings by way of His direct involvement in my life through supernatural intervention by way of His Holy Spirit which indwells all believers, and me personally."" And if you were content to treat that personal knowledge as something that were truly personal -- as somthing that indeed could not by its very nature be communicated to others without completely changing its meaning and significance -- well, then I don't think we'd be having this discussion. I happen to be an ardent admirer of Kierkegaard, who I think was the most insightful religious thinker of the last two centuries, bar none. ""Christianity is subjectivity"" -- now that is something for any and every believer to mull over, for a long time. ----- Archangel: ""It's true that I wasn't there during either the Creation event, or when Genesis was written. Just as you weren't there when the Earth was created or life began from your perspective."" At least we agree on something ! Archangel: ""The difference between us is that my faith in my Gods word is trustworthy, faithful and well placed because He is truly God."" I have absolutely no doubt that you are convinced of this. But I'm not convinced that your religious beliefs are even remotely correct, and it's going to take a lot more than sincerity to convince me. I want some reasons, and non-circular reasons at that. Archangel: ""But your faith"" -- Whoa, whoa, whoa. Wait just a minute. What do you know about "" my faith?"" Isn't it just a tad presumptuous of you to says what I believe? Okay.Back to the point. Archangel: ""But your faith is in the shallow observations of men who have completely misinterpreted the available evidence which can just more easily fit my scenario than yours."" Please be specific about the misinterpretations. Because there is a lot of evidence out there. Archangel: ""In other words Matthew, it takes more faith to believe as you do than it does for me to believe as I do..."" I disagree, because I think you're confusing ""inference"" with ""faith."" But even granting your point, if you take faith to be a good thing, then the above cannot serve as a criticism of my beliefs. Be consistent. Archangel: ""...since I personally know my God is alive and well and is not a liar."" Again, if you explored and acknowledged the constraints of that qualifier ""personally,"" I'm not sure we'd have much to argue about. Archangel: ""Therefore, even though I never personally observed what He say's about the 6 day creation event, I know He is trustworthy in His word and deed."" -sigh- Which now means that you are not going to require direct observation as a criterion of knowledge. So what we need to argue about is what reasonable criteria other than direct observation there are. And I don't think that appeals to the infallibility of literal interpretations of religious texts are reasonable. They are not literally true, as can be ascertained by the time you get through chapter 2 of Genesis. And no text is infallible, especially not just for the reason that it says so. Archangel: ""Can you say the same about the men who's science you follow? I think not."" To the contrary, I think so in the case of science. And I think so, because all science does is start with the ways that we know anything at all -- including something as simple as ""I am a human being, sitting in front of a computer"" -- and refine them so that we can know a lot more than what's right in front of us at any given time. If scientists were half as misguided as you seem to think they are about things that they cannot observe directly, then you and I wouldn't be able to have this discussion, because computers and the internet wouldn't work. ----- Archangel: ""The stick in the water which bends is a perfect example of the inconsistency and false results which evolutionists come to in every aspect of how they misinterpret the observations they claim is evidence for evolution."" Specifics please. This is just an empty declaration. It certainly doesn't address the point I made with the stick in the water example, which is that even direct observations can be misleading. ----- Archangel: ""Follow these debates for a while and you will see your evolutionist cohorts making all kinds of absolute statements of fact until I XXXX holes in them..."" All due respect, but I've been lurking for a couple weeks getting my bearings before finally now posting and entering the fray. I've looked at a lot of threads. I have yet to see you blowing holes in anything. I'm sure you disagree. But what of that? I think they've won the day, and you don't realize it. Perhaps you don't want to realize it. Archangel: ""...then they will claim science is based on ever changing input which clarifies the end result."" It is! Science is never final. If there's a better explanation of biological diversity than evolution out there, sooner or later, someone will find it, and sooner or later, it will supplant evolution. At present, neither Intelligent Design nor any other brand of creationism are anywhere close to that. Fallibilism is a big difference between science and religion -- or at least between science and fundamentalist religion. ----- Archangel: ""But in real science, there are absolute laws of physics which dictate consistent and reliable outcome."" Not true, on a number of points. First, I think it incorrect to equate ""physics"" with ""real science."" Not that physics is a false science, mind you! But just because it's useful to study fundamental forces and particles in a given way, doesn't make that way the touchstone for studying more complex systems. This was a major failing of the philosophy of science in the late 19th and early 20th century: it kept taking physics as the model for everything, and not everything is so simple. Second, there is a great deal of question about what the ""laws"" of physics are. Whether they have any causal efficacy and can therefore ""dictate"" outcomes is a very controversial idea. These days, many philosophers and scientists would say that physical laws are just formulae that we human beings construct and use to understand nature. They in no way constrain nature itself, they merely enable our knowledge of it. Finally, laws of nature allow predictions about future observations, but those predictions are rarely 100% accurate. Which makes sense, because the observations from which they were derived weren't unanimous either. There are always little discrepancies here and there. (Or do you imagine that when Newton formulated the law of gravitation, all his observations fit it perfectly? Come on!) Even if they are causal -- which is, as noted, very much in question -- laws of nature are very far from ""dicating"" what happens. Archangel: ""But not in evo. That is as fluid as an ever changing fairy tale which must constantly adjust to answer for newly discovered evidence which conflicts with and contradicts prior assumptions."" What, specifically, is the problem here? On the basis of new evidence, old assumptions are questioned. Why is that bad? ----- Archangel: ""They [scientists] call 5,000 or 10,000 year old fossils are 200 and 300 million years old, and older."" Please. If they have evidence that a fossil is only five or ten thousand years old, they call it five or ten thousand years old. If they have evidence that it's two or three hundred million years old, they call it two or three hundred million years old. Archangel: ""They have taken the same object and tested it 5 times with the same machine and come up with 5 different ages for it."" And when that happens, they try to figure out which age is right. They also try to figure out why some of the results were wrong. Again, perhaps some specifics would help here. Archangel: ""They can't accurately allow for different rates of decay since they don't know the objects age before testing it. So the whole process is based on circular reasoning at its most basic level."" What does ""different rates of decay"" mean? And how's it circular? A given radioactive isotope of carbon, say, has a particular decay rate. This rate can be ascertained independently of any fossils in which it might appear. I suppose it might vary with certain conditions, but those can also be ascertained independently of any particular fossil. And disparate conditions within a particular fossil can be accounted for. So where's the problem? ----- Archangel: ""What I marvel at is allegedly intelligent, minds of analytical scientists can't see these obvious contradictions in their methodology."" Spoken like Wonko the Sane: it's everyone else who's wrong, not you. Sorry, but that's the way I think of most creationists, and you are providing a wonderful case in point. ----- Archangel: ""This requires spiritual discernment. Something the natural man could never relate to."" And here, I think, is the root of our disagreement. You are claiming privileged access to a mode of knowledge that isn't available to others. Nothing could be further from how science operates. If you want to claim such a power that the great unwashed don't posses, fine. But for pity's sake, don't be surprised when they disagree with you, and don't waste your time trying to convince them to do otherwise. Seriously, I often wonder why creationists participate in these exchanges at all. Who are you trying to convince? Because on your very own view, you can't be trying to convince the natural man! Who, then? Who, indeed.... ----- Archangel: ""Every other belief system on Earth apart from Christ is a cult designed specifically to satisfy mans innate desire to worship God whild simultaneously leading men away from the living God. We are in a spiritual battle, but the natural man is clueless to the reality of this struggle between good and evil."" And this sort of transparently self-serving exclusivism is exactly the problem with religious conservatism. Archangel: ""This is why the bible say's that ""'f we grope out into the darkness, God will find us' and ""'f we seek the truth, the truth will set us free'. It's also why each man must seek God personally and not rely on the word of others before committing to a so called religious commitment."" But it's a rather strange version of ""everyone has to do it for themselves"" that then demands everyone to find the same ""it"" at the end of the search! Archangel: ""This might shock you but I hate religion. It is a man made concept which has led astray and corrupted countess people throughout history, many of the most powerful and most corrupted religious leaders in history have been popes who claimed to speak for God but never even knew Him personally."" And I couldn't agree more! I just think that creationism is a prime example of a concept that corrupts. Archangel: ""So Christianity isn't a religion my friend, it's a relationship with a living God who created us in His image, with free will for willing fellowship with Him as His children who have the choice, but choose to be with Him."" Maybe so, but what does that relationship have to do with literalism in the interpretation of the Biblical creation story? I regard creationism as textual idolatry , pure and simple.","built-redundancy-vs-vestigal-organs","07:02 PM","creation-intelligent-design-vs-evolution","47"
"12-26-2008","12141",4,"None","None","None","Matthew","338015","Sorry that was so long! I've had some time to kill today. I'll try to be more succinct in future posts. Though we philosophers are a wordy lot.","built-redundancy-vs-vestigal-organs","07:04 PM","creation-intelligent-design-vs-evolution","48"
"12-26-2008","12141",4,"Archangel","338010","Hi Lomu, welcome to the forum, I think. Here are 5 problems I have with Carbon dating. The question is, if a process is reliable, why must a target date be submitted with a sample before testing? Why isn't blind testing done if the process is consistent and reliable? 1. Carbon dating depends upon atmospheric carbon. This is not always consistent, and is partly related to sunspot cycles. 2. Carbon dating tries to get verified via dendrochronology which results in a circular reasoning problem as I pointed out above. 3. Carbon dating can give so many different results for even one sample that a target date is required to be submitted by most labs. 4. Compared to historical dates, carbon dating is systematically too young from about 100 BC back to about 2600 BC 5. There are known examples of wild discrepancies in carbon dating because of environmental circumstances. Carbon absorption from the environment varies significantly. Those are a fast five reasons. There are others but plenty of material is on the web. And every dating method has its own problems. Here's an explanation of why all dating methods have their own unique problems. Keep scrolling down to the next section for problems with K-ar dating method specifically. - Radiometric Dating Game -","Penfold","338023","Pure elision. Provide evidence to support your lie.","built-redundancy-vs-vestigal-organs","07:49 PM","creation-intelligent-design-vs-evolution","49"
"12-27-2008","12141",4,"Archangel","338035","Here's the rub though; decay rates can vary depending on the conditions that existed at the time they were exposed to the elements.","pandion","338036","Dead wrong. Ignorance can be corrected, but your intentional ignorance is terminal. Again, you allowed yourself to be duped by a liar.","built-redundancy-vs-vestigal-organs","10:35 AM","creation-intelligent-design-vs-evolution","53"
"12-27-2008","12141",4,"None","None","None","Matthew","338047","It is interesting to me that after you have repeatedly -- and indignantly -- complained that all these horrible evolutionists just won't take you seriously, you have responded to less than half of what I wrote to you. If you want your opponents to take you seriously, return the favor by not wasting their time. In the interests of being pro-active about not wasting too much time myself, here are some thoughts about a few sentences from your reply. You: ""If the Genesis account is false then the whole bible is a mythical story with no real relevance to humanities fall from grace and eventual redemption through Jesus sacrifice on the Cross."" If Genesis is literally false, that does not prevent the Bible (in whole or in part) from expressing profound truths about humanity's relationship to God, our place in the universe, human nature, or the foundations of morality. The idea that one must regard religious stories as literally true in order to find them at all spiritually meaningful is simply false. You: ""If you really understood the consistency of the bible, you would understand this."" I actually understand the consistency of the Bible quite well, thanks. If you can literalize yet reconcile the two separate accounts of the order of creation in Genesis 1 and Genesis 2, by all means, do so. The citations from Paul certainly don't accomplish this. You: ""So this is the process by which we were created and fell from grace through Adam, and by which we were reunited to God through Christ. It is a spiritual reconnection, which goes beyond the understanding of the natural man. Which is why the natural man is blind to the reality of the supernatural world which exists all around them."" And if the natural man is so blind, and you cannot hope to convince him, then I repeat: just whom are you trying to convince? In the immortal words of philosopher Martin Blank: ""Who do you wanna hit, man? It isn't me."" You: ""So if Genesis is a lie, allegory or myth, and Man evolved from lower life forms, then the nature of sin is bogus, as is our fall from grace and subsequent need for reconciliation to God. That means that their was no need for Jesus to come and die for our sins, then the gospel of salvation is an unnecessary fraud. So if evolution is correct, no matter how pseudo christians attempt to marry the two belief systems, if Christ did not rise from the dead, the gospel is useless and our faith is in vain as Paul put it so eloquently."" Why? I mean, look, leave aside the fact that just about nothing is as subjective as interpreting the Bible, and that many would thus no doubt take issue with your interpretation. How would evolution's truth and Genesis' (literal) falsity make sin ""bogus"" or salvation a ""fraud?"" Are we not still sinners in need of salvation? Please explain.","built-redundancy-vs-vestigal-organs","01:17 PM","creation-intelligent-design-vs-evolution","54"
"12-27-2008","12141",4,"None","None","None","Archangel","338061","Matthew, are you unaware of how to use the quote feature?","built-redundancy-vs-vestigal-organs","04:08 PM","creation-intelligent-design-vs-evolution","56"
"12-27-2008","12141",4,"None","None","None","Penfold","338063","Quote: Originally Posted by Archangel .... They have taken the same object and tested it 5 times with the same machine and come up with 5 different ages for it. Still waiting for evidence, though not holding our breaths.","built-redundancy-vs-vestigal-organs","04:46 PM","creation-intelligent-design-vs-evolution","57"
"12-27-2008","12141",4,"Penfold","338063","Quote: Originally Posted by Archangel .... They have taken the same object and tested it 5 times with the same machine and come up with 5 different ages for it. Still waiting for evidence, though not holding our breaths.","smiley","338069","Come now, Penfold. If you look at post #46, Archie's attempt at a reply did at least involved the number 5. That's pretty good for him.","built-redundancy-vs-vestigal-organs","05:48 PM","creation-intelligent-design-vs-evolution","58"
