"Date","Dialog_Turn","Discussion_Id","Post_Counter","Quote_Author","Quote_Id","Quote_Text","Response_Author","Response_Id","Response_Text","Subtopic","Time","Topic","Word_Count"
"07-02-2013","16","17119","337","Hdreams","475197","Ez and genetics.... Not the best mix. I am relatively confident that you didn't intend to say this EZ but just to clarify, Evil is not Hereditary.","Easyrider","475206","True, my analysis was a theoretical illustration. Now you wouldn't deny that there are murderers in most every generation, would you?","obama-supports-gay-marriage","11:44 AM","gay-rights-debates",25
"07-02-2013","16","17119","339","Easyrider","475206","True, my analysis was a theoretical illustration. Now you wouldn't deny that there are murderers in most every generation, would you?","Hdreams","475216","There are murderers in every generation, but they are not hereditary... They are a mix of pre-meditated, opportunist, situational etc... Killing a murderer does not prevent murderer's arising in the next generation. And perhaps some of those murderer's wished to repent, would they not then have been welcomed into gods bosom? Would it not be a horrific thing to find yourself in ""Heaven"" and bump into the murderer who massacred your family feasting on the local buffet all because he said sorry? I think their must be crime in heaven....","obama-supports-gay-marriage","01:29 PM","gay-rights-debates",102
"07-02-2013","16","17119","340","Hdreams","475216","There are murderers in every generation, but they are not hereditary... They are a mix of pre-meditated, opportunist, situational etc... Killing a murderer does not prevent murderer's arising in the next generation. And perhaps some of those murderer's wished to repent, would they not then have been welcomed into gods bosom? Would it not be a horrific thing to find yourself in ""Heaven"" and bump into the murderer who massacred your family feasting on the local buffet all because he said sorry? I think their must be crime in heaven....","Easyrider","475221","Nope. The New Testament says we're raised incorruptible. And the unrepentant murderers are cast into Hell. I think you see the earth through rose-colored glasses. There's tons of murderers in every generation. Heredity is not necessary to continue with crime. We see with the Muslims, for instance, that they train up their children to hate Jews, and there's no shortage of Muslim generations that have hated and killed Jews. And that's what we see in the Middle East during the Old Testament - one group or nation after another killing others. So I stand by my illustration.","obama-supports-gay-marriage","01:44 PM","gay-rights-debates",109
"07-02-2013","16","17119","341","Easyrider","475221","Nope. The New Testament says we're raised incorruptible. And the unrepentant murderers are cast into Hell. I think you see the earth through rose-colored glasses. There's tons of murderers in every generation. Heredity is not necessary to continue with crime. We see with the Muslims, for instance, that they train up their children to hate Jews, and there's no shortage of Muslim generations that have hated and killed Jews. And that's what we see in the Middle East during the Old Testament - one group or nation after another killing others. So I stand by my illustration.","Hdreams","475222","If the murderer was genuinely repentant he would be accepted into heaven... Im not saying he is faking it...","obama-supports-gay-marriage","01:48 PM","gay-rights-debates",21
"07-02-2013","16","17119","342","Hdreams","475222","If the murderer was genuinely repentant he would be accepted into heaven... Im not saying he is faking it...","Easyrider","475230","If he were repentant and he received Christ as his Savior (who paid for his sins at Calvary), then, on the basis of God physically dying for the sins of man, the murderer would be accepted into heaven. Remember, Moses killed a man and we see him centuries later on the Mount of Transfiguration. So there can be redemption for murderers.","obama-supports-gay-marriage","03:16 PM","gay-rights-debates",70
"07-02-2013","16","17119","343","Easyrider","475230","If he were repentant and he received Christ as his Savior (who paid for his sins at Calvary), then, on the basis of God physically dying for the sins of man, the murderer would be accepted into heaven. Remember, Moses killed a man and we see him centuries later on the Mount of Transfiguration. So there can be redemption for murderers.","Hdreams","475241","So the murderer of my family is admitted to heaven At which point when the victims see him over the heavenly all you can eat buffet there is going to be trouble.","obama-supports-gay-marriage","06:48 PM","gay-rights-debates",33
"07-04-2013","17","17119","384","Easyrider","475336","There's not that many sane people around who bow down to Muslim thuggery, but apparently you're one of the dead heads who do. There's no shortage of examples of Arab / Muslim attacks against Israel, so don't even bother trying to go there. Anyone we can pay to kill Muslim thugs / terrorists is money well spent. And don't forget all the Arab countries that support terrorism against Israel, like Iran and Syria. If you like those maggots so much move on over there.","Hdreams","475340","So your ""Christian"" viewpoint is that we should spend more money effectively hiring butchers to kill people in a foreign country as opposed to using it to empower, feed and school the population of your own country?","obama-supports-gay-marriage","08:17 AM","gay-rights-debates",41
"07-04-2013","17","17119","387","Hdreams","475340","So your ""Christian"" viewpoint is that we should spend more money effectively hiring butchers to kill people in a foreign country as opposed to using it to empower, feed and school the population of your own country?","Easyrider","475343","It's not either/or. You can do both. Government has been appointed by God to deal wrath against the evil doers. Read Romans chapter 13. Have you ever read the Bible?","obama-supports-gay-marriage","08:25 AM","gay-rights-debates",37
"07-04-2013","17","17119","388","Easyrider","475343","It's not either/or. You can do both. Government has been appointed by God to deal wrath against the evil doers. Read Romans chapter 13. Have you ever read the Bible?","Hdreams","475344","Great so you agree with spending on help, empowerment and schooling... Just as long as the government spends more on direct and by-proxy war. Also the government was not appointed by god.... im not sure what drug or religious induced delirium you are in as regards to this but they are appointed by the senate/congress/white house through elected individuals. You seriously think god elects Congressmen/Senators & Presidents? If this were true then why are you so against the divinely elected current President? please read V for Vendetta.. all chapters.","obama-supports-gay-marriage","08:44 AM","gay-rights-debates",104
"07-04-2013","17","17119","389","Hdreams","475344","Great so you agree with spending on help, empowerment and schooling... Just as long as the government spends more on direct and by-proxy war. Also the government was not appointed by god.... im not sure what drug or religious induced delirium you are in as regards to this but they are appointed by the senate/congress/white house through elected individuals. You seriously think god elects Congressmen/Senators & Presidents? If this were true then why are you so against the divinely elected current President?","Easyrider","475345","Well let me spin things back to you. I guess you're ok spending all our money on failed school systems so we can leave our country unprotected. You're apparently blind to the providence of God. As Thomas Jefferson noted, I shall need, too, the favor of that Being in whose hands we are, who lead our forefathers, as Israel of old, from their native land and planted them in a country flowing with all the necessities and comforts of life. (Monday, March 4, 1805, in his 2nd Inaugural Address) You haven't read the Bible, have you? Sometimes God gives people the screwed up government they deserve. He raised up King Nebuchadnezzar to come against Israel when they became corrupt.","obama-supports-gay-marriage","08:58 AM","gay-rights-debates",138
"05-23-2012","25","17119","46","Matthew S","455685","What you are saying, Mr Taliban, is that we can not have a civil government contract because your of religious beliefs. You rail against the Mideastern countries for their treatment of Christians and sharia law, but you are so happy to impose that same sharia law upon us. You are just the same as the Islamists that you despise.","Freedom","455711","He has not advocated the execution, imprisonment, or even mandatory therapy for homosexuals that is an unfair accusation. It is the homosexual lobby who are trying to force him and people like him to recognize homosexuality in the public sphere and thus condone and support it, and their reaction to that is the sum of the so called 'gay-bashing' in modern western countries. That is why I could live in peace with easyrider but not a collectivist, he believes in freedom if only because the founders of the united states did.","obama-supports-gay-marriage","01:16 PM","gay-rights-debates",100
"05-24-2012","25","17119","47","Freedom","455711","He has not advocated the execution, imprisonment, or even mandatory therapy for homosexuals that is an unfair accusation. It is the homosexual lobby who are trying to force him and people like him to recognize homosexuality in the public sphere and thus condone and support it, and their reaction to that is the sum of the so called 'gay-bashing' in modern western countries. That is why I could live in peace with easyrider but not a collectivist, he believes in freedom if only because the founders of the united states did.","Matthew S","455767","He is advocating that his religious beliefs be turned into laws that I have to live under. Yes he is the Taliban. Yes he wants sharia law imposed upon me and my family.","obama-supports-gay-marriage","04:55 AM","gay-rights-debates",36
"05-24-2012","25","17119","48","Matthew S","455767","He is advocating that his religious beliefs be turned into laws that I have to live under. Yes he is the Taliban. Yes he wants sharia law imposed upon me and my family.","Freedom","455769","No, you want your relationship imposed upon him and his family. What religious belief is it that he wants as law? That homosexuals should be put to death and their blood is on them? He has not advocated that in all the posts he's made since I've been here. You think you have a right to public support and that is why you have a blindness to the nature of what he wants. Homosexual marriages have not been banned by any state, some refuse to recognize them and that is all. You can still sign any contract with anyone you want. You can still have as much sex as you want with whoever you want. There are no oppressive laws and the sooner you realize that the sooner we all can stop hearing this avalanche of self-absorbed entitled complaints.","obama-supports-gay-marriage","05:03 AM","gay-rights-debates",150
"05-24-2012","25","17119","49","Freedom","455769","No, you want your relationship imposed upon him and his family. What religious belief is it that he wants as law? That homosexuals should be put to death and their blood is on them? He has not advocated that in all the posts he's made since I've been here. You think you have a right to public support and that is why you have a blindness to the nature of what he wants. Homosexual marriages have not been banned by any state, some refuse to recognize them and that is all. You can still sign any contract with anyone you want. You can still have as much sex as you want with whoever you want. There are no oppressive laws and the sooner you realize that the sooner we all can stop hearing this avalanche of self-absorbed entitled complaints.","Matthew S","455827","It is his religious belief that a civil marriage contract is between a man and a woman. His religious belief is the law and he supports that law. It is a religious law that is no difference then sharia law. His religious beliefs should have nothing to do with civil law. Further my religious beliefs are being violated.","obama-supports-gay-marriage","10:02 PM","gay-rights-debates",63
"05-24-2012","25","17119","50","Matthew S","455827","It is his religious belief that a civil marriage contract is between a man and a woman. His religious belief is the law and he supports that law. It is a religious law that is no difference then sharia law. His religious beliefs should have nothing to do with civil law. Further my religious beliefs are being violated.","Freedom","455829","Then how can non-religious people (like me) recognize that man and woman has always been what marriage meant?","obama-supports-gay-marriage","10:46 PM","gay-rights-debates",21
"05-25-2012","25","17119","56","Freedom","455829","Then how can non-religious people (like me) recognize that man and woman has always been what marriage meant?","Matthew S","455919","Because there is such a thing as a legal contract signed between two people and the state, simple as that.","obama-supports-gay-marriage","10:13 PM","gay-rights-debates",22
"06-30-2013","27","17119","266","Hdreams","475047","I will look at Xanamnes links and reply but i am still awaiting a reason as to why Gay marriage shouldnt be legal.","Xenamnes","475048","Homosexualism is not a valid measure of differentiation between two or more individuals. It is no different than claiming individual A has strong preference for people of African descent while individual B has strong preference for people of Mediterranean descent. Homosexualism has not been scientifically proven to be anything other than a simple preference for a specific type of activity. It is no more worth consideration or legal protection than bird watching or wearing brown shoes as opposed to any other color. Human sexuality is regarded as fluidic in nature and subject to change. Homosexualism as well at heterosexualism are nothing more than temporary phases of development. As such there is no reason to cater to what is nothing more than a temporary trend.","obama-supports-gay-marriage","07:58 PM","gay-rights-debates",131
"06-30-2013","27","17119","267","Xenamnes","475048","Homosexualism is not a valid measure of differentiation between two or more individuals. It is no different than claiming individual A has strong preference for people of African descent while individual B has strong preference for people of Mediterranean descent. Homosexualism has not been scientifically proven to be anything other than a simple preference for a specific type of activity. It is no more worth consideration or legal protection than bird watching or wearing brown shoes as opposed to any other color. Human sexuality is regarded as fluidic in nature and subject to change. Homosexualism as well at heterosexualism are nothing more than temporary phases of development. As such there is no reason to cater to what is nothing more than a temporary trend.","Hdreams","475049","That is ridiculous. And their are 9 million people and a whole host of specialists that would vastly disagree with your presumption. Also Men/Women who are attracted to African/Asian/Caribbean/European have the right to marry. Your logic would boil it down to complete discrimination without cause just because they are attracted to a group you dont agree with. 9 million people in the U.S would disagree with your presumption they are experiencing a developmental trend, something which you have no personal experience of.","obama-supports-gay-marriage","08:19 PM","gay-rights-debates",97
"06-30-2013","27","17119","269","Hdreams","475049","That is ridiculous. And their are 9 million people and a whole host of specialists that would vastly disagree with your presumption. Also Men/Women who are attracted to African/Asian/Caribbean/European have the right to marry. Your logic would boil it down to complete discrimination without cause just because they are attracted to a group you dont agree with. 9 million people in the U.S would disagree with your presumption they are experiencing a developmental trend, something which you have no personal experience of.","Xenamnes","475052","None of which proves that homosexualism is a legitimate differentiation in nature. It has not yet been scientifically proven to be anything more than a mere choice of preference. It is not something that should warrant constitutional protection anymore than someone's belief that women with red hair are superior to those with blond hair. Eleven million people in the United State believe that they have a right to citizenship and full constitutional benefits even though they are here illegally and engaging in larceny and tax evasion. Something is not true simply because it is wanted to a significant degree.","obama-supports-gay-marriage","09:44 PM","gay-rights-debates",104
"06-30-2013","27","17119","272","Xenamnes","475052","None of which proves that homosexualism is a legitimate differentiation in nature. It has not yet been scientifically proven to be anything more than a mere choice of preference. It is not something that should warrant constitutional protection anymore than someone's belief that women with red hair are superior to those with blond hair. Eleven million people in the United State believe that they have a right to citizenship and full constitutional benefits even though they are here illegally and engaging in larceny and tax evasion. Something is not true simply because it is wanted to a significant degree.","Hdreams","475055","You skipped this point Xanamnes Men/Women who are attracted to African/Asian/Caribbean/European have the right to marry, Gay people dont. I wonder why you left that out, perhaps because it shows that its pure discrimination. Also, did you just compare gays to illegal immigrants??? Wow........ While your at it why dont we also get rid of dwarves and midgets... hell, people with mental retardation shouldnt marry either right? If we weed out enough of them we might bring down the tax bill. And iv never liked those gypsies... and while were here we might as well get rid of the Muslims... Perhaps we can make some camps in Arizona and Nevada to put them to works while we think of a Solution . The road to extremism starts with discrimination and Intolerance of lawful individuals due to personal belief, sexual orientation or societal standing.","obama-supports-gay-marriage","10:00 PM","gay-rights-debates",166
"01-26-2012","1","16081","2","jyoshu","447801","A very well put editorial that asks and question I have wondered a number of times myself, and have brought up before. On Gay Marriage, Media Gives Obama a Pass - Yahoo! News This administration under my direction, has consistently said, we cannot discriminate as a country against people on the basis of sexual orientation What Ive seen happen over the last several years and what happened in New York last week I think was a good thing because what you saw was the people of New York having a debate, talking through these issues. It was contentious, it was emotional but ultimately they made a decision to recognize civil marriages. And I think thats exactly how things should work. And so I think it is important for us to work through these issues because each community is going to be different and each state is going to be different to work through them. In the meantime, we filed briefs before the Supreme Court that say any discrimination against gays, lesbians, transgenders is subject to heightened scrutiny and we dont think DOMA is unconstitutional (sic they do think DOMA is unconstitutional). So the combination of what states are doing, what the courts are doing, the actions were taking administratively, all are how the process should work I think what youre seeing is a profound recognition on the part of the American people that gays, lesbians and transgender persons are our brothers, our sisters, our children, our cousins, our friends, our co-workers and that theyve got to be treated like every other American. And I think that principle will win out.","Matthew S","448165","Here is the difference Every Republican presidential candidate wants gay marriage banned and gay people thrown into prison through the reinstatement of sodomy laws. They are very loud and clear on this point. They would put their personal opinions in to law that subjugate gay people. President Obama has said that he believes that marriage is between a man and a woman but he is not willing to put his personal beliefs into law. He has done everything he can to support the marriage equality position. He has said that he favors a system of strong civil unions. Besides if Obama wins reelection then he will come out for full marriage equality. No other president in US history has done more for the gay community the president Obama. He has been our strong advocate in the white house. The problem for you is that you fall on the side of imposing your moral views upon others and can not understand why someone would not want to. They don't give him a pass here is a quote from a press conference. http://www.queerty.com/obama-of-cour...mies-20110629/","gay-marriage-media-gives-obama-pass","06:20 AM","gay-rights-debates",192
"01-26-2012","1","16081","4","Matthew S","448165","Here is the difference ... gay people thrown into prison through the reinstatement of sodomy laws.","jyoshu","448174","Oh good grief. Fear-monger much? Matthew you really need to give up the gay-pride politics blogs and embrace reality for a change.","gay-marriage-media-gives-obama-pass","09:51 AM","gay-rights-debates",25
"01-27-2012","1","16081","5","jyoshu","448174","Oh good grief. Fear-monger much? Matthew you really need to give up the gay-pride politics blogs and embrace reality for a change. I, _______, pledge to the American people that if elected President, I will: One, support sending a federal constitutional amendment defining marriage as the union of one man and one woman to the states for ratification. Two, nominate to the U.S. Supreme Court and federal bench judges who are committed to restraint and to applying the original meaning of the Constitution, appoint an attorney general similarly committed, and thus reject the idea our Founding Fathers inserted a right to gay marriage into our Constitution. Three, defend the federal Defense of Marriage Act vigorously in court. Four, establish a presidential commission on religious liberty to investigate and document reports of American who have been harassed or threatened for exercising key civil rights to organize, to speak, to donate or to vote for marriage and to propose new protections, if need. Five, advance legislation to return to the people of the District of Columbia their right to vote on marriage.","Matthew S","448215","I hear the sound of the marching of the boots of the brown shirts every time I here any of the Republican candidates speak, even your precious Ron Paul. The Republican candidates all support the re-institution of sodomy laws. Rick Perry even supports the proposed Uganda law, his religion is supporting, that would not only imprison gays but execute them. But once again to the OP Obama is not given a pass on marriage equality it is just that he will never do anything to stop it and will help marriage equality become a reality. The republican candidates all will do everything in their power to stop marriage equality. Here is the pledge they signed http://thinkprogress.org/lgbt/2011/1...dge/?mobile=nc http://thinkprogress.org/lgbt/2011/0...rriage-pledge/","gay-marriage-media-gives-obama-pass","05:47 AM","gay-rights-debates",125
"01-27-2012","1","16081","7","Matthew S","448215","I hear the sound of the marching of the boots of the brown shirts every time I here any of the Republican candidates speak, even your precious Ron Paul. The Republican candidates all support the re-institution of sodomy laws. Rick Perry even supports the proposed Uganda law, his religion is supporting, that would not only imprison gays but execute them.","jyoshu","448218","Nobody is going to imprison or execute gays here in the U.S. Give it a rest. You're in far greater danger in this country simply from economic collapse by staying with Obama than you are any danger of the paranoid delusions you come up with over the gay issue.","gay-marriage-media-gives-obama-pass","09:10 AM","gay-rights-debates",51
"01-27-2012","1","16081","8","jyoshu","448218","Nobody is going to imprison or execute gays here in the U.S. Give it a rest. You're in far greater danger in this country simply from economic collapse by staying with Obama than you are any danger of the paranoid delusions you come up with over the gay issue.","Matthew S","448246","Hummm I wonder if you would have said the same thing to the native Americans or the Japanese Americans. It has happened before and can happen again. Do I need to remind you of the hundreds of thousands of native Americans that are dead at the hands of the US military or that the Japanese Americans dragged from their homes and locked away in concentration camps. An don't get me started on institution of slavery that was written into the constitution and lasted for over 80 years under that constitution. Yes these things happened here in the US and if they can happen once who knows what will happen to us.","gay-marriage-media-gives-obama-pass","09:12 PM","gay-rights-debates",116
