"Date","Dialog_Turn","Discussion_Id","Post_Counter","Quote_Author","Quote_Id","Quote_Text","Response_Author","Response_Id","Response_Text","Subtopic","Time","Topic","Word_Count"
"07-03-2013","11","17119","353","Easyrider","475221","We see with the Muslims, for instance, that they train up their children to hate Jews, ...","Dani","475259","...and Jews would never teach their children to hate Arabs would they? zvod2x.jpg","obama-supports-gay-marriage","01:13 AM","gay-rights-debates",19
"07-03-2013","11","17119","356","Dani","475259","...and Jews would never teach their children to hate Arabs would they?","Easyrider","475265","Hey, if the Muslims want to keep launching rockets against Israel and blowing up their buses, then there's no reason not to hate the murdering thugs (or people like you who are apologists for the terrorists). Remember 9/11.","obama-supports-gay-marriage","08:54 AM","gay-rights-debates",44
"07-03-2013","11","17119","360","Easyrider","475265","Hey, if the Muslims want to keep launching rockets against Israel and blowing up their buses, then there's no reason not to hate the murdering thugs (or people like you who are apologists for the terrorists). Remember 9/11.","Dani","475274","Why don't you tell us what you would do if Canada started illegally occupying parts of the USA. Tell us what you would do if the Canadian army confiscated YOUR land, destroyed YOUR home, killed YOUR family and left you to starve. What would you do knob? The irony in your idiocy is that YOU are the one beating your chest about you will fight anyone that tries to take what belongs to you. YOU are the one boasting about laying traps to kill hundreds should any try to take from you, yet here you are castigating the Palestinians for doing exactly what you claim is your 'right ' to do to others. What an obnoxious, sickening bigot you are. I couldn't give a feck about 9/11","obama-supports-gay-marriage","09:33 AM","gay-rights-debates",138
"07-03-2013","11","17119","362","Dani","475274","Why don't you tell us what you would do if Canada started illegally occupying parts of the USA. Tell us what you would do if the Canadian army confiscated YOUR land, destroyed YOUR home, killed YOUR family and left you to starve. What would you do knob? The irony in your idiocy is that YOU are the one beating your chest about you will fight anyone that tries to take what belongs to you. YOU are the one boasting about laying traps to kill hundreds should any try to take from you, yet here you are castigating the Palestinians for doing exactly what you claim is your 'right' to do to others. What an obnoxious, sickening bigot you are. I couldn't give a feck about 9/11","Easyrider","475278","Well, we care about 9/11 over here. God, and the U.N., gave that land to Israel. And if you and the Palestinians don't like it you can go climb on a parking meter and rotate.","obama-supports-gay-marriage","10:30 AM","gay-rights-debates",41
"07-03-2013","11","17119","363","Easyrider","475278","Well, we care about 9/11 over here. God, and the U.N., gave that land to Israel.","Dani","475282","Oh you poor things! One terrorist attack (the biggest part of which could have been avoided if you hadn't been so incompetent) and you think the world has to feel sorry for you for ever more. Some of us in other countries had to live with terrorism on a DAILY basis for decades and we just got on with it. You need to put away the self-pity and do the same. I'm sure that the Palestinians would be happy to have the land that the UN allocated to them. It's the amount of that UN allocated land that is being illegally occupied by the Israeli aggressors that they are complaining about.","obama-supports-gay-marriage","12:23 PM","gay-rights-debates",119
"07-03-2013","11","17119","364","Dani","475282","Oh you poor things! One terrorist attack (the biggest part of which could have been avoided if you hadn't been so incompetent) and you think the world has to feel sorry for you for ever more. Some of us in other countries had to live with terrorism on a DAILY basis for decades and we just got on with it. You need to put away the self-pity and do the same. I'm sure that the Palestinians would be happy to have the land...","Easyrider","475283","One attack? My, my, you are historically-challenged. And sorry to burst your bubble but we don't wallow in pity. We go and kick their as*es, and we've been kicking them for quite some time now. I really don't give a rat's fanny what those people want. You feel sorry for them give them some land in Spain. Otherwise Dumi up.","obama-supports-gay-marriage","12:56 PM","gay-rights-debates",70
"07-03-2013","11","17119","367","Easyrider","475283","One attack? My, my, you are historically-challenged. And sorry to burst your bubble but we don't wallow in pity. We go and kick their as*es, and we've been kicking them for quite some time now. I really don't give a rat's fanny what those people want. You feel sorry for them give them some land in Spain.","Dani","475297","No clown! The arses you kicked were the arse that had absolutely nothing to do with the crime. Why should Spain give them land? They already have their own land in Palestine that the Israelis are illegally occupying. It is for the Israelis to give back the land that they have stolen. I notice you avoided this too.... ""Why don't you tell us what you would do if Canada started illegally occupying parts of the USA. Tell us what you would do if the Canadian army confiscated YOUR land, destroyed YOUR home, killed YOUR family and left you to starve. What would you do knob? The irony in your idiocy is that YOU are the one beating your chest about you will fight anyone that tries to take what belongs to you. YOU are the one boasting about laying traps to kill hundreds should any try to take from you, yet here you are castigating the Palestinians for doing exactly what you claim is your 'right' to do to others. What an obnoxious, sickening bigot you are.""","obama-supports-gay-marriage","03:55 PM","gay-rights-debates",197
"07-03-2013","11","17119","369","Dani","475297","No clown! The arses you kicked were the arse that had absolutely nothing to do with the crime. Why should Spain give them land? They already have their own land in Palestine that the Israelis are illegally occupying. It is for the Israelis to give back the land that they have stolen. I notice you avoided this too.... ""Why don't you tell us what you would do if Canada started illegally occupying parts of the USA. Tell us what you would do if the Canadian army confiscated YOUR land, destroyed YOUR home, killed YOUR family and left you to starve. What would you do knob? The irony in your idiocy is that YOU are the one beating your chest about you will fight anyone that tries to take what belongs to you. YOU are the one boasting about laying traps to kill hundreds should any try to take from you, yet here you are castigating the Palestinians for doing exactly what you claim is your 'right' to do to others. What an obnoxious, sickening bigot you are.""","Easyrider","475309","You're an imbecile.","obama-supports-gay-marriage","06:56 PM","gay-rights-debates",4
"07-04-2013","11","17119","372","Easyrider","475309","You're an imbecile.","Dani","475320","ANSWER! ""Tell us what you would do if Canada started illegally occupying parts of the USA. Tell us what you would do if the Canadian army confiscated YOUR land, destroyed YOUR home, killed YOUR family and left you to starve. What would you do knob? The irony in your idiocy is that YOU are the one beating your chest about how you will fight anyone that tries to take what belongs to you. YOU are the one boasting about laying traps to kill hundreds should anyone try to take from you, yet here you are castigating the Palestinians for doing exactly what you claim is your 'right' to do to others. What an obnoxious, sickening bigot you are.""","obama-supports-gay-marriage","03:04 AM","gay-rights-debates",133
"07-03-2013","12","17119","355","Dani","475257","Bravo! Well said. Sickos like EZ only hear about what is happening in Palestine from American pro-Israeli news programmes. It's you that is the ignorant jackass. You need to educate yourself on the Israeli-Palestinian conflict and perhaps then you wouldn't come across as such a clown. No doubt they would if the Israelis stopped stealing Palestinian land, destroying Palestinian homes and killing Palestinians. A good start would be for Israel to give back the Palestinian land that they stole from Palestine. He's not defending Muslims. He pointing out to you the injustice that Palestinians have suffered under the Israelis.","Easyrider","475264","Love the way you antichrist jackas*es stick up for the homophobic Muslims. I would think you'd be consistent and take the Muslims to task for hating and killing gays. But no, your anti-semitism wins the day. The Palestinians never had their own country, you imbecile. And you want to talk about me sucking up media lies? You want a long list of Muslim atrocities against the Jews just Google it. And don't forget the Olympic massacre of Jewish athletes at Munich.","obama-supports-gay-marriage","08:52 AM","gay-rights-debates",90
"07-03-2013","12","17119","358","Easyrider","475264","Love the way you antichrist jackas*es stick up for the homophobic Muslims. I would think you'd be consistent and take the Muslims to task for hating and killing gays. But no, your anti-semitism wins the day. You want a long list of Muslim atrocities against the Jews just Google it.","Dani","475272","Bravo! You have no answer so you accuse someone of being anti-Semite. Go learn the difference between anti-Semite and anti-Zionist. The Palestinians never had their own country, you imbecile. And you want to talk about me sucking up media lies? You're an imbecile. Your ignorance of the Israeli-Palistinian problem is almost as great as your ignorance of evolution and other aspects of science. You want a long list of atrocities by Israelis against Palestinians just Google it. If you want to see how much land Israel has stolen from Palestine and is still illegally occupying, look here... 727u3l.jpg","obama-supports-gay-marriage","09:23 AM","gay-rights-debates",114
"07-03-2013","12","17119","359","Dani","475272","Easyrider: The Palestinians never had their own country, you imbecile. And you want to talk about me sucking up media lies? Your ignorance of the Israeli-Palistinian problem is almost as great as your ignorance of evolution and other aspects of science.","Easyrider","475273","Like I said, you imbecile, The Palestinians never had their own country. Putting up some contrived map saying they did is horse manure.","obama-supports-gay-marriage","09:26 AM","gay-rights-debates",27
"07-03-2013","12","17119","361","Easyrider","475273","Like I said, you imbecile, The Palestinians never had their own country. Putting up some contrived map saying they did is horse manure.","Dani","475275","...and like I said, you are as much of an ignoramus regarding Palestine as you are regarding evolution.","obama-supports-gay-marriage","09:38 AM","gay-rights-debates",21
"06-30-2013","14","17119","235","Hdreams","474985","What happens between two (or more) consenting adult in the privacy of their bedrooms is their own business. They have the right to the benefits we give to couple should they wish for them and the recognition of marriage. Pedophilia, wife beating, adultery all have consequences either for children (who are not of consent age), violence etc... But adultery is legal, it is legal to have an affair outside of marriage.","Easyrider","474990","Please see my previous post to ANorveyanFellow. There are dire consequences for the individual and even a nation that rebels against God. The Bible is full of such examples. ""The wicked shall be turned into hell, and all the nations that forget God."" - Psalm 9:17","obama-supports-gay-marriage","10:12 AM","gay-rights-debates",53
"06-30-2013","14","17119","236","Easyrider","474990","Please see my previous post to ANorveyanFellow. There are dire consequences for the individual and even a nation that rebels against God. The Bible is full of such examples. ""The wicked shall be turned into hell, and all the nations that forget God."" - Psalm 9:17","Hdreams","475004","Their is a separation of church and state for a reason EZ, to prevent the discrimination of a minority on religious grounds... gay marriage is a human right for consenting adult individuals. Perhaps your god does rail against gay marriage, but that should have no political weight on a secular nation consisting on hundreds of religions and secularist organisations and communities when it come to the laws that govern all peoples under that nation.","obama-supports-gay-marriage","12:02 PM","gay-rights-debates",79
"06-30-2013","14","17119","239","Hdreams","475004","Their is a separation of church and state for a reason EZ, to prevent the discrimination of a minority on religious grounds... gay marriage is a human right for consenting adult individuals. Perhaps your god does rail against gay marriage, but that should have no political weight on a secular nation consisting on hundreds of religions and secularist organisations and communities when it come to the laws that govern all peoples under that nation. The sphere of religion has no place in the discussion.","Easyrider","475007","Christians, Jews, and others of faith have voting rights too, and we can all vote as we please. In fact, if there's enough of us, we can pass a Constitutional Amendment to ban gay marriage, etc. Gay marriage is also outlawed by virtue of a number of state constitutions, passed by representatives of the people. I'm not buying that. Did you know the founding fathers and others attended church services in the US Capitol Bldg. and other federal buildings, and that continued up to and shortly after the Civil War? Kind of puts the ""separation of church"" and state in a different light for you, n'est pas?","obama-supports-gay-marriage","12:50 PM","gay-rights-debates",124
"06-30-2013","14","17119","241","Easyrider","475007","Christians, Jews, and others of faith have voting rights too, and we can all vote as we please. In fact, if there's enough of us, we can pass a Constitutional Amendment to ban gay marriage, etc. By the way, did you know the founding fathers and others attended church services in the US Capitol Bldg. and other federal buildings, and that continued up to and shortly after the Civil War? Kind of puts the ""separation of church"" and state in a different light for you, n'est pas?","Hdreams","475009","Your right, and gay marriage in no way inhibits your right to vote as you see fit... What is does do is prevent said religious groups from proposing laws, amendments and policies on religious grounds that would discriminate against a group of people. Again ill say it, freedom of religion also entails freedom from religion","obama-supports-gay-marriage","12:52 PM","gay-rights-debates",60
"06-30-2013","14","17119","243","Hdreams","475009","Your right, and gay marriage in no way inhibits your right to vote as you see fit... What is does do is prevent said religious groups from proposing laws, amendments and policies on religious grounds that would discriminate against a group of people. Again ill say it, freedom of religion also entails freedom from religion","Easyrider","475012","Religious folks, via our representatives, have proposed plenty of laws that discriminate against wickedness. And gay sex is wickedness. We also propose laws against the wickedness of aborting the innocent unborn. So we're alive and well in the voting booth, and the battle isn't over yet. There's also a higher court than the US Supreme Court, and that's God. And when he's had enough of this sodomy and wickedness he'll bring it to a screeching halt. And if not now, then at the Judgment. There won't be any gay pride cr*p in heaven.","obama-supports-gay-marriage","01:06 PM","gay-rights-debates",106
"06-30-2013","14","17119","244","Easyrider","475012","Religious folks, via our representatives, have proposed plenty of laws that discriminate against wickedness. And gay sex is wickedness. We also propose laws against the wickedness of aborting the innocent unborn. So we're alive and well in the voting booth, and the battle isn't over yet. There's also a higher court than the US Supreme Court, and that's God. And when he's had enough of this sodomy and wickedness he'll bring it to a screeching halt. And if not now, then at the Judgment. There won't be any gay pride cr*p in heaven.","Hdreams","475015","So you freely accept that your feeling and opinions are based on religious grounds, therefore should have no bearing on the laws passed by the state. The wisdom and strength of the constitution is talked about whenever individuals wish to prevent things such as gun reform, abortion etc... But when it suits you, you have no problem with ignoring the supposed wisdom of the founding fathers in their desire to create a nation for all through the separation of church and state. In conclusion, you only have conviction of the constitution when it suits and complies with your religious values, therefore you were the people the constitution was created to prevent from holding sway over law and society.","obama-supports-gay-marriage","01:12 PM","gay-rights-debates",127
"06-30-2013","14","17119","249","Hdreams","475015","In conclusion, you only have conviction of the constitution when it suits and complies with your religious values, therefore you were the people the constitution was created to prevent from holding sway over law and society.","Easyrider","475023","No one in any significant measure is promoting a theocracy or advocating a particular religion at the exclusion of all others, though perhaps the Muslims are. But as for whose ""religion"" should be approved, it isn't yours either. In the US Supreme Court decision Abington School District v. Schempp, 374, US 203, 83 S.Ct. 1560, 10 L.Ed.2d 844 (1963) Justice Clark stated: ""The State may not establish a 'religion of secularism' in the sense of affirmatively opposing or showing hostility to religion, thus 'preferring those who believe in no religion over those who do believe.' http://forum.mtstars.com/misc/v/13/1949.html","obama-supports-gay-marriage","01:27 PM","gay-rights-debates",122
"06-30-2013","14","17119","251","Easyrider","475023","No one in any significant measure is promoting a theocracy or advocating a particular religion at the exclusion of all others, though perhaps the Muslims are. But as for whose ""religion"" should be approved, it isn't yours either. In the US Supreme Court decision Abington School District v. Schempp, 374, US 203, 83 S.Ct. 1560, 10 L.Ed.2d 844 (1963) Justice Clark stated: ""The State may not establish a 'religion of secularism' in the sense of affirmatively opposing or showing hostility to religion, thus 'preferring those who believe in no religion over those who do believe.' http://forum.mtstars.com/misc/v/13/1949.html","Hdreams","475025","I have no religion EZ, that is the point... Your views are those of a religious denomination and therefore should have no bearing on laws passed by the state which affect all. In a similar way that if Islam was the majority denomination then sharia law should not be imposed on the minority christian denomination... Sodom and Gomorrah has nothing to do with it... Jefferson regardless of his personal views came round to understand the positives of a free country where people who didn't share his beliefs were protected as much as himself.... Admittedly as long as you were male, white, wealthy and of an Anglo-Saxon origin. Give religion an inch and it will take a mile. People should be free from religion, just as you are free from theirs.","obama-supports-gay-marriage","01:34 PM","gay-rights-debates",142
"06-30-2013","14","17119","252","Hdreams","475025","I have no religion EZ, that is the point... Your views are those of a religious denomination and therefore should have no bearing on laws passed by the state which affect all. Sodom and Gomorrah has nothing to do with it... Jefferson regardless of his personal views came round to understand the positives of a free country where people who didn't share his beliefs were protected as much as himself.... Admittedly as long as you were male, white, wealthy and of an Anglo-Saxon origin.","Easyrider","475026","Then you are a secularist, and there's no provision in the Constitution that favors secularism over people of faith. That's your view. I don't share it. In fact, considering the founding fathers went to church in federal buildings, hired paid Chaplains, printed a Bible, and spoke about how Christianity was the foundation of the country, I dare say you're the one who is out in left field. Sure it does. I'm not letting a secularist evict God from the public square or from the discussion. He didn't approve of sodomy, did he? In fact, which of the original states or founding fathers did?","obama-supports-gay-marriage","01:40 PM","gay-rights-debates",119
"06-30-2013","14","17119","253","Easyrider","475026","Then you are a secularist, and there's no provision in the Constitution that favors secularism over religion. That's your view. I don't share it. In fact, considering the founding fathers went to church in federal buildings, hire paid Chaplains, printed a Bible, and spoke about how Christianity was the foundation of the country, I dare say you're the one who is out in left field. Sure it does. I'm not letting a secularist evict God from the public square or from the discussion. He didn't approve of sodomy, did he? In fact, which of the original states or founding fathers did? EZ Sure it does. I'm not letting a secularist evict God from the public square or from the discussion.","Hdreams","475028","You will truly avoid the obvious to retain your weak claim to a christian US.... The separation of church and state is fundamental, it entails the FREEDOM FROM RELIGION for all, secularist, Buddhist, Muslim, Christian... The state cannot discriminate against any denomination on any religious grounds. What Jefferson and the rest of the founding fathers personally believed has no bearing, they recognized it as their personal belief and that their personal feeling and religion should not dictate the laws of a nation. It doesn't matter if they rebuilt the Basilica within the grounds of the white house, that doesn't mean Christians should be favoured above all others by the state. Im glad to hear it, i have no issue with Christians being involved in the discourse... I have a big problem with what is effectively religious law, and on this basis i hope you would support gun reform then.","obama-supports-gay-marriage","01:50 PM","gay-rights-debates",165
"06-30-2013","14","17119","257","Hdreams","475028","You will truly avoid the obvious to retain your weak claim to a christian US.... The separation of church and state is fundamental, it entails the FREEDOM FROM RELIGION for all, secularist, Buddhist, Muslim, Christian... The state cannot discriminate against any denomination on any religious grounds. What Jefferson and the rest of the founding fathers personally believed has no bearing...","Easyrider","475036","We're not talking about establishing a national religious denomination (which was what the founding fathers were addressing). We're talking illicit gay unions. And I'm not saying the US is a ""Christian nation,"" though some 70% of Americans claim to be Christians. I don't believe that for a minute.","obama-supports-gay-marriage","03:02 PM","gay-rights-debates",57
"06-30-2013","14","17119","259","Easyrider","475036","We're not talking about establishing a national religious denomination (which was what the founding fathers were addressing). We're talking illicit gay unions. And I'm not saying the US is a ""Christian nation,"" though some 70% of Americans claim to be Christians. I don't believe that for a minute.","Hdreams","475038","Give me a reason EZ that gay marriage should be banned outside of Christianity.... You have already read the statement about HIV and i hope you would see the falseness of that claim... Can give me a genuine reason that gay marriage should be banned outside of the sphere of religion?","obama-supports-gay-marriage","03:25 PM","gay-rights-debates",54
"07-02-2013","16","17119","334","Easyrider","475189","You people aren't too bright. In fact, you're ate up with the dumb a*s with your skewed perspectives. Gods Judgment Saves Lives Let's do this: How many people would 100 evil men kill in their lifetimes? Let's say a thousand, and the 100 evil men wind up in hell when they die. Now, let's let those 100 evil men have 100 offspring that over time grow up to kill the original 1,000 other people, plus 1,000 more. Now, you have 200 evil men in hell and 2,000 murdered others. Let's take it to the 10th or so generation. Now you've had 10,000 evil men giving birth to 10,000 offspring and together those 20,000 evil men and or women offspring kill 200,000 people total. So, you now have 20,000 evil men and women in hell (vs. 100 if you had nailed them earlier), plus 200,000 other dead people. So God, being smarter than his critics, and able to see consequences further out in time than the stiff-necked ""God is evil"" crowd, saves 19,900 people from going to hell plus he saves 199,000 others from getting murdered. (please excuse any math errors). Get the picture? God SAVES!!","Hdreams","475197","Ez and genetics.... Not the best mix. I am relatively confident that you didn't intend to say this EZ but just to clarify, Evil is not Hereditary.","obama-supports-gay-marriage","10:37 AM","gay-rights-debates",31
