"Date","Dialog_Turn","Discussion_Id","Post_Counter","Quote_Author","Quote_Id","Quote_Text","Response_Author","Response_Id","Response_Text","Subtopic","Time","Topic","Word_Count"
"11-17-2009","19","13537","182","jazyjason","378685","What? Meaningless and physical? Shows how much YOU know about a relationship between two people at all! I would LOVE for you to analyze some of the monogamous relationships of some gay couples that have lasted over 30 years and tell me that it is physical and meaningless. You have no idea whatsoever what you are talking about and frankly, it's just blatant stupidity laced in bigotry. MY relationship is not all physical and certainly is not meaningless. I would love for someone to judge any relationship your in and see how you feel about it...","gayhumanist","378699","You completely misunderstood. Please read back in the thread and forward to see context. I said the insecure homophobics and closeted individuals see it that way, certainly not myself. Secure and happy heterosexuals have no trouble acknowledging the love in gay relationships.","gay-marriage-opponents-keep-streak-alive","06:08 AM","gay-rights-debates",47
"11-17-2009","19","13537","188","gayhumanist","378699","You completely misunderstood. Please read back in the thread and forward to see context. I said the insecure homophobics and closeted individuals see it that way, certainly not myself. Secure and happy heterosexuals have no trouble acknowledging the love in gay relationships.","jazyjason","378781","Well I must have misread it and for that I""m sorry. *gasp*","gay-marriage-opponents-keep-streak-alive","02:00 PM","gay-rights-debates",16
"11-17-2009","19","13537","192","jazyjason","378781","Well I must have misread it and for that I""m sorry. *gasp*","gayhumanist","378868","Thanks for the apology. I can understand how you would be ready to react like that, as a young gay man in the U.S. who has had to face too much prejudice.","gay-marriage-opponents-keep-streak-alive","06:53 PM","gay-rights-debates",35
"05-17-2010","20","13537","428","Sigma","402196","Heterosexual attraction is the basis of reproduction. That is significant. Homosexual attraction is not the basis of reproduction. It cannot have the same significance.","jazyjason","402201","Bull. Just because you base your means on what is value due to reproduction does not make the attraction and love of a homosexual any less than that of a strait person.... NOT all strait people engage in sex to procreate. Would you then say that their relationships and unions are thus less significant than to those who only engage in intercourse for procreation? Or would you deem that because they ARE strait that they are then capable of procreation that then their unions are thus protected.... And of course then leave out the homosexuals because we cannot ""procreate."" In case you forgot we are all capable of procreating Sigma. Many older Gay men have sons, and daughters from previous marriages before they came out. I know one in particular that has a son.... I also know a Lesbian coworker that has 3 sons one whom is gay.... from a previous marriage... Or how about if I impregnate lets say 5 or 10 women do I get my rights THEN???","gay-marriage-opponents-keep-streak-alive","09:31 PM","gay-rights-debates",185
"05-17-2010","20","13537","431","jazyjason","402201","Bull. Just because you base your means on what is value due to reproduction does not make the attraction and love of a homosexual any less than that of a strait person....","Sigma","402204","What I posted was a fact. Any meaning you pull from it is your own. Heterosexual attraction is the basis of reproduction. This is a significant fact, since our survival as a species depends on reproduction. Homosexual attraction does not have the same significance.","gay-marriage-opponents-keep-streak-alive","09:37 PM","gay-rights-debates",50
"05-17-2010","20","13537","435","Sigma","402204","What I posted was a fact. Any meaning you pull from it is your own. Heterosexual attraction is the basis of reproduction. This is a significant fact, since our survival as a species depends on reproduction. Homosexual attraction does not have the same significance.","jazyjason","402208","Sigma.... Listen carefully OK ? This isn't ancient day Israel where people are being slaughtered and deal with population shortages OK? We have a population explosion on our hands.... Nearly 7 BILLION people.... The flawed logic you try to steer toward basing that somehow homosexual is unequal to heterosexual is a fallacy in today's modern world.... Your comparing apples to oranges and also you purposefully overlook that homosexuals can STILL reproduce! We don't have our sexual organs removed when we come out of the closet. I'm sure if it came down to it if some doomsday 2012 thing happened, a few gay men could drop off a vial of sperm at the local hospital or if necessary impregnate a woman if needed... yeesh....","gay-marriage-opponents-keep-streak-alive","09:42 PM","gay-rights-debates",133
"05-17-2010","20","13537","438","jazyjason","402208","Sigma.... Listen carefully OK ? This isn't ancient day Israel where people are being slaughtered and deal with population shortages OK? We have a population explosion on our hands.... Nearly 7 BILLION people.... The flawed logic you try to steer toward basing that somehow homosexual is unequal to heterosexual is a fallacy in today's modern world.... Your comparing apples to oranges and also you purposefully overlook that homosexuals can STILL reproduce!","Sigma","402212","So? This is a false conclusion. Heterosexual attraction was the basis for the evolution of our species. This will always be true, because we can't change the past (YET!!). This is significant. Homosexual attraction can never, ever, ever achieve the same significance for the same reason that two will not equal three. They simply are not the same thing. Homosexual relationships cannot naturally produce offspring. Heterosexual relationships can naturally produce offspring. This is also significant.","gay-marriage-opponents-keep-streak-alive","09:49 PM","gay-rights-debates",91
"05-17-2010","21","13537","429","jazyjason","402194","Creating Civil Unions creates a separate and unequal status for some of Americas citizens. The Massachusetts Supreme Judicial court ruled that creating a separate class for gay and lesbian citizens is not permissible and that is why they have voted that only marriage equals marriage. The precedent was set with Brown v. The Board of Education regarding segregation in public education. Ironically, Massachusetts marriage law went into effect on the 50th anniversary of Brown v. Board of Education.","Sigma","402202","This is something I don't get. Civil unions existed before the entire ""gay marriage"" push began, yet people who wanted to get them weren't second class citizens. What happened?","gay-marriage-opponents-keep-streak-alive","09:35 PM","gay-rights-debates",35
"05-17-2010","21","13537","432","Sigma","402202","This is something I don't get. Civil unions existed before the entire ""gay marriage"" push began, yet people who wanted to get them weren't second class citizens. What happened?","jazyjason","402205","What happened is that Gay people began to take a stand and finally demand full and equal rights under the laws of this country... We're tired of the scraps and the second class status myself included. You read the article over 1000 rights under Federal status are for married people... And even WITH Gay marriage legal in some states under DOMA, the Federal Government does not recognize them as legitimate!","gay-marriage-opponents-keep-streak-alive","09:38 PM","gay-rights-debates",75
"05-17-2010","21","13537","434","jazyjason","402205","What happened is that Gay people began to take a stand and finally demand full and equal rights under the laws of this country... We're tired of the scraps and the second class status myself included. You read the article over 1000 rights under Federal status are for married people... And even WITH Gay marriage legal in some states under DOMA, the Federal Government does not recognize them as legitimate!","Sigma","402207","So they weren't second class citizens before, but are now even though nothing changed? That seems a bit contrived, tbh. This sort of rant reminds me of a news story some years back about a self-proclaimed pedophile demanding that he not be treated different for his sexual orientation. I can't remember what happened to him though. In any case, you aren't a second class citizen. Even if you can't marry whomever you want to. No one can marry whomever they want to. It really sucks that you can't marry the person you love, but that doesn't make you a second class citizen.","gay-marriage-opponents-keep-streak-alive","09:41 PM","gay-rights-debates",114
"05-17-2010","21","13537","437","Sigma","402207","So they weren't second class citizens before, but are now even though nothing changed? That seems a bit contrived, tbh. This sort of rant reminds me of a news story some years back about a self-proclaimed pedophile demanding that he not be treated different for his sexual orientation. I can't remember what happened to him though. In any case, you aren't a second class citizen. Even if you can't marry whomever you want to. No one can marry whomever they want to. It really sucks that you can't marry the person you love, but that doesn't make you a second class citizen.","jazyjason","402211","They were before Sigma.... Gee how nice Sigma. Comparing my legitimate love of a legal adult to that of the lusts of a pedophile... Are you tag teaming with Easy now? I am an American Citizen, A Veteran, and was born here. I am entitled to every single right another man has who is strait. Separating the love I have of another legal adult is not only separate and not equal. It is drawing a line that does make me a second class citizen when nearly over 1100 rights I am entitled to are denied just simply because I am Gay...","gay-marriage-opponents-keep-streak-alive","09:48 PM","gay-rights-debates",111
"05-17-2010","21","13537","439","jazyjason","402211","Gee how nice Sigma. Comparing my legitimate love of a legal adult to that of the lusts of a pedophile... Are you tag teaming with Easy now? I am an American Citizen, A Veteran, and was born here. I am entitled to every single right another man has who is strait. Separating the love I have of another legal adult is not only separate and not equal. It is drawing a line that does make me a second class citizen when nearly over 1100 rights I am entitled to are denied just simply because I am Gay...","Sigma","402213","Don't denigrate others simply because they have different attractions. I wasn't condemning the man, I was merely pointing out the similarity of the situation. I truly feel sorry for people like him since the object of their sexual desires are and should be forever out of reach. I could not live like that. You have every single right every other man has, jazyjason . You are not denied these benefits, you simply don't qualify for them. I do not qualify for veteren benefits because I am not a veteren. You are in the same boat as every unmarried person in America be they gay or straight. Neither they nor you are second class citizens.","gay-marriage-opponents-keep-streak-alive","09:54 PM","gay-rights-debates",125
"11-06-2009","23","13537","31","JPSartre12","376971","You make no sense...as usual. Why would someone that considers marriage a sarcament go down to city hall to have it turned into a civil union?","Matthew S","377005","And you hit the nail on the head with this one. The US government does not consider marriage to be a sarcament. You are mixing religion and government. A marriage liscense is a secular document that is a contract between the state and the the couple, it has nothing to do with religion. You have said you favor civil unions for gay people and I am saying that if you think that civil unions are equal to marriage just a different name then you go turn in your liscense in favor of a civil union. However you know that they aren't so you will never do it, even if it were possible.","gay-marriage-opponents-keep-streak-alive","06:29 AM","gay-rights-debates",120
"11-06-2009","23","13537","32","Matthew S","377005","And you hit the nail on the head with this one. The US government does not consider marriage to be a sarcament. You are mixing religion and government. A marriage liscense is a secular document that is a contract between the state and the the couple, it has nothing to do with religion. You have said you favor civil unions for gay people and I am saying that if you think that civil unions are equal to marriage just a different name then you go turn in your liscense in favor of a civil union. However you know that they aren't so you will never do it, even if it were possible.","JPSartre12","377021","As a voter, I can mix whatever I want. That's the part that you aren't getting. Uncle Sam can't establish a religion or give special consideration to one religion; voters can do whatever they please and I choose to not want same sex marriage included under the definition of marriage. As for civil unions, I think your time would be better spent trying to fill the gaps in it instead of trying to scrap the current definition of marriage.","gay-marriage-opponents-keep-streak-alive","08:41 AM","gay-rights-debates",86
"11-07-2009","23","13537","45","JPSartre12","377021","As a voter, I can mix whatever I want. That's the part that you aren't getting. Uncle Sam can't establish a religion or give special consideration to one religion; voters can do whatever they please and I choose to not want same sex marriage included under the definition of marriage. As for civil unions, I think your time would be better spent trying to fill the gaps in it instead of trying to scrap the current definition of marriage.","Matthew S","377190","Fine then I think the people of California should decide weather the people of Michigan can get to have drivers licenses.","gay-marriage-opponents-keep-streak-alive","05:23 AM","gay-rights-debates",22
"11-07-2009","23","13537","46","Matthew S","377190","Fine then I think the people of California should decide weather the people of Michigan can get to have drivers licenses.","JPSartre12","377266","Since when does one state get to make thast determination for another state? You're building moldy strawmen now, Matt.","gay-marriage-opponents-keep-streak-alive","07:03 PM","gay-rights-debates",22
"11-08-2009","23","13537","47","JPSartre12","377266","Since when does one state get to make thast determination for another state? You're building moldy strawmen now, Matt.","Matthew S","377340","Since when does group of citizens get to vote on the civil rights of another group when the vote will not effect them? Letting the majority vote on whether a minority gets to marry is like letting the people of California decide if the people of Michigan get driver licenses. The people of California still get to drive and it hasn't effected their lives but with their vote they have adversely effected the lives of others.","gay-marriage-opponents-keep-streak-alive","08:20 AM","gay-rights-debates",79
"05-18-2010","27","13537","450","Sigma","402219","Of course they would still apply. Who cares if those involved are in love or not? It's just a contract between any two people. If I want my best friend to inherit or to make medical decisions, I could marry them. I don't have to actually have any romantic feelings, since it's just a contract. The big deal is basically what you've said in this post. Marriage is meaningful. It has been a custom that has not included homosexual people (with rare if any exceptions). You want to change that meaning, this custom. When you change the meaning of something that is actually very meaningful to a great deal of people don't be surprised if you tick off a portion of that population. .","Matthew S","402284","That is the whole point isn't it. Marriage is a contract between the state and the two people involved. The whole ironic thing is to the anti gay christianists that are so opposed to gay marries the religious marriage is what counts and is the important aspect but they can not stop gay people from getting religious marriage only the contract from the state, which to the anti gay christianists means nothing. How are they harmed if two men they do not know sign a contract with the state. Are they going to be offended If I form a corporation? It is none of their business, just as their marriages are none of my business. Yes they are forced to have to accept same sex marriages big f'n deal I am forced to accept their hetero marriages. They didn't ask my permission if they could get married so why should I have to ask their permission?","gay-marriage-opponents-keep-streak-alive","09:47 PM","gay-rights-debates",166
"05-18-2010","27","13537","451","Matthew S","402284","That is the whole point isn't it. Marriage is a contract between the state and the two people involved. The whole ironic thing is to the anti gay christianists that are so opposed to gay marries the religious marriage is what counts and is the important aspect but they can not stop gay people from getting religious marriage only the contract from the state, which to the anti gay christianists means nothing. How are they harmed if two men they do not know sign a contract with the state. Are they going to be offended If I form a corporation? It is none of their business, just as their marriages are none of my business. Yes they are forced to have to accept same sex marriages big f'n deal I am forced to accept their hetero marriages. They didn't ask my permission if they could get married so why should I have to ask their permission?","Sigma","402286","I suppose. I'm not religious, so what Christians do is pretty meaningless to me. I would not claim anyone is harmed. But we all have to live in this society, so the official policies are our business. Your threat here is empty since heterosexual marriage is the status quo . You have to justify changes you wish to make to the status quo, but what currently is in place doesn't need justification.","gay-marriage-opponents-keep-streak-alive","10:16 PM","gay-rights-debates",80
"05-19-2010","27","13537","456","Sigma","402286","I suppose. I'm not religious, so what Christians do is pretty meaningless to me. I would not claim anyone is harmed. But we all have to live in this society, so the official policies are our business. Your threat here is empty since heterosexual marriage is the status quo . You have to justify changes you wish to make to the status quo, but what currently is in place doesn't need justification.","Matthew S","402315","It was a christian organization, or group, or christianally deluded legislators in every case that gathered signatures for and put these marriage amendments on the ballot in every state. If I own a business I am legally forced, as a gay man, to recognise that hetero marriage. Your right we all have to live in this society and they demand that I respect, and acknowledge, their marriages. One could use your argument about slavery, misogyny, or any other unjust system. It is the status quo so there is nothing wrong with it.","gay-marriage-opponents-keep-streak-alive","07:24 AM","gay-rights-debates",105
"05-19-2010","27","13537","457","Matthew S","402315","It was a christian organization, or group, or christianally deluded legislators in every case that gathered signatures for and put these marriage amendments on the ballot in every state. If I own a business I am legally forced, as a gay man, to recognise that hetero marriage. Your right we all have to live in this society and they demand that I respect, and acknowledge, their marriages. One could use your argument about slavery, misogyny, or any other unjust system. It is the status quo so there is nothing wrong with it.","Sigma","402327","Good for them. It's an issue that should be voted on ""right"" and ""wrong"" are value judgements. It is the challenger's responsibility not to show the status quo as unjust, but that their proposal is somehow better than the status quo.","gay-marriage-opponents-keep-streak-alive","09:49 AM","gay-rights-debates",49
"05-19-2010","27","13537","458","Sigma","402327","Good for them. It's an issue that should be voted on ""right"" and ""wrong"" are value judgements. It is the challenger's responsibility not to show the status quo as unjust, but that their proposal is somehow better than the status quo.","Matthew S","402330","So then all civil rights from freedom of speech to religious freedom should be voted upon? Because I would love to vote to take religious freedom away from the christianists. nonsense it is called protecting heterosexual privilege and nothing more.","gay-marriage-opponents-keep-streak-alive","10:03 AM","gay-rights-debates",43
"05-19-2010","27","13537","461","Matthew S","402330","So then all civil rights from freedom of speech to religious freedom should be voted upon? Because I would love to vote to take religious freedom away from the christianists. nonsense it is called protecting heterosexual privilege and nothing more.","Sigma","402335","What civil rights? Are unmarried individuals denied rights? What privilege is that?","gay-marriage-opponents-keep-streak-alive","10:34 AM","gay-rights-debates",15
"05-19-2010","27","13537","463","Sigma","402335","What civil rights? Are unmarried individuals denied rights? What privilege is that?","Matthew S","402342","That is not the question I asked Do you believe taht basic rights such as freedom of speech and religion should go on to the ballot? For instance do you think that the religious freedom of say that mormon, for instance, should go on the ballot for people to vote away? The privlege they are trying to defend by keeping gay people from marriage.","gay-marriage-opponents-keep-streak-alive","12:38 PM","gay-rights-debates",69
"05-19-2010","27","13537","466","Matthew S","402342","That is not the question I asked Do you believe taht basic rights such as freedom of speech and religion should go on to the ballot? For instance do you think that the religious freedom of say that mormon, for instance, should go on the ballot for people to vote away? The privlege they are trying to defend by keeping gay people from marriage.","Sigma","402346","Since they are Constitutional rights, it would be slightly impossible to do :P What privelige is that? We don't have a right to love (at least, not one the gov't can help with). We don't have a right to marry whomever we love, or to love whomever we marry. What do you lack that every single unmarried person in America does not also lack, gay or straight?","gay-marriage-opponents-keep-streak-alive","01:00 PM","gay-rights-debates",77
"05-22-2010","28","13537","499","Sigma","402650","In the current state of affairs, unmarried homosexual people can marry the same people that unmarried heterosexual people can and obtain the same benefits. I realize there is a certain amount of sophistry with that line of reasoning since the two groups don't wish to marry the same people, but it is not false statement. This renders the entire ""gay rights"" argument, as I know it at least, null since the current state of affairs is equal in terms of rights. I think there are combination of forces. On an instinctual level I would hazard that heterosexual relationships enjoy the perception of purpose and meaning where homosexual relationships do not. On an intellectual level, as I explained, arguing in terms of ""rights"" seems to be the wrong question to be asking in the first place.","Matthew S","402657","At one time only a white person could marry another white person and a black person could only marry a black person. They were equal also. I can not marry another gay person but I can only marry a heterosexual person how is that equal? You are right so lets look at the constituion. Not allowing gay people tyo marry violates the 1st amendment, the 14th amendment, and the full faith and credit clause of the US constituion.","gay-marriage-opponents-keep-streak-alive","06:37 AM","gay-rights-debates",85
"05-22-2010","28","13537","500","Matthew S","402657","At one time only a white person could marry another white person and a black person could only marry a black person. They were equal also. I can not marry another gay person but I can only marry a heterosexual person how is that equal? You are right so lets look at the constituion. Not allowing gay people tyo marry violates the 1st amendment, the 14th amendment, and the full faith and credit clause of the US constituion.","Sigma","402669","I said: unmarried homosexual people can marry the same people that unmarried heterosexual people can. What if I said: unmarried black people can marry the same people that unmarried white people can. Would that be true if black people could not marry white people? The answer is no, white people could not marry the same partners that black people could. That is an unequal situation. Homosexual people and heterosexual people, on the other hand, have to follow the same rules. Who is not allowing homosexual people to marry? As far as I know, homosexual people are not barred from marriage. Homosexual people just have to follow the same rules heterosexual people do when they choose a partner. Now, what rights would that violate?","gay-marriage-opponents-keep-streak-alive","09:33 AM","gay-rights-debates",140
