"Date","DiscussionId","PageId","QuoteAuthor","QuoteId","QuoteText","ResponseAuthor","ResponseId","ResponseText","Subtopic","Time","Topic","postCounter"
"11-17-2003","1233",2,"sundowner","None","My grandfather always told me never help those that first won't help themselves. If you do, they learn to be reliant rather than self reliant.","montalban","22943","Ah, a pity for people who are quadraplegic then. Sittin' around all day, not lifting a finger to help themselves! What about babies, just lying around all day demanding to be fed. Bloody parasites!","foreign-aid-should-we","05:12 AM","government-debates","16"
"11-17-2003","1233",2,"theLIBERTARIAN","None","Hey it may be good now but give it a few years. You are talking the typical liberal speak. You want the government to help or take care of people. You think the government is just great dont you. What am I talking about? There seems to always be a war going on in the Middle East. Much of the time we are supplying the weapons. You call balance one side having overwhelming power over the other? That is silly. That is your excuse for giving taxpayer money to Israel? If you roll the dice enough the Israelis might lose? Sure anything is possible. I really dont care if they do lose. They are not part of the US. Why do you care? Why would we need the Israelis? Also, just because you have free trade does not justify foreign aid. There I no reasoning there. I looked back and in that quote you are referring to I did not mention 9-11. I mention cause and effect. If you smoke cigarettes there is a higher possibility you will get cancer. You cannot take taxpayer money, toss it around and expect nothing bad to come from it. According to OBL one of the two reasons for 9-11 was our support of Israel. Do you see the cause and effect? You want to give money away so they like us? Goodwill? Who cares if they like our government? It is not my responsibility. Plus, we seem to back some of the cruelest dictators at times. What reasons do you favor giving taxpayer money to other countries? You personally can give money; no one is going to stop you. But why force everyone to?","AMD4EVER","22957","Liberal speak? I simply said you should view both the good and the bad of any situation. If you are to shield all the good or bad from any situation then the answer will appear apparent when infact you are only basing your answer on a very limited and bias information. If it is only ""liberals"" who believe you should look at both the good and the bad of any situation and try to remain unbiased then all hail liberals for they are wise indeed. However I don't believe this is the case. I don't believe this is a trait that belongs to just one type of politician. The government does help take care of people in case you haven't noticed. You are probably again only looking at the negatives and not the positives and therefore have concluded that it is only a dream that the government could possibly help a single person. So let me ask you, can you even admit that the government may have helped one person that you know in any way and can you tell me how this person was helped? Do the reverse as well and tell me how one person you know was hurt by the government just to keep this balanced. I asked for specifics. Can you tell me specifically what war is constantly ongoing or were you being a little dramatic a few posts back? Supplying weapons isn't unbalancing in itself. If a room full of people get supplied weapons while they are calmly sitting down and talking is the situation anymore unbalanced now than it was a few minutes ago? I'm not suggesting that the Middle East is calmly sitting down and talking but I am suggesting that supplying weapons isn't unbalancing in itself. You have to tell me how these weapons are causing an inbalance in the Middle East. As you brought up before Israel once had to fight off a massive attack against them by several enemies on several fronts on short notice. This was not a balanced war and Israel won so you probably agree because they won the war was out of balanced in Israel's favor. At this time however they were heavily out numbered and out gunned. So are weapons the only judge of balance? Also you probably realize that the world has not has a world war in almost 60 years now and in that time the US has become a massive powerhouse of a nation along with Russia. Our two countries alone could level the entire Earth with our weapons while no other nation can come even close to being in the same league as us. So how has this massive inbalance led to almost 60 years without a massive war while the 60 years before that had 2 massive wars? Let say you are in 5th grade and you have a brother who is in 2nd grade. Some bullies pick on him every day but eventually quit picking on him only because they know if they do again you will be there to defend him. But why should you defend him? He isn't you and you are in far less danger if you just avoid the whole situation right? So a day comes where the 2nd grade bullies are picking on him again, do you find any reason to help him? Do you help him if he is only a friend of yours? Do you help him if he is a friend of your brothers or a friend of your friend? How about if you had never seen him before in your life? I would hope that you are willing to simply stand up for what is right and not what is easiest. Using grade school playground terminology I think Israel is the 2nd grader and the US is the 5th grader while a bunch of bullies are looking to pick him the littler Israel. I don't think it is right and having recently been picked on ourselves this 5th grader isn't about to let the bullies have free reign over Israel. This is how I view the situation. How do you view it? Why do we need a 2nd grader? There are thousands more like them so why worry about just one? Is that what you are asking? You are hard to get through to sometime. We are not talking aid at all here. We are talking about things we may one day regret. We may one day regret NAFTA because it supported the Canadian economy. What if one day they become more powerful than us and turn on us. Do you think we could regret having ever been of any service to them? So should we end NAFTA now because it may one day turn on us? You also agreed that 9-11 would have happened if we stayed completely out of foreign affairs. It was not just cause and effect, it was inevitable. Cancer is not inevitable although it is likely regardless of cigarettes. How about do you see the cause and effect of the Arab nations rising up against Israel right now? They could either win or lose. If they lose they probably get nuked and world tensions rise. If they win the arabs now have nukes and many of them and world tensions rise. If Israel is simply attacked world tensions rise. Is there a cause and effect for the US pulling support from Israel? In my view there sure is but maybe you don't believe there is. Goodwill would be the result of helping people who need it. I wouldn't give money just to please people but I would please people anyways as a result of my actions. It also does matter that they like our government. If they were all to hate us I can see a cause and effect happening. You seem to not want to take responsibility for anything other than yourself. I would imagine a lot of your libratarian friends do the same. It really is a selfish form of government although selfishness does lower taxes. For the good of others and for ourselves. It is sort of like why people give money to the church. They do it and really get nothing in return except a goodfeeling of having helped an organization who will help others. The government does force people to do this now unlike the church but you can see how the basic principle ties into the real world. Also personally giving money is not going to always go into the right hands either. Personally giving money to Africa in general doesn't always get to the specific location it is supposed to go to. The government has more control over where the money goes and who it helps. True they should do a better job of making sure it gets where it is going. They need to reform.","foreign-aid-should-we","09:29 AM","government-debates","17"
"11-17-2003","1233",2,"AMD4EVER","None","Liberal speak? I simply said you should view both the good and the bad of any situation. If you are to shield all the good or bad from any situation then the answer will appear apparent when infact you are only basing your answer on a very limited and bias information. If it is only ""liberals"" who believe you should look at both the good and the bad of any situation and try to remain unbiased then all hail liberals for they are wise indeed. However I don't believe this is the case. I don't believe this is a trait that belongs to just one type of politician. The government does help take care of people in case you haven't noticed. You are probably again only looking at the negatives and not the positives and therefore have concluded that it is only a dream that the government could possibly help a single person. So let me ask you, can you even admit that the government may have helped one person that you know in any way and can you tell me how this person was helped? Do the reverse as well and tell me how one person you know was hurt by the government just to keep this balanced. I asked for specifics. Can you tell me specifically what war is constantly ongoing or were you being a little dramatic a few posts back? Supplying weapons isn't unbalancing in itself. If a room full of people get supplied weapons while they are calmly sitting down and talking is the situation anymore unbalanced now than it was a few minutes ago? I'm not suggesting that the Middle East is calmly sitting down and talking but I am suggesting that supplying weapons isn't unbalancing in itself. You have to tell me how these weapons are causing an inbalance in the Middle East. Also you probably realize that the world has not has a world war in almost 60 years now and in that time the US has become a massive powerhouse of a nation along with Russia. Our two countries alone could level the entire Earth with our weapons while no other nation can come even close to being in the same league as us. So how has this massive inbalance led to almost 60 years without a massive war while the 60 years before that had 2 massive wars? Let say you are in 5th grade and you have a brother who is in 2nd grade. Some bullies pick on him every day but eventually quit picking on him only because they know if they do again you will be there to defend him. But why should you defend him? He isn't you and you are in far less danger if you just avoid the whole situation right? So a day comes where the 2nd grade bullies are picking on him again, do you find any reason to help him? Do you help him if he is only a friend of yours? Do you help him if he is a friend of your brothers or a friend of your friend? How about if you had never seen him before in your life? I would hope that you are willing to simply stand up for what is right and not what is easiest. Using grade school playground terminology I think Israel is the 2nd grader and the US is the 5th grader while a bunch of bullies are looking to pick him the littler Israel. I don't think it is right and having recently been picked on ourselves this 5th grader isn't about to let the bullies have free reign over Israel. This is how I view the situation. How do you view it? Why do we need a 2nd grader? There are thousands more like them so why worry about just one? Is that what you are asking? You are hard to get through to sometime. We are not talking aid at all here. We are talking about things we may one day regret. We may one day regret NAFTA because it supported the Canadian economy. What if one day they become more powerful than us and turn on us. Do you think we could regret having ever been of any service to them? So should we end NAFTA now because it may one day turn on us. You also agreed that 9-11 would have happened if we stayed completely out of foreign affairs. It was not just cause and effect, it was inevitable. Cancer is not inevitable although it is likely regardless of cigarettes. How about do you see the cause and effect of the Arab nations rising up against Israel right now? They could either win or lose. If they lose they probably get nuked and world tensions rise. If they win the arabs now have nukes and many of them and world tensions rise. If Israel is simply attacked world tensions rise. Is there a cause and effect for the US pulling support from Israel? In my view there sure is but maybe you don't believe there is. Goodwill would be the result of helping people who need it. I wouldn't give money just to please people but I would please people anyways as a result of my actions. It also does matter that they like our government. If they were all to hate us I can see a cause and effect happening. You seem to not want to take responsibility for anything other than yourself. I would imagine a lot of your libratarian friends do the same. It really is a selfish form of government although selfishness does lower taxes. For the good of others and for ourselves. It is sort of like why people give money to the church. They do it and really get nothing in return except a goodfeeling of having helped an organization who will help others. The government does force people to do this now unlike the church but you can see how the basic principle ties into the real world. Also personally giving money is not going to always go into the right hands either. Personally giving money to Africa in general doesn't always get to the specific location it is supposed to go to. The government has more control over where the money goes and who it helps. True they should do a better job of making sure it gets where it is going. They need to reform.","theLIBERTARIAN","22970","The reason it sounded like typical liberal speak is because you have this urge to help people using the government. Personally, I would like the Federal government to leave me alone and dont try to help anybody, except removing people from society that commit force or fraud (in the US only). Just because the government does try to help people does not mean I think it is right. You are right, in the long run the government can NOT help people. Specifics. I have seen the Israeli / Palestinian conflict non-stop for decades. Besides I have seen many wars occur in the area besides that. How can there be an imbalance of weapons in the Middle East? Here is how: One side is supplied with a large quantity of weapons. There was mutual assured destruction (MAD). Who is the bully? Who has the most weapons the Palestinians or the Israelis? Should we arm the underdog? No way! I dont think it is right giving a second grader a gun. If the second grader then shoots people we would and should be held responsible. Or should we go in and send troops? Hey, if you want to go over and help people or send them money go ahead. Viewing government actions for the past few decades, I would say they backfire more times than not. Even those that dont backfire seem to at a later time. Israel, Nigeria, Columbia, Viet Nam are not part of the US. You can help them personally, but IMHO our collective should not. Well, in a way I do agree with you. I think NAFTA was unnecessary. We could have just lowered Tariffs. What does concern me is the governing body that NAFTA requires, without oversight from our elected officials. I do agree NAFTA was bad there. BUT, we never needed to impose tariffs or taxes on goods. This initial government action should not have taken place. Correlating to what we are talking about : We should not have imposed taxes in the first place then we would not need NAFTA. We should never have given aid to Israel then according to OBL 9-11 probably would not have occurred (also we should not have stationed troops in Saudi Arabia - the other reason for 9-11) I did not say 9-11 would have happened if we did not stay out of foreign affairs. I did say 9-11 happened while we were doing what YOU advocate, ie giving money to foreign countries. So your actions did not prevent 9-11. My opinion: We should have never given money away in the first place. It might have been sold to us originally as good intentions but this road to hell is paved with good intentions (have you heard that quote?). Yes, I think there will be negatives to pulling our support for Israel. Our politicians would probably receive less money in the form of contributions. But on the up side: It would save the taxpayer money or at least keep the money here. We would be resented less throughout the Arab world. Israel is not part of the United States. It does not concern me anymore than any other country. If you want to help, go ahead, IMHO. You call me selfish because I do not favor forced charity. I contribute money besides what I pay in taxes. And yes I am selfish. No one will care for my kids like I do. You dont do you? I need to feed and shelter my kids, not the world. No, in fact much of the money we gave in aid to Africa went to purchasing weapons. Good point. They cant do a better job. This is what you dont understand. Maybe you are little young, I dont know. The government is not as good at the private sector and never will be.","foreign-aid-should-we","01:35 PM","government-debates","18"
"11-17-2003","1233",2,"theLIBERTARIAN","None","Like I said, you can spend your money on what ever you want. I gave money to help mothers left here while their husbands are in Iraq. This is the way charity should work: voluntarily. This is your idea of developing relations? We have to give them money? I like the free market. I dont like spilling blood so I can save a few pennies on oil. OR I dont like taking tax money and bribing people so the consumer can save some money. It is not the taxpayers responsibility. How about some shoes for my kids. My sons have worn hand-me downs. We have shopped at the thrift store for my daughters dresses. Hey, if you have lots of extra money you send the government or foreign governments money. My kids are still young, so they dont seem to care. We are doing better now. But my feelings come from the decades of poverty I experienced. Mad and AMD, let me ask you both a question if you dont mind. Do you guys have kids?","Madhat","22972","Right. But not every person actually will spend his money on good causes. Your government knows what's good for you and your country (well.... not always, but I have faith in the good willingness of the US government). As a leading nation I think the US does have responsibility to help other nations. One of the biggest complaints the radical leftists had was the US sanctions opposed on Iraq. Hundreds of thousands of Iraqi people died because of that. Let's not take that example to argue whether it was justified or not, but it shows that no one will just take his money and spend it on foreign aid. Why spilling blood? The US doesn't spill blood over Egypt, Jordan, etc. It's a two way benefit. Both sides can be happy with the income. So you do not care that Israel could've lost in 1973? You do not care that millions of people would have been slaughtered. What about WW2? If the US could send money to Europian countries to beat Nazi Germany you wouldn't support it? That way you wouldn't even have to go to war and get killed. Just make others powerful so they'll do the job for you. Anyways, you said Israel could survive on its own. You said Israel won before US aid ever came in. I showed you that that war (1947-9) was barelly won, and Israel almost lost another war (in 1973) with American aid. Do you think you will pay less tax if foreign aid will be cut? I am definately not an expert on these things and I do not know much about this stuff. But it seems to me that tax money wouldn't change. And no I don't have kids of my own. And I am only slightly mad, not totally...","foreign-aid-should-we","01:47 PM","government-debates","19"
"11-17-2003","1233",2,"None","None","None","theLIBERTARIAN","22976","Mad, I like your sense of humor. It almost makes me want to write a check and send it to the government, BUT I do not think government knows what's good for you and your country. If fact it is the opposite. I think our elected officials are sold out to the highest bidder. Do you remember the Microsoft Anti-trust suit? Did you know Microsoft spent very little in contributions before the suit? (rhetorical dont answer). Well, after they were sued by the justice department that all changed. They are now one of the largest contributors and the suit disappeared. I dont think MS should have been sued but it does illustrate how the government may have different motives than whats good for you. PS, thanks for answering about the kids question.","foreign-aid-should-we","02:10 PM","government-debates","20"
