"Date","DiscussionId","PageId","QuoteAuthor","QuoteId","QuoteText","ResponseAuthor","ResponseId","ResponseText","Subtopic","Time","Topic","postCounter"
"11-18-2003","1233",2,"theLIBERTARIAN","None","The reason it sounded like typical liberal speak is because you have this urge to help people using the government. Personally, I would like the Federal government to leave me alone and dont try to help anybody, except removing people from society that commit force or fraud (in the US only). Just because the government does try to help people does not mean I think it is right. You are right, in the long run the government can NOT help people. Specifics. I have seen the Israeli / Palestinian conflict non-stop for decades. Besides I have seen many wars occur in the area besides that. How can there be an imbalance of weapons in the Middle East? Here is how: One side is supplied with a large quantity of weapons. There was mutual assured destruction (MAD). Who is the bully? Who has the most weapons the Palestinians or the Israelis? Should we arm the underdog? No way! I dont think it is right giving a second grader a gun. If the second grader then shoots people we would and should be held responsible. Or should we go in and send troops? Hey, if you want to go over and help people or send them money go ahead. Viewing government actions for the past few decades, I would say they backfire more times than not. Even those that dont backfire seem to at a later time. Israel, Nigeria, Columbia, Viet Nam are not part of the US. You can help them personally, but IMHO our collective should not. Well, in a way I do agree with you. I think NAFTA was unnecessary. We could have just lowered Tariffs. What does concern me is the governing body that NAFTA requires, without oversight from our elected officials. I do agree NAFTA was bad there. BUT, we never needed to impose tariffs or taxes on goods. This initial government action should not have taken place. Correlating to what we are talking about : We should not have imposed taxes in the first place then we would not need NAFTA. We should never have given aid to Israel then according to OBL 9-11 probably would not have occurred (also we should not have stationed troops in Saudi Arabia - the other reason for 9-11) I did not say 9-11 would have happened if we did not stay out of foreign affairs. I did say 9-11 happened while we were doing what YOU advocate, ie giving money to foreign countries. So your actions did not prevent 9-11. My opinion: We should have never given money away in the first place. It might have been sold to us originally as good intentions but this road to hell is paved with good intentions (have you heard that quote?). Yes, I think there will be negatives to pulling our support for Israel. Our politicians would probably receive less money in the form of contributions. But on the up side: It would save the taxpayer money or at least keep the money here. We would be resented less throughout the Arab world. Israel is not part of the United States. It does not concern me anymore than any other country. If you want to help, go ahead, IMHO. You call me selfish because I do not favor forced charity. I contribute money besides what I pay in taxes. And yes I am selfish. No one will care for my kids like I do. You dont do you? I need to feed and shelter my kids, not the world. No, in fact much of the money we gave in aid to Africa went to purchasing weapons. Good point. They cant do a better job. This is what you dont understand. Maybe you are little young, I dont know. The government is not as good at the private sector and never will be.","AMD4EVER","23077","What about people who speed in their cars? Should the government try and handle this problem as well? Or how about fires that break out? Should the government have any role in containing these fires? Or would you rather just depend on volenteers for everything the government does now? I'm glad you answered this way. You have shown your true colors and anyone who wishes to see this need only refer to post #18 where you made this response. I asked several questions which you didn't answer and you blatantly have shown that you are unable to admit that the government can possible help even one person when you have to know that it is true that they have. That is not a war. You said a war was going on. The balance to this is that the Arabs have sheer numbers advantages over the Israelis. It is balanced now because the Israelis have the weapons to fight against these numbers. So weapons provide balance as I have shown before. The Arabs would invade Israel if not for MAD but since Israel has these weapons the Arabs won't budge. Israel would invade the Arabs if not for Russia and Europe. So basically the weapons are causing balance even in this conflict. The bully is anyone who tries to invade another nation. Israel has been invaded over and over by the Arabs and ever since then they have been trying to prevent it from happening again. They are the ones being bullied and there is no debate about that. BTW, why not arm the underdogs if they are the ones who will need the help the most? Also I thought you said Israel was too powerful so why are they suddenly the underdogs? We never gave the 2nd grader a gun. We gave him training in karate at most. The gun equivilant to a 2nd grader would be giving a country many nuclear weapons. They are linked to the US however. I can see obvious reason to help Israel as I'm sure you can see as well but just don't want to admit it (per your 2nd quote in this post). You know you are wrong in this area but are too proud to admit it. So I guess the question now becomes why do you continue to defend something that makes no sense in your own head? Actually you should defend tariffs to the grave if you don't want us to somehow help another country that may one day turn on us. We should have massive tariffs in order to prevent any country from doing any business at all with us. We wouldn't want to sell someone something at a fair price if they may one day use it against us. Shouldn't that be your view? If we had just isolated ourselves from the world completely we could live in harmony. Lock down all borders and let no one in just in case we may regret letting them in later. Don't talk to the UN or NATO or any other country as me may regret talking to them later. Just how far are you willing to let your paranoia about regreting a future event go anyways? My actions have prevented another 9-11. You basically have no evidence of what ""your"" actions could do as no one has ever attempted ""your"" actions. Lets assume what you are saying here was the policy of the government before WWII. You are the president and the Nazi's are beginning to take control of Europe. You stayed so isolated that the Japanise never felt that the US was a threat so Pearl Harbor never happened. It is 1942 and England is about to fall and needs our help just as China is begging for help. China and England are not part of the US so does it concern you what is happening there as long as Germany and Japan don't do any physical harm to the US? Do you keep taxes low and not build up our military even if you don't plan on helping the fight overseas? This is the ultimate failure of your system of thinking. When something like this should happen you will have no good answer. Either you will go back on everything you have said and join the fight or you will sit back and await the fall of your nation and government. But based on your response to my previous questions I really don't expect that you would answer these questions either. I call you selfish because of quotes like ""Israel is not part of the United States. It does not concern me anymore than any other country"". You basically state that the fall of Israel would not be your concern. The nukes that Israel would use during their fall against the Middle East would not be your concern. You simply would not care what is happening as long as it does not directly affect you. That is why I call you selfish. As for your kids analogy, I care more for others than you do as I care that Israel is not invaded and that people don't have to die in a bloody war there. You don't care at all. I know I care that your kids get fed and have shelter just as I care that Canadian kids get fed and have shelter. You probably simply stop your caring once you reach our Northern border if not sooner. Exactly. Reform is necessary! They can't or won't? Of course they can do a better job but just don't know how to handle tracking where their money gets spent so therefore they just won't do this. If you don't believe that our government is good for our private sector then what do you believe is good for our private sector? The US didn't just become #1 in the world because we are the ""United States"". The government set up our economic system long before you were born. They set up our military defense which has protected us from invasion for hundreds of year. The government has looked out for the interests of our children and helped define what America is for centuries. You are basically stating that if the government never existed that our private sector would be better than it is now. Frankly that is idiotic. You also fail to tell me what libritarian government would be able to do in the time of a crisis. List off a few crisis's that you can forsee happening to the US within the next 50 years and let me know how the libritarian government will handle these crisis's better than our current government. I do hope you have the ability to provide an good response to this.","foreign-aid-should-we","10:21 AM","government-debates","21"
"11-22-2003","1233",2,"AMD4EVER","None","What about people who speed in their cars? Should the government try and handle this problem as well? Or how about fires that break out? Should the government have any role in containing these fires? Or would you rather just depend on volenteers for everything the government does now? I'm glad you answered this way. You have shown your true colors and anyone who wishes to see this need only refer to post #18 where you made this response. I asked several questions which you didn't answer and you blatantly have shown that you are unable to admit that the government can possible help even one person when you have to know that it is true that they have. That is not a war. You said a war was going on. The balance to this is that the Arabs have sheer numbers advantages over the Israelis. It is balanced now because the Israelis have the weapons to fight against these numbers. So weapons provide balance as I have shown before. The Arabs would invade Israel if not for MAD but since Israel has these weapons the Arabs won't budge. Israel would invade the Arabs if not for Russia and Europe. So basically the weapons are causing balance even in this conflict. The bully is anyone who tries to invade another nation. Israel has been invaded over and over by the Arabs and ever since then they have been trying to prevent it from happening again. They are the ones being bullied and there is no debate about that. BTW, why not arm the underdogs if they are the ones who will need the help the most? Also I thought you said Israel was too powerful so why are they suddenly the underdogs? They are linked to the US however. I can see obvious reason to help Israel as I'm sure you can see as well but just don't want to admit it (per your 2nd quote in this post). You know you are wrong in this area but are too proud to admit it. So I guess the question now becomes why do you continue to defend something that makes no sense in your own head? Actually you should defend tariffs to the grave if you don't want us to somehow help another country that may one day turn on us. We should have massive tariffs in order to prevent any country from doing any business at all with us. We wouldn't want to sell someone something at a fair price if they may one day use it against us. Shouldn't that be your view? If we had just isolated ourselves from the world completely we could live in harmony. Lock down all borders and let no one in just in case we may regret letting them in later. Don't talk to the UN or NATO or any other country as me may regret talking to them later. Just how far are you willing to let your paranoia about regreting a future event go anyways? My actions have prevented another 9-11. You basically have no evidence of what ""your"" actions could do as no one has ever attempted ""your"" actions. Lets assume what you are saying here was the policy of the government before WWII. You are the president and the Nazi's are beginning to take control of Europe. You stayed so isolated that the Japanise never felt that the US was a threat so Pearl Harbor never happened. It is 1942 and England is about to fall and needs our help just as China is begging for help. China and England are not part of the US so does it concern you what is happening there as long as Germany and Japan don't do any physical harm to the US? Do you keep taxes low and not build up our military even if you don't plan on helping the fight overseas? This is the ultimate failure of your system of thinking. When something like this should happen you will have no good answer. Either you will go back on everything you have said and join the fight or you will sit back and await the fall of your nation and government. But based on your response to my previous questions I really don't expect that you would answer these questions either. I call you selfish because of quotes like ""Israel is not part of the United States. It does not concern me anymore than any other country"". You basically state that the fall of Israel would not be your concern. The nukes that Israel would use during their fall against the Middle East would not be your concern. You simply would not care what is happening as long as it does not directly affect you. That is why I call you selfish. As for your kids analogy, I care more for others than you do as I care that Israel is not invaded and that people don't have to die in a bloody war there. You don't care at all. I know I care that your kids get fed and have shelter just as I care that Canadian kids get fed and have shelter. You probably simply stop your caring once you reach our Northern border if not sooner. Exactly. Reform is necessary! They can't or won't? Of course they can do a better job but just don't know how to handle tracking where their money gets spent so therefore they just won't do this. If you don't believe that our government is good for our private sector then what do you believe is good for our private sector? The US didn't just become #1 in the world because we are the ""United States"". The government set up our economic system long before you were born. They set up our military defense which has protected us from invasion for hundreds of year. The government has looked out for the interests of our children and helped define what America is for centuries. You are basically stating that if the government never existed that our private sector would be better than it is now. Frankly that is idiotic. You also fail to tell me what libritarian government would be able to do in the time of a crisis. List off a few crisis's that you can forsee happening to the US within the next 50 years and let me know how the libritarian government will handle these crisis's better than our current government. I do hope you have the ability to provide an good response to this.","theLIBERTARIAN","23631","Just because we have a fire department and police does not mean we need to have every law you can imagine. Like I have said before, leave it to local governments for police and fires. the road to hell is paved with good intentions. I dont care about intentions. I consider it a war. There are more Chinese. That does not mean the Chinese can win a war with the US. I see why you say balance now. Does there have to be a balance? Why does the American Taxpayer have to foot the bill? I would say the Palestinians are the underdogs. That does not mean we should arm them. WE do not need balance. That does not justify our giving tax money to Israel. You are wrong. Why do you say Israel is linked to the US? You are silly and wrong. You feel if you lose one argument for your socialist program your whole house of cards will collapse. Actually you are such an extreme liberal I dont know where to begin. Now you want to defend tariffs. I addressed this argument in the tax section of this forum under steel tariffs. You are the paranoid one. You are afraid and feel the solution is to give taxpayer money away. You can not prove your actions have prevented another 9-11. 9-11 did happen with your plan of meddling in place. You cannot deny 9-11 happened. You somehow believe a country or two can take over the world and control it. You are mistaken. No country can do this. We are in the best position of any country throughout history to do so and we get bogged down trying to control just a few or one for an EXTENED PERIOD OF TIME. The only method of controlling a country is to kill all of the inhabitants. We cannot control Iraq until all inhabitants have perished (control indefinably that is). So until you are ready to genocide populations, we will never win. This is the failure of YOUR system. Oh, because Israel has nukes we have to give them taxpayer money? You are silly. You say I dont care at all. Quit making things up to support your flimsy arguments. I said I dont care anymore about Israel than other countries. Typical liberal answer: Oh lets not do away with the program, lets reform it. We have trying to reform it for decades. You are afraid your whole socialist house of cards will collapse. FREE enterprise is good for the private sector. Socialism kills the private sector. Government interference kills the private sector. Regulations hurt small businesses more than large ones. This probably went right over your head though. When you grow up you will understand, hopefully. Blah Blah Blah. We are successful because of freedom. Compare Hong Kong to China, East and West Germany, North and South Korea. What is the difference? Freedom. You do the same with your philosophy. My goal would be to NOT BE A TARGET. If we do not entangle ourselves in foreign wars and meddling there would be less resentment. After all, according to OBL, it was resentment that caused 9-11 (our money to Israel and troops in Saudi Arabia). NOW AMD, what is your solution for eliminating the resentment for the next 50 years?","foreign-aid-should-we","04:07 PM","government-debates","22"
"11-22-2003","1233",2,"None","None","None","theLIBERTARIAN","23660","This discussion has become quite involved AMD. It is hard to read your post and not respond. When I started reading your posts in this forum I thought you were conservative. I was mistaken. I still respect your opinion. I am sure there are things I have said that you disagree with. You will want to respond. Go ahead. I might respond to your post, or may not. I am trying to figure out what our fundamental difference is. Very rarely do I wan the government to fix something. I dont want the governments help per se. I do want local governments to provide police and fire protection. I do want the states to build roads with money collected from a gas tax. As for the Federal Government: Many members of the Libertarian Party do not feel the need for a standing army. They feel if we are ever invaded, everyone grab their guns and fight. Personally, I have favored a standing army. I do understand why they dont though. They feel our government will use a standing army to invade and kill people in other countries. Back to foreign aid: I feel most government programs become corrupted and I favor very few. To me Israel is just like any other country, IMHO, they just lobby better. Footnote: Your philosophy reminds me of mine when I graduated high school. Over the past few decades it has changed. I attribute my early socialist thoughts to socialist programming in a socialist school system. I thought government was good. Now I realize we would all be better off without public education.","foreign-aid-should-we","08:55 PM","government-debates","23"
"02-06-2004","1233",2,"None","None","None","Jamesg","34114","I think we should eliminate foreign aid to developed countries, as they have an economy great enough to be able to hold their own weight....but continue to assist developing countries.","foreign-aid-should-we","04:41 PM","government-debates","24"
"02-06-2004","1233",2,"theLIBERTARIAN","None","I was looking at the Libertarian Party website and guess what; Those guys agree with me. Do you think we should give foreign aid to countries? http://www.lp.org/issues/foreign-policy.html Libertarian foreign policy: Ending welfare for nations -- foreign aid","hvozdany","34116","Although, there is something to be said for this, I am suprised anyone would take such an absolute stance. Does that mean that you would not have supported the Marshall Plan? I assumed most people thought the Marshall Plan one of the greatest acts of diplomacy in history. Who would have belived 50 years ago that Germany would have been one of our strongest allies?","foreign-aid-should-we","05:00 PM","government-debates","25"
"02-08-2004","1233",2,"None","None","None","daewoo","34311","I think that until we have solved our own problems at home, giving money to third parties is a misguided act. Americans pay taxes that support our government. Until every American is taken care of, I don't feel our government has the right to give away our tax money. As far as israel goes, people have pointed out earlier in the thread that without our foreign aid, they could simply not survive. To me, this is the argument for discontinuing aid to israel. If a nation cannot survive except ont he generousity of america, thewy should not survive as a nation. Why should we pump billion a year into a country taht cannot survive on its own? If we are going to do that, we may as well make them a 51st state.","foreign-aid-should-we","02:43 PM","government-debates","26"
"02-09-2004","1233",2,"None","None","None","J_ha","34384","Just because a country can not survive in the present does not mean they will not beable to survive in the future. Isreal is a small minority that supports democracy, surrounded by a lunatic violent majority who dispises anythign relating to western political ideology. So obviously you help your friend in need. I on the other hand do not support lending money to kleptocracies like the many in Africa who are at the top of the international monotary fund's lending list (USA contributes 80% to imf). These same counties remain at the top of the poorest-contries-list written by the imf, allowing them to not pay back the money inherently turning lending into giving.","foreign-aid-should-we","02:44 PM","government-debates","27"
"02-09-2004","1233",2,"None","None","None","Broker","34385","We have to stop giving aid and start helping these countries develop. Food and money will only last for awhile, and then nothing is accomplished... they'll just need more food and money.","foreign-aid-should-we","02:50 PM","government-debates","28"
"02-10-2004","1233",2,"J_ha","None","Just because a country can not survive in the present does not mean they will not beable to survive in the future. Isreal is a small minority that supports democracy, surrounded by a lunatic violent majority who dispises anythign relating to western political ideology. So obviously you help your friend in need. I on the other hand do not support lending money to kleptocracies like the many in Africa who are at the top of the international monotary fund's lending list (USA contributes 80% to imf). These same counties remain at the top of the poorest-contries-list written by the imf, allowing them to not pay back the money inherently turning lending into giving.","daewoo","34429","In exactly what world do you think that Israel would be able to survive on its own? Nations that are as contemptful of their neiborghs as Israel is do not survive.","foreign-aid-should-we","01:35 AM","government-debates","29"
