"Date","DiscussionId","PageId","QuoteAuthor","QuoteId","QuoteText","ResponseAuthor","ResponseId","ResponseText","Subtopic","Time","Topic","postCounter"
"12-12-2005","7023",3,"zachvac","None","I don't particularly care what they're called. But what does Christmas have to do with trees anyway? How are Christmas trees part of the religious holliday anyway?","Kronus","184724","When Christianity was being spread through Northern Europe, it was a tough sell, and the conversion by sword method wasn't as effective as some would have hoped. So, instead of outlawing the native's old religions, they were co-opted. The natives were allowed to celebrate around the solstice like they always did, but instead of celebrating the birth of the new year, they were told they were celebrating the birth of Jesus. Symbols of the old religion, like trees, wreaths and mistletoe, were incorporated into the new holiday.","holiday-trees","10:05 AM","government-debates","33"
"12-12-2005","7023",3,"Steeeeve","None","You know Yule is celebrated in Austrialia during June and July and not on December 25. As I recall, I have never seen Christmas celebrated on any day but Dec. 25. This may come as a shock, but this holiday was created by Christians (or actually a Pope). Did Grant say ""I declare Christmas a holiday for which we will celebrate one religion""...probably not. Did the congress say ""I declare Chrisitianity the only religion in the US so lets put 'In God We Trust' on our currency"" probably not. Christmas is and has always been a holiday created for and by Christians...thus CHRIST MASS. It is right there in the name. Yule and Christmas are not the same and to think Christmas was not created by and for religious purposes is insane. You of all people should know since you plagiarise Wikipedia so well.","Eddie","184754","Many european countries/cultures celebrate christmas on the 24:th... In fact, they are. Yule can mean different things depending on the situation, but one of it`s meanings is ""christmas"". Just like santa claus and st: nicholas share the same meaning depending on the situation...","holiday-trees","12:35 PM","government-debates","36"
"12-12-2005","7023",3,"Eddie","None","Many european countries/cultures celebrate christmas on the 24:th... In fact, they are. Yule can mean different things depending on the situation, but one of it`s meanings is ""christmas"". Just like santa claus and st: nicholas share the same meaning depending on the situation...","Steeeeve","184757","ok??? I guess it doesn't matter when you celebrate it as it is still the same thing you are celebrating but do you have a link to this claim. They are not the same thing. We even stated that Yule was here long before Christmas ever was. When the Pope created Christmas he wasn't trying to just replace the word ""Yule"" because it sounded bad. This is easily seen as Yule is celebrated in June and July in Australia and Christmas is celebrated on Dec 25th. Yule might be used in the same meaning as Christmas every now and then but they are clearly two different things in normal use. How is anyone arguing that Christmas is not a holiday founded on religion...this is crazy.","holiday-trees","12:54 PM","government-debates","37"
"12-12-2005","7023",3,"Steeeeve","None","ok??? I guess it doesn't matter when you celebrate it as it is still the same thing you are celebrating but do you have a link to this claim. They are not the same thing. We even stated that Yule was here long before Christmas ever was. When the Pope created Christmas he wasn't trying to just replace the word ""Yule"" because it sounded bad. This is easily seen as Yule is celebrated in June and July in Australia and Christmas is celebrated on Dec 25th. Yule might be used in the same meaning as Christmas every now and then but they are clearly two different things in normal use. How is anyone arguing that Christmas is not a holiday founded on religion...this is crazy.","Eddie","184764","I guess I could dig up a link, but I can assure you that I celebrate christmas on the 24:th (christmas eve). Celebrating christmas on the 25:th (christmas day) is an anglo-saxon tradition as far as I know. Yule was here long before christmas. It was a tradition among various germanic tribe. The actual word ""Yule"" derives from norweigan word ""Jul"", which still is the same holliday as christmas. I`m not arguing that christmas isn`t a holiday founded on religion, but that it is also founded on pagan rituals and traditions. Many aspects of the anglo-saxon christmas comes from the germanic pre-christian traditions of ""Yule"". Like the christmas tree... Which is the topic of this thread","holiday-trees","01:19 PM","government-debates","38"
"12-12-2005","7023",3,"None","None","None","Jo Bennett","184770","I seem to recall that churches in the eastern orthodox tradition celebrate Christmas day on 6th January.","holiday-trees","01:42 PM","government-debates","39"
"12-12-2005","7023",3,"Eddie","None","I guess I could dig up a link, but I can assure you that I celebrate christmas on the 24:th (christmas eve). Celebrating christmas on the 25:th (christmas day) is an anglo-saxon tradition as far as I know. Yule was here long before christmas. It was a tradition among various germanic tribe. The actual word ""Yule"" derives from norweigan word ""Jul"", which still is the same holliday as christmas. I`m not arguing that christmas isn`t a holiday founded on religion, but that it is also founded on pagan rituals and traditions. Many aspects of the anglo-saxon christmas comes from the germanic pre-christian traditions of ""Yule"". Like the christmas tree... Which is the topic of this thread","Steeeeve","184783","Don't bother, I am not sure the day the even is celebrated even matters...the point that what it celebrates is what matters. Can you honestly say that without Christianity we would have a holiday called Christmas? No doubt Christmas takes many traditions from Yule and other various holidays. Yule is still not the same holiday as Christmas though. Christmas has one sole purpose for its creation...to celerbrate the birth of Christ...thus MASS of CHRIST. This is so very clear by just looking at Yule being celebrated as a Winter Solitice in Australia which is in June/July. No Christ = no Christmas. Very simple concept. It was set up as a religious holiday. Very simple concept. As for the Christmas Tree, It has long been called a Christmas tree and there is no indication that the cone-shaped tree was for any other holiday eventhough Yule did use a tree. We can set up a Dogwood tree and call it a holiday tree, how about that..leave the Christmas tree's name alone unless you have a valid reason to change it.","holiday-trees","02:15 PM","government-debates","40"
"12-12-2005","7023",3,"Steeeeve","None","Don't bother, I am not sure the day the even is celebrated even matters...the point that what it celebrates is what matters. Can you honestly say that without Christianity we would have a holiday called Christmas? No doubt Christmas takes many traditions from Yule and other various holidays. Yule is still not the same holiday as Christmas though. N Christmas has one sole purpose for its creation...to celerbrate the birth of Christ...thus MASS of CHRIST. This is so very clear by just looking at Yule being celebrated as a Winter Solitice in Australia which is in June/July. No Christ = no Christmas. Very simple concept. As for the Christmas Tree, It has long been called a Christmas tree and there is no indication that the cone-shaped tree was for any other holiday eventhough Yule did use a tree. We can set up a Dogwood tree and call it a holiday tree, how about that..leave the Christmas tree's name alone unless you have a valid reason to change it.","Eddie","184793","No, it would probably still be called Yule in that case, at least in Brittain and other english speaking countries And that`s where I would say that you are wrong. Sure, ""Yule"" can also refer to some neo-pagan ritual as well as an archaic tradtition among germanic tribes, but it also refers to ""christmas"". Yule=Jul=Christmas Christmas had probably many purposes for it`s creation. Celebrating the mass of christ was probably one of them. By neo-pagans, yes. As is, No [insert various pagan influences]=no christmas, at least not as you know it today I have no intention of changing your name ""christmas tree"" but I don`t see why you would object to other people using other names for it. Our name is still ""Yule/Christmas pine"" (Julgran) though .","holiday-trees","02:44 PM","government-debates","41"
"12-12-2005","7023",3,"Steeeeve","None","Without Christ and the Christian faith how you can have a Christmas. Back when Yule was around they weren't going ""hey, this is Christmas"". Why? Because Christmas wasn't even invented then. No pagan influences = less traditions on christmas taken from that culture. The holiday is all about Christ, thats the whole reason it is here. Yule was a winter solitice celebration and only started meaning christmas when Christmas was formed. Once again, Austrialia celebrates this during June and July, obviously not the same as Christmas. It was the only reason actually. HEre is agood link on the orgins of Christmas http://www.mrrena.com/Christmas.shtml","Eddie","184839","But this is the problem. Once it was about Yule and scaring spirits and darkness away*. As christian influence started to penetrate germanic superstition and old traditions, Yule gradually became more and more about the birth of christ. People tended mass and heard the christmas evangelium (if there is such an evangelium) until the old pre-christian traditions lost their meanings. They became mere rituals without any real meaning, like the christmas tree, candles, fire logs and gnomes. And today, the christian and religious meaning of christmas is gradually being replaced by secular meanings such as comfort, friends and family and presents, at least for many of us. Claiming that christmas is about christs birth is not incorrect. The traditions are clearly there (with the baby jesus and the crib and the sermon). But not everyone celebrate christmas this way. For me and my family and friends, chrsitmas is just as much about scaring the darkness and evil spirits away as it is about the birth of christ. The rituals are there, but none of them mean anything other than what we make of them. * This is from a germanic perspective, as in anglo-saxon, swedish, german etc, etc. The history of christmas where naturally different in Roman and greek cultures. Once again, christmas is the english word for a holiday that is called very differently in various languages. The traditions surrounding christmas also vary from country to country. In the nordic countries, christmas is called Jul (Yule) and our traditions are pretty similiar to that of the anglo-saxons., In Germany it is called ""Weinnachten"" (wine night) and their traditions are pretty similiar to ours as well. In Eastern europe, christmas traditions are very different from yours and ours. In France it is called something about Noel (don`t remeber) and their traditions are different, etc, etc. Yule is not a mainstream tradition in australia. It is celebrated by neo-pagans only. These are fringe groups who choose to celbrate an archaic tradition that is currently recognized as christmas. The fact that this small group of people (how many can they be, 100?) does this not negate the fact that Yule means christmas. Are you saying that a think-piece written by the author of ""The Christian Living and Apologetics Website"" is a good source for the historic origin of christmas? He doesn`t even bring up the year the bishop in Rome declared 24th of december to be the birthdate of christ or how it relates to the celebration of the Roman god Saturn... Or all of it`s connections to various other pagan festivities around the world... I`m sorry, but I don`t consider that link as an authoritive on anything other than Eric Knickerbockers own viewpoint and memories of christmas.","holiday-trees","07:01 PM","government-debates","44"
"12-12-2005","7023",3,"Steeeeve","None","You all seem to be missing the point. No Christian value = no Christmas holiday. If we were a Muslim nation we wouldn't have Christmas. If we had no religion we wouldn't have Christmas (as a national holiday that is). In fact, if you didn't ahve christiantity, guess what, no Christmas. It doesn't get much more religious then that. If you want to claim that Christmas doesn't have much of a religious meaning anymore you can but at the same time you can't complain about ""In God We Trust"" or ""One Nation Under God"" because those are just as embedded in our society as Christmas is. Oh, and yes I know Jesus wasn't born on Dec 25th which is why I said ""remember"" instead of ""born on"". Yes, I also know people work on Christmas, Waffle House is open .","zachvac","184869","But you seem to be missing the point I made. I have no problem with Christianity in general, the problem is when it is put in the government. This includes ""One Nation under God"" as well as ""In God we Trust"". If a business wants to make people work on Christmas, it's their choice. If they want to fire people for taking Christmas off, that's their choice. Most employers give their employees off because they know that they wouldn't come to work anyway and they would lose money staying open on Christmas, but many retail stores don't think that way and make lots of money on Christmas.","holiday-trees","09:19 PM","government-debates","45"
"12-12-2005","7023",4,"Steeeeve","None","HAHA of course they will say that now. It seems odd that Grant decided that a religious holiday would be a good day to just take off...no religious reasoning for it at all im sure :/","doG","184891","Huh? It's not just now that they're saying it, that was the wording of the original legislation. Didn't you read it? The name of HR2224 of the 41st Congress is, ""An Act Making the first day of January, the twenty-fifth day of December, the fourth day of July, and Thanksgiving day, holidays, within the District of Columbia."" This is the name of the act on the day it was passed by the House of Representatives on June 17, 1870 , as passed by the Senate on June 24, 1870 and as signed by Grant. It wasn't Grant that picked the days, it was Representative Burton C. Cook that drafted the original bill as a result of a campaign by local banker and business men of the District to correspond with similar laws of the States around the district. Source: CRS Report For Congress Federal Holidays: Evolution and Application February 8, 1999 http://www.senate.gov/reference/reso...l_Holidays.pdf","holiday-trees","10:17 PM","government-debates","47"
"12-13-2005","7023",4,"doG","None","Huh? It's not just now that they're saying it, that was the wording of the original legislation. Didn't you read it? The name of HR2224 of the 41st Congress is, ""An Act Making the first day of January, the twenty-fifth day of December, the fourth day of July, and Thanksgiving day, holidays, within the District of Columbia."" This is the name of the act on the day it was passed by the House of Representatives on June 17, 1870 , as passed by the Senate on June 24, 1870 and as signed by Grant. It wasn't Grant that picked the days, it was Representative Burton C. Cook that drafted the original bill as a result of a campaign by local banker and business men of the District to correspond with similar laws of the States around the district. Source: CRS Report For Congress Federal Holidays: Evolution and Application February 8, 1999 http://www.senate.gov/reference/reso...l_Holidays.pdf","Steeeeve","184906","And it only applied to the District of Columbia...","holiday-trees","12:47 AM","government-debates","48"
"12-13-2005","7023",4,"Steeeeve","None","And it only applied to the District of Columbia...","doG","184922","Correct. All of the ""Federal Holidays"" only apply to the District. The holidays of the States are set by the States. As you can see from the Uniform Holidays Act of 1870, Congress acted to declare holidays for business coinciding with those of the States surrounding it. Similarly, States have passed their own laws enacting holidays for themselves, likely to match those of the States around them. You should also note that the States were not considered to be inhibited by the 1st Amendment to the US Constitution until after the 14th Amendment was passed.","holiday-trees","07:48 AM","government-debates","49"
"12-13-2005","7023",4,"doG","None","Correct. All of the ""Federal Holidays"" only apply to the District. The holidays of the States are set by the States. As you can see from the Uniform Holidays Act of 1870, Congress acted to declare holidays for business coinciding with those of the States surrounding it. Similarly, States have passed their own laws enacting holidays for themselves, likely to match those of the States around them. You should also note that the States were not considered to be inhibited by the 1st Amendment to the US Constitution until after the 14th Amendment was passed.","Steeeeve","184927","There are federal buildings outside of DC though.... And what is your point...it is a leglistation and not the whole reasoning. I can give you legislation. http://www.law.cornell.edu/uscode/ht...3----000-.html There is the law for you. You haven't addressed my Thanksgiving point either. http://showcase.netins.net/web/creat...hes/thanks.htm","holiday-trees","08:23 AM","government-debates","50"
"12-13-2005","7023",4,"Steeeeve","None","There are federal buildings outside of DC though.... And what is your point...it is a leglistation and not the whole reasoning. You haven't addressed my Thanksgiving point either. http://showcase.netins.net/web/creat...hes/thanks.htm","doG","184932","It doesn't matter where Federal Buildings are located. The declaration of holidays for the District is simply an instrument for declaraing them Federal holidays as opposed to any State holidays. Thanksgiving was initially proclaimed a holiday by Washington for purposes he clearly claimed were religious but there was no 1st Amendment at that point in time. Thanksgiving was later created by the same act that made the 25th of December a holiday but it did so to only make the day a holiday coincidental to the States surrounding the District as solicited of the Congress by the local businessmen and bankers. The wording, terminology and intent of that act was not to create a preference for any religious belief, just a federal holiday that coincided with the holidays of the States. It is important to notice in this context that the States were not inhibited by the Bill of Rights in making there own laws affecting the citizens until the 14th Amendment was passed so the States were free to dclare holidays for any reasons they chose including religious ones. That the Federal Congress wanted to inact legislation on behalf of business for business in coordinating Federal holidays with States holidays does not make the intent to respect a religious establishment, only to coordinate Federal government with State government.","holiday-trees","08:44 AM","government-debates","51"
"12-13-2005","7023",4,"Steeeeve","None","We declared Christmas a national holiday...of course some here believe it was mere coincidence that Dec 25 happened to be Christmas as well. Not only that, but Thanksgiving is going to have to be gotten rid of as well. Lincoln clearly said this is a day for God...","jyoshu","184960","The fact is, if we did what some would like and eradicated every mention of religion and God from govt., we'd lose a great deal of our nation's history. The biggest problem I have with this witch hunt against any religious reference in any govt. sphere is that it's historically revisionist. The idea that the 1st amendment means the very utterance of ""god"" or ""Christ"" the moment one steps across the property line onto govt. land, a classroom, capitol hill, or a prayer in a govt. meeting is pretty new in the history of our country. Our founders were much more tolerant than that. There's no evidence that those who founded this nation would have felt the freedom of religion should be withheld. In fact the very opposite is true: it is apparent that the founding fathers had great respect and tolerance for people of faith and some certainly WERE deeply religious. Would that those who preach liberal ""tolerance"" today follow their example.","holiday-trees","10:50 AM","government-debates","52"
"12-13-2005","7023",4,"doG","None","It doesn't matter where Federal Buildings are located. The declaration of holidays for the District is simply an instrument for declaraing them Federal holidays as opposed to any State holidays. Thanksgiving was initially proclaimed a holiday by Washington for purposes he clearly claimed were religious but there was no 1st Amendment at that point in time. Thanksgiving was later created by the same act that made the 25th of December a holiday but it did so to only make the day a holiday coincidental to the States surrounding the District as solicited of the Congress by the local businessmen and bankers. The wording, terminology and intent of that act was not to create a preference for any religious belief, just a federal holiday that coincided with the holidays of the States. It is important to notice in this context that the States were not inhibited by the Bill of Rights in making there own laws affecting the citizens until the 14th Amendment was passed so the States were free to dclare holidays for any reasons they chose including religious ones. That the Federal Congress wanted to inact legislation on behalf of business for business in coordinating Federal holidays with States holidays does not make the intent to respect a religious establishment, only to coordinate Federal government with State government.","Steeeeve","185064","It seems you didn't even read your own link. They had a whole debate about how the holidays only applied to DC. A president proclaimation is pretty much what does it. Actually, A president can proclaim a holiday. Like what Lincoln did. Lincoln said it was on the last thursday (later changed obviously...by another president no less). It was not created by the legislation you hold so dear. In fact you can read up on President proclaimations here: http://en.wikipedia.org/wiki/Federal...l_Proclamation Either way you look at it, Thanksgiving was done on religious grounds just like Christmas....guess we gotta get rid of them just like ""In God We Trust"".","holiday-trees","07:25 PM","government-debates","53"
"12-13-2005","7023",4,"Steeeeve","None","Either way you look at it, Thanksgiving was done on religious grounds just like Christmas.","doG","185065","I challenge you to prove that. The congressional record states otherwise.","holiday-trees","07:35 PM","government-debates","54"
"12-13-2005","7023",4,"Master_Shake","None","To be honest, I agree with Steeeve here, but probably not for the same reasons. Thanksgiving is a celebration of Puritanism over Native Americans. You simply can't seperate Thanksgiving from the Puritans or from what it represents with regard to Native Americans.","doG","185078","Just because Thanksgiving has religious underpinnings does not mean the Congress could only make the last Thursday of November a holiday for the sake of Thanksgiving. If Congress passed a law making the 5th day of September a holiday do you think that would mean they were specifically doing so just to honor your birthday? Of course you can strike Thanksgiving at the Federal Level if you want, the States are still free to retain the holidays set by their own laws prior to the time that they became inhibited by the 14th Amendment. The effect would simply be another act of congress to coordinate holidays with the States which is not prohibited by the Constitution.","holiday-trees","08:40 PM","government-debates","56"
"12-13-2005","7023",4,"doG","None","Just because Thanksgiving has religious underpinnings does not mean the Congress could only make the last Thursday of November a holiday for the sake of Thanksgiving.","Master_Shake","185084","No, it doesn't mean they could only make the last Thursday of November a holiday for the sake of Thanksgiving, but that's irrelavant because the fact is they did. They didn't just pull a random day out of a hat and say, ""Hey, let's make this a federal holiday for no reason whatsoever!""","holiday-trees","08:57 PM","government-debates","57"
"12-13-2005","7023",4,"doG","None","I challenge you to prove that. The congressional record states otherwise.","Steeeeve","185085","I already did. Your congressional record is for DC only...if you don't realize that then we can't go on, it says it right there in the link you provided. ""The intention is that it shall apply only to the Distric of Columbia"" Said over and over. Not only that, proclaiming a holiday can be done by president (see link in my last post). Morever, look at Lincolns Address and tell me that wasn't religious. Christmas is very obvious...They made a holiday on Christmas day, your argument would be like saying the 4th of July is not really to celebrate our independence. You are just fooling yourself into thinking overwise and I wonder why you couldn't fool yourself with ""In God We Trust""....maybe that had no religous meaning too :-/. yeah right.","holiday-trees","09:18 PM","government-debates","58"
