"Date","DiscussionId","PageId","QuoteAuthor","QuoteId","QuoteText","ResponseAuthor","ResponseId","ResponseText","Subtopic","Time","Topic","postCounter"
"12-08-2005","7023",1,"None","None","None","debategirl88","184178","Did you know that they are now, in some parts of America, calling Christmas trees holiday trees because some are getting offended? Post your thoughts, and I'll comment in a bit.","holiday-trees","10:34 PM","government-debates","1"
"12-08-2005","7023",1,"debategirl88","None","Did you know that they are now, in some parts of America, calling Christmas trees holiday trees because some are getting offended? Post your thoughts, and I'll comment in a bit.","zachvac","184179","I don't particularly care what they're called. But what does Christmas have to do with trees anyway? How are Christmas trees part of the religious holliday anyway? I don't care if they call them Christmas trees, but I also don't care if they want to call them holiday trees. ""A rose by any other name stinks as much"".","holiday-trees","10:36 PM","government-debates","2"
"12-09-2005","7023",1,"None","None","None","coolcodemn3","184214","They are called Chritmas trees becuase they have been for many years. Christmas is not a religious holiday like it used to be. Non Christians celebrate Christmas. Its recognized as a federal holiday so it should not be taken away. The liberals think they are getting back at the right-wing Christians, but they are not. ITs pathetic, its a Christmas tree, dradles are not holiday tops they are dradles, manorahs are not holiday candle holders, they are manorahs. And if the companies are doing it for money to please all people, they are loosing oney becuase the number of people that celebrate Chistmas in this country is 96%. So this Christmas bashing is bad for everyone, Liberals look dumb when they try to support these Christmas hating companies, Christmas celebrators dont get the joy of their holiday.","holiday-trees","01:16 AM","government-debates","3"
"12-09-2005","7023",1,"None","None","None","Matthew S","184234","I don't care what they are called. It seems that only the right wing evangelicals care that christmas trees are called holiday trees. Heck if it p.o.'s an evangelical, I will start calling them X-MAS trees.","holiday-trees","06:37 AM","government-debates","4"
"12-09-2005","7023",1,"None","None","None","emoreno2292","184240","This is ridiculous. It's always been Christmas, hasn't it? I don't understand why everyone's getting so afraid of saying Christmas anymore. But what's also annoying is how Christians have another thing to whine and gripe about. Call it Christmas, call it a holiday tree, do whatever you want, I don't care. Hell, I call the tree my family has had the solstice bush. Any problems there? I hope not.","holiday-trees","07:41 AM","government-debates","5"
"12-09-2005","7023",1,"None","None","None","Eddie","184243","As long as there is no law forbidding the use of the term ""christmas tree"", I don`t see what the fuzz is all about.","holiday-trees","07:53 AM","government-debates","6"
"12-09-2005","7023",1,"None","None","None","Steeeeve","184357","Christmas is not a religious holiday? HAHAHA, if there were no Christian faith then there is no Christmas. CHRIST mas. I guess we should be saying Holidaymas. The people that are offended by ""Christmas Tree"" need to stop being a the Grinch, grow a back bone, and move to France.","holiday-trees","10:43 PM","government-debates","7"
"12-09-2005","7023",1,"Steeeeve","None","Christmas is not a religious holiday? HAHAHA, if there were no Christian faith then there is no Christmas. CHRIST mas. I guess we should be saying Holidaymas. The people that are offended by ""Christmas Tree"" need to stop being a the Grinch, grow a back bone, and move to France.","doG","184358","Please explain why the history of christmas dates back more than 4000 years then...BTW, give ol' Chirac a kiss for us when you get settled over there.","holiday-trees","10:57 PM","government-debates","8"
"12-10-2005","7023",1,"None","None","None","Jo Bennett","184385","The history of Christmas doesn't date back 4000 years. The history of festivals around the time of winter may do, but that's not the same as Christmas. If you want to celebrate Yule or whatever then that's entirely up to you, but it ain't Christmas.","holiday-trees","05:19 AM","government-debates","9"
"12-10-2005","7023",1,"Jo Bennett","None","The history of Christmas doesn't date back 4000 years. The history of festivals around the time of winter may do, but that's not the same as Christmas. If you want to celebrate Yule or whatever then that's entirely up to you, but it ain't Christmas.","Eddie","184391","Hehe... Actually ""Jul"" (Yule) translates ""Christmas"" directly... But I agree that the pagan festival is very different from the christian festival we currently celebrate. On the other hand, I would say that christmas has changed considerably the last few decades as well. In many households around the world, the christian meaning of christmas is simply not a part of their christmas celebrations. I would also like to point out that getting smashed and beat up your wife and kids seems to be a universal christmas tradition, even among devout christians. So I guess the pagan ritual of drinking ""jul"" at the winter solstice is more prelavent than the christian meanings and rituals","holiday-trees","07:05 AM","government-debates","10"
"12-10-2005","7023",1,"Eddie","None","Hehe... Actually ""Jul"" (Yule) translates ""Christmas"" directly... But I agree that the pagan festival is very different from the christian festival we currently celebrate. On the other hand, I would say that christmas has changed considerably the last few decades as well. In many households around the world, the christian meaning of christmas is simply not a part of their christmas celebrations. I would also like to point out that getting smashed and beat up your wife and kids seems to be a universal christmas tradition, even among devout christians. So I guess the pagan ritual of drinking ""jul"" at the winter solstice is more prelavent than the christian meanings and rituals","georged","184408","I also find it interesting that in the US domestic violence reaches peak highs during the holiday season running from thanksgiving through new year. Is that an inherited European tradition or something original?","holiday-trees","09:18 AM","government-debates","11"
"12-10-2005","7023",1,"georged","None","I also find it interesting that in the US domestic violence reaches peak highs during the holiday season running from thanksgiving through new year. Is that an inherited European tradition or something original?","Eddie","184412","Most probably inherited. We experience the same phenomenon over here. I would say increased alcohol consumption is a big culprit. Even though, stress, failed expectations and the fact that people are free from their work to socialize with their families are probably significant factors as well.","holiday-trees","09:30 AM","government-debates","12"
"12-10-2005","7023",1,"None","None","None","Steeeeve","184413","The point remains though. We celebrate a Christian holiday. No Christian Holiday and no Dec 25 off of work. No matter how you slice is, it is putting ""religion"" into government. Of course, people aren't going to say we should just get rid of the holiday 100%, they would rather change it to Holiday Trees in order to still get off of work. We have a word for this....selfish.","holiday-trees","09:32 AM","government-debates","13"
"12-10-2005","7023",1,"Eddie","None","Most probably inherited. We experience the same phenomenon over here. I would say increased alcohol consumption is a big culprit. Even though, stress, failed expectations and the fact that people are free from their work to socialize with their families are probably significant factors as well.","georged","184416","Our local LE say they'd rather face criminals in a gunfight than respond to the uncertainty of domestic disturbance situations. I'd expect the failed expectations play a big part on families hammering on each other and anyone else who gets in the way.","holiday-trees","09:38 AM","government-debates","14"
"12-10-2005","7023",1,"Steeeeve","None","The point remains though. We celebrate a Christian holiday. No Christian Holiday and no Dec 25 off of work. No matter how you slice is, it is putting ""religion"" into government. Of course, people aren't going to say we should just get rid of the holiday 100%, they would rather change it to Holiday Trees in order to still get off of work. We have a word for this....selfish.","Eddie","184417","Reminds me of how the russians reacted to the Soviet Union crumbling in relation to holidays. During the communist era, many religous holidays where removed from the calender in order to further the bolsjevik propaganda. Instead, ideological holidays where introduced (like the birthday of Lenin and what-not). When the wall came tumbling down, the russians where not prepared to let go of their communist-hollidays, while they fought fiercily to get the religous hollidays back into the calender (with the payed days-off naturally, you cannot worship your god unless you get a salary for it). So now, they have two sets of holidays, and twice as many as before. And sure, it is selfish. Just like expecting that the free time you get during christians hollidays should be payed for by your employer. We are all selfish.","holiday-trees","09:38 AM","government-debates","15"
"12-10-2005","7023",2,"Steeeeve","None","The point remains though. We celebrate a Christian holiday. No Christian Holiday and no Dec 25 off of work. No matter how you slice is, it is putting ""religion"" into government. Of course, people aren't going to say we should just get rid of the holiday 100%, they would rather change it to Holiday Trees in order to still get off of work. We have a word for this....selfish.","georged","184418","Especially when that month determines annual success or failure for many retail entities.","holiday-trees","09:39 AM","government-debates","16"
"12-10-2005","7023",2,"None","None","None","GreenMtnBoy","184451","I think it's stupid to call it a holiday tree, as no other holiday at that time of the year celebrates a tree. However, I have no problem with ""Happy Holidays"". Saying ""Merry Christmas"" to people you don't know is making an ASSumption. But it's all freedom of speech, anyone can use whichever they want, and anyone trying to force others to use thier term is nothing more than an authoritarian.","holiday-trees","12:16 PM","government-debates","17"
"12-10-2005","7023",2,"Steeeeve","None","The point remains though. We celebrate a Christian holiday. No Christian Holiday and no Dec 25 off of work. No matter how you slice is, it is putting ""religion"" into government. Of course, people aren't going to say we should just get rid of the holiday 100%, they would rather change it to Holiday Trees in order to still get off of work. We have a word for this....selfish.","doG","184460","No, not we. The holiday that has been celecrated for 1000s of years for the winter solstice, called ""yule"" by some, is not a christian holiday. That christians elected to celebrate their religious holiday at the same time did not change the soltice celebration of others to a religious one.","holiday-trees","01:06 PM","government-debates","18"
"12-10-2005","7023",2,"GreenMtnBoy","None","I think it's stupid to call it a holiday tree, as no other holiday at that time of the year celebrates a tree.","doG","184463","No, but the Norse celebrate the Yule log. I agree on the other point though, it is a Christmas Tree, not a holiday tree. Germany is credited with starting the Christmas tree tradition as we now know it in the 16th century when devout Christians brought decorated trees into their homes during the winter solstice celebration. For those that are interested I recommend the History of Christmas by the History Channel. Maybe such silly quibbling over Christmas vs Holiday would go away if more people learn just a little more about the cultures of others. Christmas is both a secular and a religious holiday depending on the celebrant.","holiday-trees","01:17 PM","government-debates","19"
"12-10-2005","7023",2,"doG","None","No, but the Norse celebrate the Yule log. I agree on the other point though, it is a Christmas Tree, not a holiday tree. Germany is credited with starting the Christmas tree tradition as we now know it in the 16th century when devout Christians brought decorated trees into their homes during the winter solstice celebration. For those that are interested I recommend the History of Christmas by the History Channel. Maybe such silly quibbling over Christmas vs Holiday would go away if more people learn just a little more about the cultures of others. Christmas is both a secular and a religious holiday depending on the celebrant.","jyoshu","184465","But it's called ""Christ Mass"". It may be that others celebrated something else at the same time (Winter solstice for example), but that's not Christmas. ""Christmas"" is a religious holiday; there's no way around it. Others may celebrate other things at the same time, but those things aren't Christmas. ""Christmas"" (or 'Christ mass') is pretty much understood to be celebrating the birth of Christ. In the immortal words of Linus in a Charlie Brown Christmas . . . . ""that's what Christmas is all about, Charlie Brown.""","holiday-trees","01:24 PM","government-debates","20"
"12-10-2005","7023",2,"None","None","None","Ooaman","184467","The chances are high that Jesus wasn't even born in the (Greecko-Roman*) December but more like in September. Christmas itself didn't come around until about 400 A.D. Even then it was in major controversy because many Christians believed that celebrating one's birthday was something that the pagans did. It was finally placed in December simply because that was when the winter solstice was. Okay, now I know that's not what the main point of this is but I thought I'd give a little history. Now I don't know about Christmas in other countries, but in America it has become commercialized. (For example, the concept we have of Santa Claus was based upon a Coke ad. Santa Claus, or actually St. Nick, was a Turkish man back I believe in the 900's A.D. who did some good deeds by tossing coins in the window of some man so he wouldn't have to sell his 3 daughters into slavery and quite possibly prostitution to help pay a debt. I could almost assume that if Christmas were held in August or September, Santa would be wearing a Speedo instead of a red suit.) Now I don't believe that this is a liberal VS concervative thing. This is typical American business not making a good choice and then is confused when people question what they are doing. This happens a lot. *I'm not sure of the proper spelling but I'm sure you know I'm referring to the calender.","holiday-trees","01:28 PM","government-debates","21"
"12-10-2005","7023",2,"jyoshu","None","But it's called ""Christ Mass"". It may be that others celebrated something else at the same time (Winter solstice for example), but that's not Christmas. ""Christmas"" is a religious holiday; there's no way around it. Others may celebrate other things at the same time, but those things aren't Christmas. ""Christmas"" (or 'Christ mass') is pretty much understood to be celebrating the birth of Christ.","doG","184469","Yes, but ""Yule"" and ""Yuletide"" are also archaic terms for Christmas, sometimes invoked in songs to provide atmosphere. Indeed, this is the only meaning of ""Yule"" accepted by either the full Oxford English Dictionary or the Concise Oxford Dictionary, and people unfamiliar with ancient pagan traditions will not distinguish between Yule and Christmas.","holiday-trees","02:04 PM","government-debates","22"
"12-10-2005","7023",2,"Ooaman","None","For example, the concept we have of Santa Claus was based upon a Coke ad.","doG","184470","Um....no. St. Nicholas, a monk born sometime around 280 A.D. in Patara, near Myra in modern-day Turkey and much admired for his piety and kindness, made his first inroads into American popular culture towards the end of the 18th century. In December 1773, and again in 1774, a New York newspaper reported that groups of Dutch families had gathered to honor the anniversary of his death. The name Santa Claus evolved from Nick's Dutch nickname, Sinter Klaas, a shortened form of Sint Nikolaas (Dutch for Saint Nicholas). Coca-cola was not even invented until the late 1800s.","holiday-trees","02:13 PM","government-debates","23"
"12-10-2005","7023",2,"Georged","None","Especially when that month determines annual success or failure for many retail entities.","Steeeeve","184477","It is clearly embedded in our society now but it doesn't take away what the holiday is...a religious one. The fact remains that they only reason you don't work on Dec 25 is because that is the day of remebering the birth of Jesus and the US government decided to declare it a holiday. A good example of mixing religion and government. I still stand that if you want ""In God We Trust"" off of everything then you have to get rid of Christmas too.","holiday-trees","03:22 PM","government-debates","24"
"12-10-2005","7023",2,"Steeeeve","None","It is clearly embedded in our society now but it doesn't take away what the holiday is...a religious one. The fact remains that they only reason you don't work on Dec 25 is because that is the day of remebering the birth of Jesus and the US government decided to declare it a holiday. A good example of mixing religion and government. I still stand that if you want ""In God We Trust"" off of everything then you have to get rid of Christmas too.","doG","184504","No, the holiday is both a religious and a secular holiday, two holidays in one. It is celebrated throughout the world but it is only religious to christians.","holiday-trees","04:32 PM","government-debates","25"
"12-10-2005","7023",2,"doG","None","Um....no. St. Nicholas, a monk born sometime around 280 A.D. in Patara, near Myra in modern-day Turkey and much admired for his piety and kindness, made his first inroads into American popular culture towards the end of the 18th century. In December 1773, and again in 1774, a New York newspaper reported that groups of Dutch families had gathered to honor the anniversary of his death. The name Santa Claus evolved from Nick's Dutch nickname, Sinter Klaas, a shortened form of Sint Nikolaas (Dutch for Saint Nicholas). Coca-cola was not even invented until the late 1800s.","Ooaman","184514","By concept, I meant the image of the old white bearded man in a red suit and black boots and goes around saying Ho-Ho-Ho. You did read the rest of my post didn't you? I went on to say that the true Santa Claus was a Turkish man. Okay, so I was wrong with the decade. What if I were to say that they way we in-vision Santa Claus here in America is based off of an early coke ad. And if not a coke ad, then at least through the poem ""The Night Before Christmas."" Now I don't know what Americans before the late 1800's viewed Santa Claus as looking like, but the view we in America have of him now as that fat man with the red suit and hat on with a white beard came from a mixture of an early coke ad and the poem I mentioned. There is no doubt in my mind that he looked entirely different in real life. If he were born in Turkey, he would have probably had a darker grayer beard for one thing. Okay fine, what is considered modern-day Turkey. But that wasn't my main point. My main point was that in this country, Christmas has become very much commercialized.","holiday-trees","05:59 PM","government-debates","26"
"12-11-2005","7023",2,"Steeeeve","None","It is clearly embedded in our society now but it doesn't take away what the holiday is...a religious one. The fact remains that they only reason you don't work on Dec 25 is because that is the day of remebering the birth of Jesus and the US government decided to declare it a holiday. A good example of mixing religion and government. I still stand that if you want ""In God We Trust"" off of everything then you have to get rid of Christmas too.","zachvac","184639","Other than people who work for the government, it doesn't matter. Employers can give their employees Christmas off, or not. Stores are still open on Christmas, right? I'm flying on an airplane this Christmas, the airports are open. Many people don't get it off. Christmas is NOT the birth of Jesus, as mentioned earlier. And in terms of the reason? I would say it's more because most people celebrate Christmas. If the government didn't have it as a holliday, they would have to spend money to stay open, but not have as many workers. Most people get New Year's Day off too. They can give some days off, so if they didn't give Christmas off most likely they would pick another day.","holiday-trees","09:30 PM","government-debates","27"
"12-11-2005","7023",2,"zachvac","None","Other than people who work for the government, it doesn't matter. Employers can give their employees Christmas off, or not. Stores are still open on Christmas, right? I'm flying on an airplane this Christmas, the airports are open. Many people don't get it off. Christmas is NOT the birth of Jesus, as mentioned earlier. And in terms of the reason? I would say it's more because most people celebrate Christmas. If the government didn't have it as a holliday, they would have to spend money to stay open, but not have as many workers. Most people get New Year's Day off too. They can give some days off, so if they didn't give Christmas off most likely they would pick another day.","Steeeeve","184663","You all seem to be missing the point. No Christian value = no Christmas holiday. If we were a Muslim nation we wouldn't have Christmas. If we had no religion we wouldn't have Christmas (as a national holiday that is). In fact, if you didn't ahve christiantity, guess what, no Christmas. It doesn't get much more religious then that. If you want to claim that Christmas doesn't have much of a religious meaning anymore you can but at the same time you can't complain about ""In God We Trust"" or ""One Nation Under God"" because those are just as embedded in our society as Christmas is. Oh, and yes I know Jesus wasn't born on Dec 25th which is why I said ""remember"" instead of ""born on"". Yes, I also know people work on Christmas, Waffle House is open .","holiday-trees","11:40 PM","government-debates","28"
"12-11-2005","7023",2,"doG","None","No, the holiday is both a religious and a secular holiday, two holidays in one. It is celebrated throughout the world but it is only religious to christians.","Steeeeve","184664","It isn't celebrated in throughout the world. You think Iran has Christmas as a national holiday? No. China? Only the Christians in China...otherwise they tend to celebrate the Chinese New Year. Just face it, without religion there would be no Christmas.","holiday-trees","11:46 PM","government-debates","29"
"12-12-2005","7023",2,"Steeeeve","None","It isn't celebrated in throughout the world. You think Iran has Christmas as a national holiday? No. China? Only the Christians in China...otherwise they tend to celebrate the Chinese New Year. Just face it, without religion there would be no Christmas.","doG","184667","Who cares if Iran celebrates anything on that day or China either, even though they do celebrate the Death of Tsongkapa in Tibet on that day. The winter solstice celebration, ""Yule"", dates back more than 4000 years, long before the birth of any alleged jesus. FWIW, President Grant declared Christmas a holiday as a gesture of good will toward men at the same time that he declared New Year's a holiday.","holiday-trees","12:28 AM","government-debates","30"
"12-12-2005","7023",3,"doG","None","The winter solstice celebration, ""Yule"", dates back more than 4000 years, long before the birth of any alleged jesus.","jyoshu","184711","But that's not Christmas. The only people who truly celebrate Christmas, ""Christ Mass"", are people celebrating the birth of Christ . That's what Steeeve is saying, and I agree with him. Others may indeed celebrate Yule, Winter Solstice, Hannakah, whatever. But those aren't Christmas, anymore than celebrating Christmas means celebrating winter solstice. I've never celebrated winter solstice--it's always been Christmas. Remember, the trees that this thread is about are not called ""Solstice Trees."" They are almost always called Christmas trees.","holiday-trees","09:19 AM","government-debates","31"
"12-12-2005","7023",3,"doG","None","Who cares if Iran celebrates anything on that day or China either, even though they do celebrate the Death of Tsongkapa in Tibet on that day. The winter solstice celebration, ""Yule"", dates back more than 4000 years, long before the birth of any alleged jesus. FWIW, President Grant declared Christmas a holiday as a gesture of good will toward men at the same time that he declared New Year's a holiday. It is celebrated throughout the world but it is only religious to christians.","Steeeeve","184716","Ok, but Christmas is the holiday that was declared...not Yule. And who cares that it isn't celebrated in Iran or China? Well you for one. Do you forget this comment... I am still unsure why people are bringing up Yule..we don't celebrate that here. They do it Australia so maybe you should move there (although its in a different month).","holiday-trees","09:30 AM","government-debates","32"
