"Date","DiscussionId","PageId","QuoteAuthor","QuoteId","QuoteText","ResponseAuthor","ResponseId","ResponseText","Subtopic","Time","Topic","postCounter"
"09-11-2010","14586",5,"None","None","None","gansao","412122","David Attenborough Naturalist and broadcaster...We are living in the most exciting intellectual time in history. In my lifetime we have discovered such profundities, such huge principles. When I was an undergraduate, I went to the professor of geology and said, ""Would you talk to us about the way that continents are drifting?"" And he said, ""The moment we can demonstrate that continents are moving by a millimetre, I will consider it, but until then it's sheer moonshine, dear boy."" And within five years of me leaving Cambridge, it was confirmed, and all the problems disappeared why Australian animals were different that one thing changed our understanding and made sense of everything. Some moonshine!","there-point-evolution","02:53 PM","creation-intelligent-design-vs-evolution","70"
"09-11-2010","14586",5,"gansao","412121","Its there if you look...once again you think I didnt answer because my answer was not the one you wanted","Freedom","412124","No you set up the criteria in which you would respect views, you did not answer my question which did not ask what the criteria was but if you were literally referencing views/beliefs.","there-point-evolution","03:04 PM","creation-intelligent-design-vs-evolution","71"
"09-11-2010","14586",5,"Freedom","412124","No you set up the criteria in which you would respect views, you did not answer my question which did not ask what the criteria was but if you were literally referencing views/beliefs.","gansao","412130","The criteria was enough to answer the question.","there-point-evolution","03:20 PM","creation-intelligent-design-vs-evolution","72"
"09-11-2010","14586",5,"gansao","412130","The criteria was enough to answer the question.","Freedom","412131","I don't see how. Perhaps you could elaborate on the implication your criteria has on my question?","there-point-evolution","03:22 PM","creation-intelligent-design-vs-evolution","73"
"09-11-2010","14586",5,"None","None","None","gansao","412134","Read the first line of post 61","there-point-evolution","03:25 PM","creation-intelligent-design-vs-evolution","74"
"09-11-2010","14586",5,"gansao","412134","Read the first line of post 61","Freedom","412135","""I respect other peoples views unless the view is to disrespect other peoples views."" Yes and?","there-point-evolution","03:26 PM","creation-intelligent-design-vs-evolution","75"
"09-11-2010","14586",6,"Freedom","412135","""I respect other peoples views unless the view is to disrespect other peoples views."" Yes and?","gansao","412138","Thats enough...I dont need to specify anything. Thats what I have been saying...if the answer is not to your liking it must be incorrect...not that the poster does not want to answer to your liking...","there-point-evolution","03:30 PM","creation-intelligent-design-vs-evolution","76"
"09-11-2010","14586",6,"None","None","None","gansao","412143","How? You want me to explain the process of me respecting others views? I expect that if I said I love my fellow man you would ask if that includes ..lets say..black people. Then if I repeated that I love my fellow man you would complain that I have not answered your question. The answer is there in full in the first line of post 61 All you need is the wit to apply it","there-point-evolution","03:52 PM","creation-intelligent-design-vs-evolution","78"
"09-11-2010","14586",6,"gansao","412143","How? You want me to explain the process of me respecting others views? I expect that if I said I love my fellow man you would ask if that includes ..lets say..black people. Then if I repeated that I love my fellow man you would complain that I have not answered your question. The answer is there in full in the first line of post 61 All you need is the wit to apply it","Freedom","412150","The answer is not there in full in the first line of post 61. I want you to explain how it is possible to respect what you do not believe is true. So far all you have basically said (and this is implicit and not even explicit) is that you do respect things you do not believe in, so long as it is not something that says not to respect something others believe in. That is not an answer, by that I do not mean it is not an answer I like or approve of; I mean it is not an answer as it still leaves the question, i.e. it does not provide the information requested.","there-point-evolution","05:39 PM","creation-intelligent-design-vs-evolution","79"
"09-11-2010","14586",6,"Freedom","412150","The answer is not there in full in the first line of post 61. I want you to explain how it is possible to respect what you do not believe is true. So far all you have basically said (and this is implicit and not even explicit) is that you do respect things you do not believe in, so long as it is not something that says not to respect something others believe in. That is not an answer, by that I do not mean it is not an answer I like or approve of; I mean it is not an answer as it still leaves the question, i.e. it does not provide the information requested.","gansao","412152","Yes it does..except for' how '.","there-point-evolution","05:44 PM","creation-intelligent-design-vs-evolution","80"
"09-11-2010","14586",6,"Freedom","412115","Some would say that about evolution since the publication of origin of species.","Accipiter","412155","Yes that is correct, modern evolutionary biology has not progressed at all since Darwin.","there-point-evolution","06:07 PM","creation-intelligent-design-vs-evolution","81"
"09-11-2010","14586",6,"gansao","412152","Yes it does..except for' how '.","Freedom","412160","Do you mean you respect the right of a person to have their own judgement? Is a yes or no question, one may try to have a more poetic answer but it should be possible to simplify it to yes or no. Is it yes or no?","there-point-evolution","08:33 PM","creation-intelligent-design-vs-evolution","82"
"09-11-2010","14586",6,"None","None","None","gansao","412163","I respect other peoples views unless the view is to disrespect other peoples views. If a person judges that it is correct to disrespect other peoples views I cannot respect that view","there-point-evolution","08:44 PM","creation-intelligent-design-vs-evolution","83"
"09-11-2010","14586",6,"None","None","None","Freedom","412175","Answer the question, I assure you I am able to match my stubbornness to yours. You have not answered my question and I will hear no more of it until you admit that to yourself and give me a boolean answer to a boolean question.","there-point-evolution","11:08 PM","creation-intelligent-design-vs-evolution","84"
"09-12-2010","14586",6,"Freedom","412175","Answer the question, I assure you I am able to match my stubbornness to yours. You have not answered my question and I will hear no more of it until you admit that to yourself and give me a boolean answer to a boolean question.","gansao","412184","The question has been answered. The stubbornness is all yours.","there-point-evolution","05:16 AM","creation-intelligent-design-vs-evolution","85"
"09-12-2010","14586",6,"gansao","412184","The question has been answered. The stubbornness is all yours.","Freedom","412198","Is the answer yes or no?","there-point-evolution","12:25 PM","creation-intelligent-design-vs-evolution","86"
"09-12-2010","14586",6,"Freedom","412198","Is the answer yes or no?","gansao","412199","Neither yes nor no. The answer is exactly what I gave you. Will you stop being obtuse?..answer yes or no","there-point-evolution","12:32 PM","creation-intelligent-design-vs-evolution","87"
"09-12-2010","14586",6,"gansao","412199","Neither yes nor no. The answer is exactly what I gave you. Will you stop being obtuse?..answer yes or no","Freedom","412202","Precisely the point I have been making! If the answer is neither yes nor no, to a yes or no question it is not an answer. I do not require that you answer any questions nor make any claims about you if you do not. What makes me upset here is that you claimed you did. You could explain why the question is not a valid one, or why it is partly right and partly wrong but you must admit it was a yes no question. Do or do not, there are no other alternatives. If you are implying that other peoples views = the right of a person to have their own judgement that was almost exactly the question!","there-point-evolution","12:39 PM","creation-intelligent-design-vs-evolution","88"
"09-12-2010","14586",6,"Freedom","412202","Precisely the point I have been making! If the answer is neither yes nor no, to a yes or no question it is not an answer. I do not require that you answer any questions nor make any claims about you if you do not. What makes me upset here is that you claimed you did. You could explain why the question is not a valid one, or why it is partly right and partly wrong but you must admit it was a yes no question. Do or do not, there are no other alternatives. If you are implying that other peoples views = the right of a person to have their own judgement that was almost exactly the question!","gansao","412203","You claimed the answer needed to be yes or no ..it didnt No wonder you are upset Almost but not quite..both your claim to what I was implying and the equation that you just created","there-point-evolution","12:49 PM","creation-intelligent-design-vs-evolution","89"
"09-12-2010","14586",6,"gansao","412203","You claimed the answer needed to be yes or no ..it didnt","Freedom","412206","Is their an alternative to do or do not?","there-point-evolution","01:54 PM","creation-intelligent-design-vs-evolution","90"
"09-12-2010","14586",7,"Freedom","412206","Is their an alternative to do or do not?","gansao","412207","To certain questions..I supplied one and you unwittingly supplied another","there-point-evolution","01:57 PM","creation-intelligent-design-vs-evolution","91"
"09-12-2010","14586",7,"Freedom","412206","Is their an alternative to do or do not?","Ripskar","412212","Mmmm Try you can... [/Yoda]","there-point-evolution","03:00 PM","creation-intelligent-design-vs-evolution","92"
"09-12-2010","14586",7,"None","None","None","MrWriteLA","412222","""I cannot - yet I must. How do you calculate that? At what point on the graph do 'must' and 'cannot' meet? Yet I must - but I cannot!"" -- Ro-Man in Robot Monster (1953) (In case you can't tell from the photo, this has officially been voted one of the Worst Movies Ever Made. As such, I highly recommend it... or the MST3K version of it.)","there-point-evolution","04:57 PM","creation-intelligent-design-vs-evolution","93"
"09-12-2010","14586",7,"gansao","412207","To certain questions..I supplied one and you unwittingly supplied another","Freedom","412232","Name it then. I am pretty sure at this point you are just amusing yourself by refusing to communicate reasonably and that you have no alternative, that you think it is a yes or no question and that you are simply wasting time as some kind of sick play with the freedom game. You have answered every question with a foggy near mystic answer even ones where that could not possibly be sublime.","there-point-evolution","08:08 PM","creation-intelligent-design-vs-evolution","94"
"09-13-2010","14586",7,"fartingle","412010","It is an absolute rule. The situation it is used in is what changes. No, when Jesus said it was a parable, then it was a parable. What errors are you talking about? We have the death penalty in America which is for killing 2+ people. This man had killed thousands and was on the run from justice. ""Cold blood"" is not just about whether or not a person is attacking you. More like attacking. People back then were not the non-violent protest type. Having an heir was one of the most important things in life for them. It was the law that the next brother must help produce an heir for a dead brother. You say it was condoned but the son was killed. She blackmailed Judah because he had lied to her. Instances like this, the descendants always become a thorn in the side of Israel. Breaking the law always has consequences. When those gods cause you to sacrifice children and the prophets bleed themselves as worship, and it is a viral pagan religion that immediately infects Israel unless the evil is destroyed. You think those who get the death penalty are never the family of anybody? If someone is evil, it does not matter who they are. It still never says ""borrow"", and they were very much willing to give it to the Isrealites to get them out of Egypt. Yes I meant Abraham. Also the 10 commandments were given long after Abraham. Actually he was. They did not have elaborate ceremonies back then. Do not most people get the day off work on Sundays? There are absolute morals and laws that lead to the absolute standard: perfection. They were created in the knowledge that no man can ever be perfect. That is why we need God to save us, and why we cannot save ourselves. It is not a ""that guy broke a commandment so they must not be absolute"" kind of thing.","unkerpaulie","412239","Perfect, no argument here. You've just justified every instance of God's people breaking his absolute laws. like I said, NOTHING about the absolute laws in the bible are absolute. They are all broken at will, and anytime you want to break them, and you have a justification you're personally happy with, then its ok to break them.","there-point-evolution","05:33 AM","creation-intelligent-design-vs-evolution","95"
"09-13-2010","14586",7,"Freedom","412232","Name it then. I am pretty sure at this point you are just amusing yourself by refusing to communicate reasonably and that you have no alternative, that you think it is a yes or no question and that you are simply wasting time as some kind of sick play with the freedom game. You have answered every question with a foggy near mystic answer even ones where that could not possibly be sublime.","gansao","412262","You supplied the question ..it is the one that I have been trying to reply to. You are wasting your own time by trying to get an answer which although would be to you liking, would be innaccurate. I am just helping you do it.","there-point-evolution","02:42 PM","creation-intelligent-design-vs-evolution","96"
"09-13-2010","14586",7,"Freedom","412079","I do not wish to argue Catholicism vs protestantism","fartingle","412274","Why did you post so many fallible arguements then? I will not continue if you truly refuse.","there-point-evolution","03:52 PM","creation-intelligent-design-vs-evolution","97"
"09-13-2010","14586",7,"unkerpaulie","412239","Perfect, no argument here. You've just justified every instance of God's people breaking his absolute laws. like I said, NOTHING about the absolute laws in the bible are absolute. They are all broken at will, and anytime you want to break them, and you have a justification you're personally happy with, then its ok to break them.","fartingle","412275","Not at all. It only goes against what you have decided it means. They are absolute. Those who break them are punished. Justice must happen for mercy to exist.","there-point-evolution","04:04 PM","creation-intelligent-design-vs-evolution","98"
"09-16-2010","14586",7,"None","None","None","Bennedict","412568","i was moving, so im a late comer but ill give my two cents anyways. we dont think of evolution or any science as something with a goal. there is no point to evolution or any other science other than telling the truth and furthering our understanding of the world. evolutionary biologists are not in the business of making people feel good about themselves, theyre in the business of finding answers to questions - all scientists are. to me, i feel much much better about being a part of this magnificient universe than i would if i were to believe that there is something beyond it. this is the only life i have, its a wonderful life and im going to take full advantage of what i have now instead of waiting for a skewed utopian afterlife that may or may not happen. to me, evolution, science, atheism are infinitely more uplifting than religious belief. in your original post, fart, you are confusing atheism with evolution. although one compliments the other, there are theistic evolution believers. most British bishops believe in evolution, one of my favorite lecturers on the internet is Ken Miller, a theistic evolutionary biology professor at Brown University. evolution and atheism do not come as a package, and evolution has nothing to do with believing or not believing in spirituality. why waste our keystrokes discussing evolution or learning about evolution? because we have the amazing ability to understand these things. why waste our knowledge not learning about the world we live in?","there-point-evolution","01:07 PM","creation-intelligent-design-vs-evolution","100"
"09-16-2010","14586",7,"Freedom","412293","In other words (and this is how I take it) you are not going to answer the question.","gansao","412569","I answered it..you dont need other words","there-point-evolution","01:13 PM","creation-intelligent-design-vs-evolution","101"
"09-16-2010","14586",7,"Bennedict","412568","In your original post, fart... Ken Miller, a theistic evolutionary biology professor at Brown University...","MrWriteLA","412575","Love it. Wow! I mean, sincerely!","there-point-evolution","02:32 PM","creation-intelligent-design-vs-evolution","102"
