"Date","DiscussionId","PageId","QuoteAuthor","QuoteId","QuoteText","ResponseAuthor","ResponseId","ResponseText","Subtopic","Time","Topic","postCounter"
"09-01-2010","14586",1,"None","None","None","fartingle","411272","Why take you time to argue people into the church of Evolution if it teaches that there is nothing more than the material. Their belief is that death is the end. If that is end for everyone regardless of religion then why waste your breath (or key-strokes as is the case here)?","there-point-evolution","03:55 PM","creation-intelligent-design-vs-evolution","1"
"09-03-2010","14586",1,"None","None","None","fartingle","411450","By the lack of responses I assume there is none. But heck, it is fun!","there-point-evolution","03:56 PM","creation-intelligent-design-vs-evolution","2"
"09-03-2010","14586",1,"None","None","None","Iuris","411455","The same point as gravity: it doesn't need one. Evolution happens, and provides its own purpose. Things that are better at surviving survive, and that's it, at the core. It is an observable natural phenomenon in the present. Traces in the material world also indicate that it has been going on for quite a while. As for why bother with it, mostly, because it's useful. Understanding the world around us gives us the ability to control it or adapt to it better, and that understanding also applies to the past history of the world and its inhabitants and to the processes and where they might lead in the future. Lastly, why bother if death is the end? Well, for one thing, there's this thing called life before it, and it sure matters. For another, one may recognize that even if they themselves die, they may leave a legacy, the same way that we have inherited, or rather, ARE, the legacy of our ancestors. As for religion, religions are applying restrictions on us. Whether it be a global thing like disallowing certain research and medical procedures I could benefit from or local, like my petty gripe with every village in the area deciding they just HAVE to buy a new set of church bells, out of sheer prestige, and me personally knowing that I HAD to contribute money to our own new set of bells or be ostracized - money that could well have, at the time, been spent on things like finally finishing the canalization that had been waiting for further funds.","there-point-evolution","04:15 PM","creation-intelligent-design-vs-evolution","3"
"09-03-2010","14586",1,"None","None","None","fartingle","411456","You can keep telling yourself that as long as you like.","there-point-evolution","04:24 PM","creation-intelligent-design-vs-evolution","4"
"09-03-2010","14586",1,"None","None","None","Iuris","411457","Well, you did ask, so I told you...","there-point-evolution","04:30 PM","creation-intelligent-design-vs-evolution","5"
"09-03-2010","14586",1,"None","None","None","unkerpaulie","411485","Luris pretty much covered it already. Evolution is a theory that attempts to explain how a certain observed phenomenon works. Just like any other theory. If an explanation that better explains what is observed comes up, the theory is revised. And evolution doesn't teach anything about what happens after you die. In fact, there aren't even theories of what happens after you die, because there is no observed phenomenon. There is only creative speculation.","there-point-evolution","07:42 PM","creation-intelligent-design-vs-evolution","6"
"09-04-2010","14586",1,"None","None","None","fartingle","411529","I posted this on Iuris' page, but I will have it out here for the rest of you. No, there is no point in arguing it with anybody. His whole point was about how life would be better. Medical science is not held back by a few Jehovah's Witnesses refusing blood transfusion. If all people believed evolution then obvious problems would arise. The ""eat, drink, and be merry for tomorrow we die"" attitude would be rampant. There would be absolutely no point in helping your fellow man because this life (wich you have wasted far too much of arguing for evolution) is all that there is and you must make the most of it. There would be no sense of morals left in life because, heck, everything is relative right? Say that after someone steals your wallet.","there-point-evolution","03:21 PM","creation-intelligent-design-vs-evolution","9"
"09-04-2010","14586",1,"fartingle","411529","If all people believed evolution then obvious problems would arise. The ""eat, drink, and be merry for tomorrow we die"" attitude would be rampant. There would be absolutely no point in helping your fellow man because this life (wich you have wasted far too much of arguing for evolution) is all that there is and you must make the most of it. There would be no sense of morals left in life because, heck, everything is relative right? Say that after someone steals your wallet.","Accipiter","411533","The fact of the matter is you don't know what would happen. You idiotic religious people think that since you have faith in god that you automatically understand everything and you clearly do not understand anything. Your a joke.","there-point-evolution","04:04 PM","creation-intelligent-design-vs-evolution","10"
"09-04-2010","14586",1,"fartingle","411536","And yet you can already see it anywhere you go. All you must do is imagine it intensified. Again... Ad hominem attacks are not arguements, in fact they show that you have come to an end of reasoning and must resort to insults.","Accipiter","411538","What I see everywhere I go is the result of religion. You people have had 4,000 years to get it right but we continuous to have poverty, war, strife, inequality at a rampant level, why is that? Why doesn't your way work? Do people just not listen to your message and do what you want them to do, is that the problem?","there-point-evolution","04:37 PM","creation-intelligent-design-vs-evolution","12"
"09-04-2010","14586",1,"fartingle","411536","And yet you can already see it anywhere you go. All you must do is imagine it intensified.","birdan","411539","Actually, I look at real statistics and I see nothing of the sort. I compare crime statistics of Japan vs. the U.S., and I see AT LEAST a five-fold difference in violent crimes and property crimes. I look at statistics and I see a marked difference in teenage pregnancies, STDs, etc. Japan has much less crime, much less teenage pregnancies and STDs, a smaller mortality rate and a higher life expectancy. I also noticed that Japan has over a 90% acceptance of evolution and is less than 5% Christian. Nope, I don't ""see it anywhere you go"", what I see is a typical creationist strawman depicting evolutionary biology as some sort of moral code rather than what it actually is: an explanation for some biological mechanisms in nature.","there-point-evolution","04:53 PM","creation-intelligent-design-vs-evolution","13"
"09-04-2010","14586",1,"fartingle","411529","I posted this on Iuris' page, but I will have it out here for the rest of you. No, there is no point in arguing it with anybody. His whole point was about how life would be better. Medical science is not held back by a few Jehovah's Witnesses refusing blood transfusion. If all people believed evolution then obvious problems would arise. The ""eat, drink, and be merry for tomorrow we die"" attitude would be rampant. There would be absolutely no point in helping your fellow man because this life (wich you have wasted far too much of arguing for evolution) is all that there is and you must make the most of it. There would be no sense of morals left in life because, heck, everything is relative right? Say that after someone steals your wallet.","unkerpaulie","411545","You seem to be equating evolution to atheism for some reason. The truth is that there are christians who believe in God and afterlife, and acknowledge evolution as fact. Besides that, you may not believe this, but in many ways theists, with all their morals, display more disregard for their fellow humans than atheists. Religious followers have a history of violence and oppressive dogma that they put into practice whenever they get the opportunity. There are probably more wars initiated by religious dogma than secular reasons. Plus, because religious followers are programmed to believe that death is their ticket to an existence much better than their life on earth, they are willing to die in sacrifice for their religious cause, getting to go to heaven, and leaving a legacy of martyrdom for their follow religious followers. But we are talking about evolution, not atheism, aren't we?","there-point-evolution","07:03 PM","creation-intelligent-design-vs-evolution","14"
"09-05-2010","14586",1,"fartingle","411272","Why take you time to argue people into the church of Evolution if it teaches that there is nothing more than the material. Their belief is that death is the end. If that is end for everyone regardless of religion then why waste your breath (or key-strokes as is the case here)?","Larni","411583","I think there is something important going on, here. I could be wrong so bear with me. It appears to me that you are suggesting that for the non theist ToE fulfils the same conceptual space as religion does for the religious. I subscribe to ToE in the same way I subscribe to Germ Theory or Thermodynamics. It has no bearing on how I approach life or people, but nor does the fact I also subscribe to the Fundamental Attribution Error being real. Further down you post something along the lines that by subscribing to ToE as a theory for allele change over time that one has to throw out morality. I subscribe to ToE and to be fair, I think I'm a pretty decent person. I'm a therapist and I'v spent the last 6 years helping other people through traumatic times in their life. All that and still subscribing to ToE. This alone voids your point, I hope you can see. As you can see by some of the other posts there is no point to ToE any more than there is a point to Boyle's Law. ToE is not a reason or cause for organisms evolving it is a description of natural history; very much like Boyle's Law describes volume and pressure of gases. Basically when organisms change over myriad generations ToE tells us how. It does not pertain to origins or morality or religion: it describes a phenomena as best as we can at this point in time. And yes, it is subject to change because scientist acknowledge that we could be wrong. Best wishes, Larni.","there-point-evolution","11:11 AM","creation-intelligent-design-vs-evolution","15"
"09-06-2010","14586",2,"fartingle","411272","Why take you time to argue people into the church of Evolution if it teaches that there is nothing more than the material. Their belief is that death is the end. If that is end for everyone regardless of religion then why waste your breath (or key-strokes as is the case here)?","pandion","411643","Where on earth did you find the idea that evolution is a church? What an bizarre and ignorant idea. Further, the study of biological evolution doesn't attempt to teach that there is nothing more than the material. You, apparently, haven't bothered to learn the difference between philosophical materialism and methodological materialism. Philosophical materialism is a philosophic view of the world. Methodological materialism is a method of investigation that proposed natural explanations for natural events. To whom are you referring? Certainly not scientists. There are many theistic scientists who believe in an afterlife. Moreover, such concepts have no application in science, at least until the day that you can offer some non-supernatural evidence for such afterlife.","there-point-evolution","01:44 AM","creation-intelligent-design-vs-evolution","16"
"09-06-2010","14586",2,"None","None","None","fartingle","411691","First point (beacause it is getting a little annoying), not all religions should be thrown into a group (it is important in this argument of morality) and not all people who say they have religion do have it. Second, people who say they believe in evolution and God are liars about one of the two. To believe in the Bible and evolution in to go against yourself. Third, I did not say that ALL people are evil just because they do not have religion (though technically I believe that all people, myself included, are depraved and vile which is why we need a Savior), and alot of people who ""have religion"" are evil. What I am saying is that there would start to be an attitude of ""every man for himself"". To go deeper, this would soon result in majority induced ""equality"" a.k.a. Communism, Socialism, and in some places Fascism. These have always come after a country adopts ""reason"" as their only belief. We can see that these never work out well for most people.","there-point-evolution","04:51 PM","creation-intelligent-design-vs-evolution","17"
"09-06-2010","14586",2,"fartingle","411691","What I am saying is that there would start to be an attitude of ""every man for himself"".","Larni","411698","Please provide evidence to support your assertion.","there-point-evolution","05:16 PM","creation-intelligent-design-vs-evolution","18"
"09-06-2010","14586",2,"Larni","411698","Please provide evidence to support your assertion. Well, for one thing, there's this thing called life before it, and it sure matters. For another, one may recognize that even if they themselves die, they may leave a legacy, the same way that we have inherited, or rather, ARE, the legacy of our ancestors.","fartingle","411701","here is Iuris' answer But concrete evidence can only come from it happening. What I am saying is that people would ""realize"" that this is the only time they have so they must make the best of it.","there-point-evolution","05:20 PM","creation-intelligent-design-vs-evolution","19"
"09-06-2010","14586",2,"fartingle","411701","What I am saying is that people would ""realize"" that this is the only time they have so they must make the best of it.","Larni","411703","I don't see how this is evidence to substantiate your point that that without religion it would be 'every man for himself'. I'm in no way religious and yet I care deeply for my family, friends and indeed fellow man. All that with out a religious motivation in sight. Also, if one does act in a 'moral' way for religious reasons rather than humanitarian reasons, what does that say about ones humanity?","there-point-evolution","05:29 PM","creation-intelligent-design-vs-evolution","20"
"09-06-2010","14586",2,"None","None","None","unkerpaulie","411706","Fartingdale, if you stop and think about it, theistic morality is no different from atheistic morality. The underlying roots are the same, even though it may seem that the motivation is different on the surface. From an evolutionary perspective, man is a social animal that seeks survival and reproduction just like any other animal. However, we have highly complex social orders. It is in the best interest of humans to be ""kind"" and ""love your neighboors"" because it cultivates a safe and comfortable social environment. However, there are individuals that would think to seek their own interest at the detriment of the group. You might call them sins, but really they are actions that cause legitimate threats to social order and harmony. So laws are put in place. In religion, violating these laws could send you to hell, so people are convicted by self-induced guilt or by their local peers, and possibly ostracized from their church group. Its a damn good system, though not perfect, it saves a lot of overhead. In the secular arena, violators also face public rejection and go through the self-induced guilt of knowing they've done something wrong. However the consequences are faced while you are alive, for serious offences, rather than after you die. Like I said, on the surface, the motivation seem different. Rather than doing what is socially beneficial because you fear unimaginable eternal suffering in hell, the non-religious do what is right because they appreciate the natural benefits of a peacful and orderly living environment. Fartingdale, you are saying that somehow religious morality is above that of atheistic morality because the threat of hell (which is the only difference) makes your system better. In fact, you seem to think that if people are not programmed to believe in a supernatural judgement hanging over their heads in the afterlife, they are incapable of self-directed moral action. The reality is, believing that you are doing what is right in the hope of getting a grand reward for yourself eventually does not in any form make you morality superior to the person that does what is right because the welfare of himself and his social community depends on it.","there-point-evolution","06:48 PM","creation-intelligent-design-vs-evolution","21"
"09-06-2010","14586",2,"fartingle","411691","First point (beacause it is getting a little annoying), not all religions should be thrown into a group (it is important in this argument of morality) and not all people who say they have religion do have it. Second, people who say they believe in evolution and God are liars about one of the two. To believe in the Bible and evolution in to go against yourself.","trebor","411720","My , aren't you pretentious to know the sincerity and validity of other people's beliefs if they believe differently than you. How prideful is that! You should take a little chill pill there, cause you might be shocked at the end of life.","there-point-evolution","11:46 PM","creation-intelligent-design-vs-evolution","22"
"09-07-2010","14586",2,"Freedom","411723","They are fundamentally different, theistic morality is absolute. atheistic morality (as you mean it) is not absolute, it has exceptions because as long as morality is a means to an end it is only valid so long as a person believes a specific case will lead to that end. If Joe thinks that his creator and ruler of heaven and earth commands him not to kill bob, there is no circumstance nor case nor argument he could make to himself to defy that. If Joe thinks that the general gene frequencies of his species typically benefit from cooperation he will not kill bob so long as he doesn't convince himself bob is no longer beneficial to the race provided he even cares about the race. and those who truly believe this will act as animals. You say they will not and point to the fact that they do not but I say that is only because we yet have laws that recognize no exception except the slow process of democratic change.","unkerpaulie","411730","Thank you for illustrating the point I was going to make to counter what you said about absolute morality. God's commandments are absolute and unchanging, unless God decides to change his mind, which God reserves the right to do at anytime without notice or explanation. Theistic morality is directly given by God (as long as you are totally convinced that God told you so), and always absolute, except when God tells you to do the opposite, which is also absolute. In the bible every one of the commandments, which are all absolute, had exceptions. God commanded his people to kill numerous times, encouraged the Israelites to steal just before they left Egypt, and never penalized Abraham or commiting adultery. And we don't even have to talk about keeping the sabbath. So you're right, there is a fundamental difference. In your example, Joe doesn't need to rationalize why he should kill Bob, he only needs to be convinced in his mind that God told him to kill Bob. And that's why theistic morality is far superior to atheistic morality, because obeying God's orders (that you tell yourself is God's orders) is much better than using your own reasoning. I don't say we won't act as animals. We do. We act as highly socialized animals instinctively motivated by survival and reproduction. And we pursue these motivations by very complex methods. Part of the method is the establishment of legal, judicial and government systems. And yes, its complcated, slow, and basically imperfect. Maybe you're not aware of this, but religion is also one of the systems established to attempt to control our natural behavior. It is an ancient version of our legal, judicial and government system, and in some places is still followed. Its simpler, quite inaccurate, and basically imperfect as well. If you think that your system of behavioral control is superior to mine, I'd like to know why.","there-point-evolution","09:47 AM","creation-intelligent-design-vs-evolution","24"
"09-07-2010","14586",2,"Freedom","411723","They are fundamentally different, theistic morality is absolute. atheistic morality (as you mean it) is not absolute, it has exceptions because as long as morality is a means to an end it is only valid so long as a person believes a specific case will lead to that end. If Joe thinks that his creator and ruler of heaven and earth commands him not to kill bob, there is no circumstance nor case nor argument he could make to himself to defy that. If Joe thinks that the general gene frequencies of his species typically benefit from cooperation he will not kill bob so long as he doesn't convince himself bob is no longer beneficial to the race provided he even cares about the race. and those who truly believe this will act as animals. You say they will not and point to the fact that they do not but I say that is only because we yet have laws that recognize no exception except the slow process of democratic change. You couldn't argue the sky was blue if you were deprived of your meaningless diatribes could you?","trebor","411750","The only difference is that the theistic morality is CLAIMED to be absolute. Yet, there is so very little agreement about what that absolute is. There is so much variation among the people who claim morality is an absolute, the only conclusion is that the theist is projecting their own concepts on to God, rather than admitting it is relative to them. Considering the actions of the theistic promoters when it comes to Islam verses fundy, I would say those who deny it act more like ""animals"" than the atheist. You certainly aren't getting my point. Perhaps you have some blindness you have to overcome yourself to seem my point.","there-point-evolution","01:42 PM","creation-intelligent-design-vs-evolution","25"
"09-07-2010","14586",2,"None","None","None","Accipiter","411751","The Crusades, the Spanish inquisition, burning heretics at the stake, etc Theistic morality is immoral and that's the only absolute thing about it.","there-point-evolution","03:22 PM","creation-intelligent-design-vs-evolution","26"
